,url,poster,title,ganres,description,year,rating,cast
120,https://kino.mail.ru/series_915442_korolevskaya_akademiya/,https://resizer.mail.ru/p/e1362610-274d-5ce8-8529-341c610abf45/AAACphw_uqLZPU4GsVxwGAZlzV-9jaGnpP1w-yIvzqHVmKUtun9yzsiHvNrurwsCQOxFOOtLhnKKgBRTJGgW7rbtfnk.jpg,Королевская академия,"['приключения', 'для детей', 'мультсериалы']","Главная героиня мультфильма — милая девочка Роуз. Она очень любит шоппинг, поэтому может часами бродить по городу в поисках новых туфель и платьев. Однажды Роуз нашла интересный магазинчик, в котором она встретила мышонка с золотым ключиком в зубах. Ключ попал к ней в руки, но что с ним делать — оставалось загадкой, пока на улице она не наткнулась на парня с таким же ключом. Проследив за юношей, Роуз узнала, что золотой ключ открывает потайную дверь в стене, за которой скрывается секретный проход в мир сказок.","['2016', '—', 'по']",,"['Элисон Ли Розенфельд, Бриттни Ли Хэмилтон, Пьерлуиджи Астор, Эмануэла Барони, Орора Кансиан, Алессандра Кассиоли, Кьяра Франсиз, Джанни Джулиано, Эмануэла Ионика, Алекс Полидори, Элеонора Рети, Эрика Шредер', 'Италия', '0 +']"
121,https://kino.mail.ru/series_925931_krasavitsa_i_vori/,https://resizer.mail.ru/p/2b542bb4-8ab5-54da-baf5-62a089b665c1/AAACVIX3Zt0yer66hLIFF8SyovOyqd_3X9fVZEAeRiybjymCJX4C_0jXiQ14QR3qyHkQninI1dSwj_810sHVzdVZuk0.jpg,Красавица и воры,"['мелодрама', 'детектив']","Следователь прокуратуры Валерия отметила тридцатипятилетие и готовится получить очередное звание. Однако вместо повышения ее временно отстраняют от работы из-за пропажи незначительного дела, которое она вела. Валерия подавлена, и лучшая подруга Ася решает отправить ее в косметический салон. Там следователь узнает о таинственном обольстителе, похищающем не только драгоценности доверчивых дам, но и важные документы их мужчин. Она решает изловить преступника и с победой вернуться на службу.","['2020', '(Сериал', 'закончился)']",6.7,"['Светлана Антонова, Максим Щеголев, Анастасия Панина, Анатолий Лобоцкий, Максим Коновалов, Михаил Дорожкин, Ирина Баринова, Вахтанг Беридзе, Елена Муравьева, Александр Красовский', 'Россия', '16 +']"
122,https://kino.mail.ru/series_934864_late_night_school/,https://resizer.mail.ru/p/8377a3af-a924-51b9-9515-66c127af3711/AQACZs_ua8vTPStiOYLsaI6-vVo9YN3qQPbdaMgRleiIC9htzd4AOCI-0sywG1q8Nk_Y4jy_8XNj_vPG9XR66IxWe10.jpg,Лэйт Найт Скул,"['драма', 'комедия']","Группа старшеклассников снимает в школьном спортзале скандальное ток-шоу Late Night School, в котором подростки обсуждают самые острые и актуальные проблемы: секс, буллинг, отношения с родителями и учителями и многое другое. Шоу выходит в сети и с каждым выпуском набирает все больше просмотров. Опьяненные успехом, создатели добавляют в проект все больше хайпа и все чаще переходят границы разумного. Они становятся кумирами молодежи, но вместе с тем приобретают реальные проблемы: за неосторожные действия и высказывания в эфире им грозит отчисление из школы и даже уголовное дело. Столкнувшись с серьезными последствиями бездумной гонки за лайками, подростки осознают, что настоящая жизнь дороже популярности в соцсетях.","['2022', '(Сериал', 'закончился)']",4.5,"['Алексей Лукин, Мария Миронова, Артем Ткаченко, Сергей Бондарчук-мл., Анна Александрова, Павел Табаков, Иванка Осина-Фридман, Егор Мухин, Никита Плахотнюк, Алиса Тарасенко, Юрий Шелковников, Елизавета Мордашова, Иван Чернов', 'Россия', '18 +']"
123,https://kino.mail.ru/series_783848_messiya/,https://resizer.mail.ru/p/2bf8cf0e-320c-5df4-8884-1b9fb16b5ae1/AAACUxSjuf_yRCKXkXaYUkX0uEG7uTpR76npZ3cjcx3r6QODSYsmPseysJu23bsxtEqhsC1xI3Lscz57JuQP83VTxZs.jpg,Мессия,"['драма', 'криминал', 'триллер', 'детектив']","В центре сюжете сериала «Мессия» — серия жестоких убийств. Лондонский детектив Рэд Меткалф вместе со своей командой расследует цепь странных преступлений. Серийный убийца отрезает языки своих жертв, оставляя на их месте серебряные ложки. Вскоре Рэд понимает, что имена всех убитых поразительно похожи на имена двенадцати учеников Иисуса. Пытаясь предотвратить дальнейшие убийства, Меткалф просчитывает последующие ходы фанатика. Но коварный убийца всегда оказывается на шаг впереди, как будто получает «информацию» о действиях полиции из первых рук.","['2001', '(Сериал', 'закончился)']",,"['Кен Стотт, Фрэнсис Грей, Джэми Дрэйвен, Киран О’Брайэн, Нил Даджон, Мишель Форбс, Арт Малик, Эдвард Вудворд, Колин Гурли', 'США, Великобритания', '16 +']"
124,https://kino.mail.ru/series_919488_missis_fletcher/,https://resizer.mail.ru/p/046065c4-984e-5108-92e4-c82cfa3b8693/AAACZ50N7StntxMVakDykPoQ-Wd_WmW0Ux8NYqHqKUmCK6dM0RE8od07fT7tfPWTOjmn_S1nYgE2VZeZF3rD1j6jyP0.jpg,Миссис Флетчер,['комедия'],"Миссис Флетчер — разведенная и еще довольно привлекательная женщина среднего возраста. Она только что отправила взрослого сына в колледж и обнаружила, что дом ее совершенно опустел. Героиня расценивает этот момент как долгожданную свободу, примеряет образ секс-бомбы и открывает для себя совершенно новый мир эротических фантазий.
«Миссис Флетчер» — это экранизация одноименного романа американского писателя Тома Перроты, принимавшего непосредственное участие в написании сценария сериала.","['2019', '(Сериал', 'закончился)']",,"['Кэтрин Хан, Жасмин Сепас Джонс, Дэнни Марин, Джен Ричардс, Оуэн Тиг, Джексон Уайт, Кейси Уилсон', 'США', '18 +']"
125,https://kino.mail.ru/series_924928_moskovskie_taini_libereya/,https://resizer.mail.ru/p/d9ecc64a-786c-5ee5-85cc-3d946ed7f039/AAAC5o3lq2-dRTiMXLKwJ_iKlC5AfLGf3nY4Z7TegRL5S75lB5Z4RXsOboDneLmv5CLEOFC43NiQqwTPCgB9Mt9mTyE.jpg,Московские тайны. Либерея,['детектив'],"Настя Вяземская расследует странную смерть охранника антикварного магазина на Никольской улице. В руке у погибшего была обнаружена древняя рукопись на греческом языке. Нити расследования ведут к Либереи — утерянной библиотеке Ивана Грозного. Пока Настя выясняла подробности случившегося, рукопись украли неизвестные. Кто-то явно охотится за сокровищами Либереи. И эти люди готовы на все, чтобы добраться до них первыми.
«Московские тайны. Либерея» — детектив из цикла «Московские тайны», события которого разворачиваются на старых улицах Москвы.","['2019', '(Сериал', 'закончился)']",,"['Евгений Пронин, Александра Богданова, Иван Жвакин, Александр Робак, Владислав Ветров, Екатерина Семенова, Алексей Лонгин', 'Россия', '16 +']"
126,https://kino.mail.ru/series_790736_moya_prekrasnaya_tolstushka/,https://resizer.mail.ru/p/e9adfd49-3e74-5b30-b8c3-e32d900f579e/AAACVYXO7VboF-eYYIDHdHvY5uiOynGtlFzG8jZCe0-LjHa0hyPS2XwTmrMyGjxEtmHOWozmbGfjFf7dYffJK_4avCM.jpg,Моя прекрасная толстушка,"['драма', 'мелодрама']","Умная и добрая девушка по имени Валентина Виллануэва Ланс отличается пышными формами. Она недавно окончила учебу и ждет встречи с певицей Эвой Ланс — ее матерью. Когда Валентине исполнилось восемь лет, тетя Олимпия отправила в интернат, чтобы девочка не попала под плохое влияние матери, которая после смерти мужа начала сильно пить. После встречи с дочерью Эва попадает в аварию и погибает. Дядя Валентины по имени Хуан Анхель отвозит девушку в особняк семьи. Коварная Олимпия сделает жизнь Валентины невыносимой. Девушке предстоит пережить множество унижений со стороны обитателей дома. Однако тут же она найдет и свое счастье. Кузен Орестес станет для нее лучшим советником и другом и будет ласково называть ее «моя прекрасная толстушка».","['2002', '—', '2003']",,"['Деннис Веласко, Наталия Стрейгнард, Хуан Пабло Раба, Хильда Абрахамс, Норкис Батиста, Пракрити Мадуро, Даниэль Альварадо, Эмма Раббе, Эйлин Селеста', 'Венесуэла', '20 ноября 2002 (Мир)']"
127,https://kino.mail.ru/series_920465_neveroyatnoe/,https://resizer.mail.ru/p/09136cb9-7151-5ac4-adc7-582a5bda7f17/AAACZQVBoEfSrfr8SQ4DoFj-QxsaCdZZJUEJm_wXg2O275RSLQipymFzMh5XWSqSaMR-WusjuC5hKVGi8CWjx5ZuutU.jpg,Невероятное,"['драма', 'детектив']","В центре сюжета — история девушки-подростка Мари, чьи заявления о том, что она была изнасилована, признаны ложными. Две женщины-детектива берутся расследовать это дело, подозревая, что речь может идти о серийном насильнике.
В основу сериала легла статья An Unbelievable Story of Rape авторов Т. Кристиана Миллера и Кена Армстронга и эпизод Anatomy of Doubt еженедельной радиопрограммы This American Life.","['2019', '(Сериал', 'закончился)']",8.0,"['Тони Коллетт, Мерритт Уивер, Кейтлин Дивер, Фрэнк Герриш, Ванесса Белл Кэллоуэй, Дейл Дикки, Джон Хартманн, Остин Хеберт, Лиза Лапира, Кай Леннокс, Даниэль МакДональд, Элизабет Марвел, Омар Маскати', 'США', '16 +']"
128,https://kino.mail.ru/series_926792_ni_shagu_nazad/,https://resizer.mail.ru/p/9f334a14-ab47-51ea-b366-8f8b7cdafe71/AAACm4SU_uV-cUAvlgQ6KiTdmJxRXmKcE3qAFZsp5bYqqWvuyhslPyFuFmdhf-3I0prR_J5QQhgu5Hq-xKc40QjbZcU.jpg,Ни шагу назад!,"['драма', 'военный']","Наивная деревенская девочка Тоша Лыткина любила всех людей вокруг. Но в первые дни войны на фронте убили ее отца, а мать, младший брат да и все остальные жители деревни погибли во время вражеского налета. Тоша чудом уцелела и решила пойти на войну, чтобы уничтожить ненавистного ей Гитлера и отомстить за семью. Пытаясь доказать, что она достойна выступить на фронт, Тоша делала невозможное. Она прыгала из самолета без парашюта, ее ранили, расстреливали и травили ядом, но каждый раз она выживала и продолжала совершать героические подвиги в тылу врага. Тоша вела свою собственную войну с немцами и со смертью и именно на этой войне нашла настоящую любовь.","['2019', '—', '2020']",,"['Валентина Попова, Гела Месхи, Мария Шукшина, Федор Гуринец, Анастасия Зюркалова, Тамара Миронова, Алена Медведева, Марина Поддубная, Светлана Косолапова, Инна Коляда', 'Украина', '16 +']"
129,https://kino.mail.ru/series_924705_obvinyaemii/,https://resizer.mail.ru/p/e0740611-0614-5314-9072-622029a84ab0/AAAC5oaOW2LEKXcLeLCnYafbY6jkEJMcgDWyUzQmZcKKmbRna5c3VmQzCxtNFzDpM1_Pe95L5HQ5_WT41tGnEUndDfI.jpg,Обвиняемый,"['триллер', 'детектив']","Шесть лет назад Йон Аристеги стал подозреваемым в убийстве своей возлюбленной Анне, которая бесследно пропала. Тело девушки так и не нашли, дело не было раскрыто, с Йона сняли все обвинения, а сам он уехал в Париж. Семейные обстоятельства заставляют героя вернуться в родной городок, где он вновь сталкивается с призраками прошлого: местными жителями и членами семьи Анне, которые до сих пор считают, что Йон убил Анне за то, что она знала его самые сокровенные тайны.","['2018', '(Сериал', 'закончился)']",,"['Мигель Анхель Муньос, Суси Санчес, Эльвира Мингес, Хосеан Бенгоэчеа, Томас дел Эстал, Ицияр Атьенца, Алехандра Ониэва, Тереса Уртадо де Ори, Ирена Монтала, Иньяки Фонт', 'Испания', '18 сентября 2018 (Мир)']"
130,https://kino.mail.ru/series_847224_obmani_esli_lyubish/,https://resizer.mail.ru/p/4d7a73d6-b6a8-5524-8b32-919f8a5fb16e/AAACOL5DC5jslxUk9cQWYg6dxzqcHRNHcIdbmi5XFskVG35Vf3V0mFxf9IGiH6ZUzXsMO7KHcTS_Vk0FlH0nkQ4qw5I.jpg,"Обмани, если любишь","['мелодрама', 'комедия']","Михаил Воробьев (Сергей Чирков) любит вечеринки и веселье. Одно из таких развлекательных мероприятий в офисе закончилось пожаром. Но молодого человека не уволили, а даже повысили: шеф поручил ему перевоспитание своего сына Сергея Королева (Никита Смольянинов). Михаил должен превратить стеснительного студента в любимца женщин и душу компании. Сергей оказывается способным учеником и вскоре становится соперником Михаила в борьбе за сердце красавицы Марины (Юлия Хлынина)...
Сериал «Обмани, если любишь» снят по мотивам романа Андрея Геласимова «Год обмана».","['2013', '(Сериал', 'закончился)']",7.5,"['Сергей Чирков, Юлия Хлынина, Никита Смольянинов, Игорь Миркурбанов, Юлия Рутберг, Марина Зудина, Александр Орав, Алика Смехова, Виталия Корниенко, Татьяна Демидова', 'Россия', '16 +']"
131,https://kino.mail.ru/series_870973_odin_edinstvennii_i_navsegda/,https://resizer.mail.ru/p/04365d9b-912a-5ec6-8cf8-a385479beae9/AAACfwKl3iTn6p_V3M8IHs4X45RiSN9C4QiI20je0xgDpwGU0UqBYbq7hVPpqVJPOr6gNIjekfUT6FiPBnKxbo2qaE8.jpg,Один единственный и навсегда,['мелодрама'],"Однажды Наталья слышит по радио врача московской клиники и... влюбляется в его голос. Вместе с подругой Ольгой она приезжает в столицу, чтобы встретиться с Алексеем.
В Москве с героинями сериала «Один единственный и навсегда» происходит несчастный случай: спасая подругу, Наталья попадает под машину и получает серьезные травмы. Так она оказывается в больнице, где работает Алексей. Однако он обращает внимание не на влюбленную в него Наташу, а на красавицу Ольгу. И что такое чувства подруги и женская дружба по сравнению с перспективой остаться в Москве? Конечно, Оля закручивает с симпатичным доктором бурный роман. А в это время в Наталью влюбляется виновник аварии Игорь.","['2011', '(Сериал', 'закончился)']",,"['Юлия Кадушкевич, Полина Сыркина, Андрей Фролов, Михаил Евланов, Владимир Иванов, Александр Павлов, Михаил Каминский, Марина Денисова, Анна Кисель, Алена Козырева', 'Россия', '16 +']"
132,https://kino.mail.ru/series_781065_ohotniki_na_monstrov/,https://resizer.mail.ru/p/edf8a0b2-82a3-51c5-a487-15e5b6b7f156/AQACpus1awbNNkFJFZovxVGAaU7I1wbplQWTfcqh5IOc6aLDeDXtOi6TM22zlXmI01WZJY_P-JDIEQCwyrLSWkmbq0s.jpg,Охотники на монстров,"['документальный', 'исторический', 'детектив']","Американский документальный сериал «Охотники на монстров» посвящен поискам загадочных и пугающих существ. Профессиональные искатели странных созданий исследуют различные уголки нашей планеты. Доказательством существования монстров может стать любая деталь. Команда охотников всегда готова отправиться в путешествие. Используя новейшее высокотехнологичное оборудование, эксперты с особой тщательностью изучают любые доступные улики, будь то частицы костей, или фото и видео-свидетельства, общаются с очевидцами, и со всех сторон обнажают пугающую легенду, покрытую завесой тайны.","['2007', '—', '2010']",,"['Стэн Бернард, Дэйл Пирсон, Джеффри Мелдрам, Тони Герард, Лорен Коулмэн, Линн Роджерс', 'США', '12 +']"
133,https://kino.mail.ru/series_918010_plohaya_doch/,https://resizer.mail.ru/p/5e8d2a3b-3cb1-59de-affb-04e41d2fa6ae/AAACWQvxFOKnWqR1uAsfEp5uQymAcgSiCGAlDrQ5W_dpbm3kcJg5l4adAj0hpDegCi83zVPtk-45dvFt0ODeI0lYZqk.jpg,Плохая дочь,['мелодрама'],"Главная героиня сериала «Плохая дочь» — студентка медицинского института Сашенька, будущий хирург и очень добрая и отзывчивая девушка. Она уже распланировала свою жизнь на годы вперед — окончит институт, выйдет замуж за своего возлюбленного Андрея, найдет хорошую работу... Но известие о смерти тетки, у которой сиротами остались трое детей, меняет все планы. Саша не раздумывая отказывается от своей мечты и едет в деревню, чтобы помочь родственникам. Именно там она обретет новую семью и настоящую любовь.","['2017', '(Сериал', 'закончился)']",7.1,"['Дана Абызова, Вячеслав Дробинков, Наталия Курдюбова, Егор Баринов, Вячеслав Чепурченко, Юлия Подозерова, Женя Хомжукова, Валентина Светлова, Марина Карабанова, Елизавета Кочеткова', 'Россия', '12 +']"
134,https://kino.mail.ru/series_816911_pod_pritselom/,https://resizer.mail.ru/p/4de2494c-9280-5992-a7be-c217538a500f/AAACPD_0QJiNynhd21Ymp19T-grbY8M4E3QraV23fdQIpreqIJG8AaGlhidTv_1iv6kp2DZZnvhx-v2kos65uZZamys.jpg,Под прицелом,['детектив'],"Эксперимент, который решили провести в одном из отделений полиции в целях улучшения качества работы, серьезно повлиял на трудовые будни сотрудников. Теперь им придется проводить расследования, собирать улики, допрашивать подозреваемых и проводить аресты «под прицелом», то есть под постоянным наблюдением видеокамер. В кабинетах за следователями будут следить стационарные камеры, на выездах — камеры с операторами. В первые же дни эксперимента оказалось, что работать в полиции очень вежливо и без рукоприкладства весьма непросто.
В центре сюжета сериала — шесть персонажей. У каждого из них есть своя личная история, которая не должна помешать оперативной деятельности под прицелом видеокамер.","['2014', '(Сериал', 'закончился)']",,"['Нина Гогаева, Роман Курцын, Андрей Харитонов, Сергей Жарков, Дмитрий Бакунин, Валерий Новиков, Игорь Головин, Игорь Савочкин, Владимир Гусев', 'Россия', '16 +']"
