,url,poster,title,ganres,description,year,rating,cast
242,https://kino.mail.ru/series_839177_dvoe_s_pistoletami/,https://resizer.mail.ru/p/370b0d1a-0705-5a00-b97a-17dbd803355f/AQACwh2JXvxO9ckJPlG5m2h-hAwPFqEyVnM4K1F2Y-zT6ni5B2VZLRENf3ptCRtnM7jhh-4JFAatlD0Li5wH8VJ4n08.jpg,Двое с пистолетами,"['боевик', 'детектив']","Действие сериала «Двое с пистолетами» начинается с того, что в районный отдел полиции приходит новый сотрудник — своенравный Вадим Воронов. На первом же задании он вступает в конфликт с непосредственным начальником — подполковником Николаем Дугиным. Им приходится работать вместе, несмотря на разные характеры и методы расследования. Консервативный Дугин и дерзкий Воронов идеально дополняют друг друга и вместе раскроют немало преступлений: внезапную смерть криминального журналиста, таинственное убийство примы оперного театра на сцене, несправедливое увольнение следователя из училища МВД...","['2014', '(Сериал', 'закончился)']",,"['Сергей Векслер, Роман Полянский, Ксения Роменкова, Артур Ваха, Алексей Морозов, Игорь Ключников, Кира Кауфман, Ольга Никольская', 'Россия', '16 +']"
243,https://kino.mail.ru/series_918831_devochka_volshebnitsa_madoka/,https://resizer.mail.ru/p/3806d2f9-4e17-50b8-a828-6f5ea4ef2d4a/AAACkiGRTUg2Qoao_GjLRdDadXikqUKX3EE5vCk9uxgVpuV7-EIH5t1awn0dVwG-gkZg7XlGjYPKWlaDRO6vvQh8a2M.jpg,Девочка-волшебница Мадока,"['драма', 'фэнтези', 'триллер', 'приключения', 'детектив', 'аниме', 'мультсериалы']","14-летняя Мадока Канамэ живет в самом обычном доме с мамой, папой-домохозяином и маленьким братом. Однажды ночью ей снится темноволосая воительница, сражающаяся с силами зла в каком-то странном мире. Наутро Мадока встречает эту девочку в школе, а вскоре в ее жизни появляется удивительный зверек — магическое существо по имени Кюбей. Он предлагает исполнить любое желание Мадоки, если та станет волшебницей и вступит в битву с гротескными ведьмами. Хомура — новая темноволосая знакомая Мадоки — всеми силами пытается разорвать это соглашение и показать природу происхождения Кюбей.","['2011', '(Сериал', 'закончился)']",,"['Аои Юки, Сайто Тива, Като Эмири, Китамура Эри, Нонака Ай, Рёко Синтани, Каори Мидзухаси, Юко Гото', 'Япония', '16 +']"
244,https://kino.mail.ru/series_758869_derzhi_menya_krepche/,https://resizer.mail.ru/p/d6d26d5b-c8ca-52ac-9d8f-5ce57b137565/AAACHrr7L5Px_k8iHy_240Q-Z0Ug3kXp3bqHKsBLeXlg6NwqOOBdMLcHkfHu7rhei0uhnp8LnsAUaSphnvfBEAaz918.jpg,Держи меня крепче,['мелодрама'],"Руководитель школы бальных танцев «Большой вальс» Марина Скворцова объявляет важную новость: приезжает Георгий Княжинский, в прошлом известный танцовщик, а нынче миллионер, проживающий во Франции. Княжинский ищет таланты для своего мега-шоу, с которым намерен отправиться в мировое турне. Фаворитка Скворцовой — Инга, дочь известного мецената Дмитрия Шахова. Марина делает все, чтобы помочь одаренной танцовщице добиться успеха. Полина Павлова танцует в массовке. Она не менее талантлива, чем Шахова, но из-за давней вражды ее мамы с наставницей Полина вынуждена забыть о своих амбициях. Никто даже представить не может, какой накал страстей вызовет приезд Княжинского.
Сериал «Держи меня крепче» снят на Украине и вышел на экраны в 2007 году.","['2007', '—', '2008']",,"['Евгения Коцюбинская, Анна Тришкина, Дмитрий Фрид, Алена Яковлева, Денис Матросов, Максим Дрозд, Виталий Егоров, Людмила Чурсина, Альбина Джанабаева', 'Украина', '16 +']"
245,https://kino.mail.ru/series_815533_katina_lyubov/,https://resizer.mail.ru/p/af1143c3-4d2a-5ab8-8988-e05523230b12/AAACqAkRfc071QeOdEsiyRfUiYJDG79blwbmhPh233--5z25wJIZ2MzwTVCZ7BZGVUeMOyF6zunOFiwFa08FJ7zEhWw.jpg,Катина любовь,['мелодрама'],"В детстве Катю предал отец, и это событие навсегда травмировало героиню. Очутившись в западне, без сил и возможности наладить жизнь, Катя научилась сопротивляться. Она всем и себе доказала, что смелость города берет, а вера и верность — самое надежное оружие. Теперь она выросла и сама начала строить свою жизнь, но травма прошлого дает о себе знать.
Мелодрама «Катина любовь» — это невероятная история преодоления. В критических ситуациях человек способен на многое, и сериал показывает это на примере простого человека, который вынужден бороться за самого себя и за своих самых близких людей.","['2012', '(Сериал', 'закончился)']",4.8,"['Ольга Павловец, Дмитрий Пчела, Юрий Цурило, Ольга Дроздова, Анна Данькова, Антон Батырев, Сергей Пиоро', 'Россия', '16 +']"
246,https://kino.mail.ru/series_927219_kipo_i_era_chudesnih_zverei/,https://resizer.mail.ru/p/213c2dc4-24ae-5637-b99e-98032cac0ffc/AAAColp4mcOLWL8yqSXgOGtDNiUwapA4AgbUUmmBKS0U5CPXoXs5xwzzOfHsbp_oLQhIx8nrShzDvmb9thQvCDGs03g.jpg,Кипо и эра чудесных зверей,"['фэнтези', 'боевик', 'приключения', 'для детей', 'семейный', 'мультсериалы', 'музыкальные']","Действие мультсериала разворачивается в постапокалиптическом мире через 200 лет после некоей катастрофы, полностью изменившей флору и фауну. Из-за высокого уровня радиации остатки человечества вынуждены жить в подземных городах, а животные мутировали. Некоторые из них приобрели разум и построили собственное общество с четко выраженной иерархией и социальными ролями. Кипо Оак — любознательная и жизнерадостная 13-летняя девочка, которая живет со своим отцом. В результате аварии в подземелье она впервые в жизни оказывается на поверхности. В компании угрюмой девочки Вольфи, веселого парня Бенсона, разумного жука Дэйва и четырехглазой и шестилапой свинки-мутанта Манду героиня изучает удивительный наземный мир и узнает много нового о себе самой. Теперь ей предстоит найти дорогу обратно в человеческую колонию и выяснить правду о своем происхождении.","['2020', '(Сериал', 'закончился)']",,"['Карен Фукухара, Сидни Микайла, Ди Брэдли Бейкер, Деон Коул, Кой Стюарт, Грэй Гриффин, Джейк Грин, Стерлинг К. Браун, Мэтт Лоу, Дэн Стивенс', 'США', '6 +']"
247,https://kino.mail.ru/series_916307_konvoi/,https://resizer.mail.ru/p/1933b4d5-4883-554b-b54e-1f33d8745766/AAACFswu05YxEln7_Z_JkzawUN7jNlnQaZBw393bBq3dke6Jipwiiw5T0Eu2sRtXcCpbePqZBs5Ox3blz8UiiM_DxHQ.jpg,Конвой,"['драма', 'детектив', 'военный']","События сериала «Конвой» развиваются в годы Великой Отечественной войны. Отряд солдат сопровождает секретный груз на аэродром. По пути красноармейцы встречают карателей, которые уничтожают мирных жителей в одной из деревень. Несмотря на приказ, запрещающий отклоняться от утвержденного маршрута, молодой боец Роман (Илья Денискин) решает вступить в схватку с врагами...","['2017', '(Сериал', 'закончился)']",,"['Илья Денискин, Михаил Хмуров, Алексей Дмитриев, Рихард Леперс, Владимир Заец, Дмитрий Сарансков, Василий Сивохоп, Евгений Подгорный, Полина Василина', 'Украина', '16 +']"
248,https://kino.mail.ru/series_826893_koroleva_yuga/,https://resizer.mail.ru/p/a1c22daa-512b-5eff-b2bf-fecf30d0113d/AAACGzx2YR-hakEk-tif2pNyby5DPIbqiN2dhucH9VaGuntDuzjfkpHNH91ZBerPl0y1foOffGF8sZafaVjNRJvBJxI.jpg,Королева юга,"['драма', 'боевик', 'криминал', 'триллер']","Тереза Мендоса счастливо жила в Мексике со своим женихом Гуэро Давилой, наркоторговцем и восходящей звездой преступного картеля. Но однажды героиня узнает, что ее возлюбленного убили. Бросив все, оставив свою прежнюю жизнь навсегда, Тереза бежит из Мексики в Испанию и там очень скоро сама оказывается вне закона. Ей предстоит пройти через тюрьму, предательства и боль потерь. Доброй и наивной девушке необходимо научиться быть расчетливой и хладнокровной владелицей многомиллионного бизнеса, построенного на крови и смертях.
Сериал «Королева юга» является экранизацией одноименного произведения Артуро Переса-Реверте. Существует версия, что роман был написан на основе биографии реальной женщины, которая сумела превратить единичные неорганизованные точки наркоторговли в настоящий синдикат, охвативший несколько стран.","['2011', '(Сериал', 'закончился)']",7.5,"['Кейт дель Кастильо, Умберто Сурита, Рафаэль Амайа, Иван Санчес, Кристина Ургель, Альберто Хименес, Джозеф Абадиа, Хуан Дэвид Агудело, Карлос Агиляр, Рубен Арсиньегас', 'США, Испания, Колумбия, Мексика', '16 +']"
249,https://kino.mail.ru/series_913821_lyubov_po_prikazu/,https://resizer.mail.ru/p/2d04f915-f2f5-5fe2-99ad-693fc0fadc9c/AAAC49DbqZ-P9m-xTR2QMDGMQEC2bs312a1noW6JGOrhvC4ptC00pBWY016G998hOlwYByJ2DEiGKeNjAvTqhsqCeBg.jpg,Любовь по приказу,['драма'],"Действие психолоической драмы начинается в 1988 году в Ленинграде. Главная героиня сериала «Любовь по приказу» артистка Варвара Утешева вполне счастлива: у нее прекрасный муж и сын, а в театре музкомедии ей доверяют ведущие роли. Но в один из дней все меняется: Варвара становится свидетельницей гибели своего супруга. А вскоре женщину вызывают в КГБ, где сообщают, что ее муж хотел выехать из страны с документами, составляющими государственную тайну...","['2018', '(Сериал', 'закончился)']",6.3,"['Полина Сыркина, Александр Мохов, Марина Куделинская, Ёла Санько, Артем Быстров, Юлия Шиферштейн', 'Россия', '16 +']"
250,https://kino.mail.ru/series_919816_messiya/,https://resizer.mail.ru/p/c481062a-04bd-53aa-97b1-6a053b572703/AAAC94nHcdjApXzeUYTAraHsbfO1SvG_qoG0v1tSJHHv6FBwukdHRuO5g_ajFjnvaCpupAVIkBUGGXvDt4UuKT3D8gI.jpg,Мессия,['драма'],"Офицер американской разведки Ева Геллер сталкивается с необычным делом: в Сирии объявляется человек по имени Аль-Масих, который объявляет себя посланником Бога и собирает армию последователей. Девушке предстоит разобраться, действительно ли он мессия или опасный самозванец, который пытается повлиять на международную геополитическую ситуацию и спровоцировать беспорядки среди населения среднеазиатских стран.","['2020', '(Сериал', 'закончился)']",7.7,"['Мишель Монахэн, Мехди Дехби, Томер Сисле, Джексон Херст, Джон Ортис, Джейн Адамс, Махди Чалхаои, Сайид Эль Алами, Мелинда Пейдж Хэмилтон, Стефания Оуэн, Майкл Е. Стогнер, Уил Трэвэл', 'США', '16 +']"
251,https://kino.mail.ru/series_911646_na_perekrestke_radosti_i_gorya/,https://resizer.mail.ru/p/09c0bae4-353b-592d-bc52-fc784a1d7254/AQACQxfUZgXhwCaxcea5dtdRrkCv4LRWgFPESP9pL1ypluiMI2-1CfYwSY5Qp5HZrar3pgTm_owOimsxc6STjlMzmOw.jpg,На перекрестке радости и горя,['мелодрама'],"Вера переезжает из Северной столицы в маленький провинциальный городок, где устраивается преподавателем литературы в местную школу. В первый же рабочий день у нее возникает конфликт с ученицей Дашей, после которого девочка перестает посещать уроки литературы. Вера вызывает отца Даши, Евгения, в школу, однако их встреча только усугубляет разлад: мужчина во всем обвиняет Веру.
Вне работы Вера, скрывающая, что ее муж Степан сидит в тюрьме, общается только со своей однокурсницей Зоей. Героиня сериала «На перекрестке радости и горя» старается отгородиться от всего мира, но, когда жизнь ее сталкивает с проблемами Даши и ее двоюродной сестры Насти, оставшейся после смерти родителей на попечении Евгения, Вера решает помочь девочкам. Внезапно в город приезжает Степан.","['2016', '(Сериал', 'закончился)']",,"['Марина Коняшкина, Кирилл Кяро, Иван Кокорин, Яна Крайнова, Ксения Щербакова, Анастасия Калашникова, Сергей Беляев, Дмитрий Мазуров, Богдан Щукин, Анна Антонова', 'Россия', '12 +']"
252,https://kino.mail.ru/series_858580_nasledie/,https://resizer.mail.ru/p/6cac0754-ce4c-57cb-bef1-1d84ce3be7ff/AQAC-nE9ZL3gGTCQvkHLC0y67UWtwsXN05yhYPWivD0gI7A9T8qFNje6zzmbvKpwnyDpejdnAMf-rCMr6j3_o-dtW3k.jpg,Наследие,['драма'],"Известие о смерти известной художницы Вероники Гроннегард вновь собирает вместе ее четверых детей на живописном датском острове Фюн. Родственникам необходимо решить вопрос о разделе имущества, и вскоре выясняется, что родовое поместье Вероника завещала своей дочери Сигне, которую она в свое время отдала на воспитание в другую семью. Эта новость становится началом путешествия в мир секретов и лжи, которое переворачивает жизни героев сериала «Наследие» с ног на голову. Разделенные годами и расстояниями, братья и сестры узнают много нового о себе и друг друге.","['2014', '—', '2017']",,"['Трине Дюрхольм, Еспер Кристенсен, Мария Бах Хансен, Карстен Бьорнлунн, Миккель Боэ Фёльсгор, Лене Мария Кристенсен, Тронд Эспен Сейм, Йенс Йорн Споттаг, Кеннет М. Кристенсен, Виктор Столтенберг Нилсен', 'Дания', '18 +']"
253,https://kino.mail.ru/series_899504_the_oa/,https://resizer.mail.ru/p/7b22fe18-de21-5852-b49e-3a3664f7b8d3/AAACPOWGttTskJ0hXsEdeddLNFC2g9fQ3X-CWwPFRQhANF1SEWg6oT2GqrWspAmVCN_MlnZU2GtJp_cNqgDECfj9wbo.jpg,ОА,"['драма', 'триллер', 'мистика']","Девушка по имени Прэйри Джонсон возвращается в родной городок спустя семь лет после своего загадочного исчезновения. Соседи и знакомые считают это чудом — Прэйри была слепой, а вернулась с полностью восстановившимся зрением. Страсти вокруг внезапного возвращения дочери Джонсонов подогреваются тем, что она наотрез отказывается рассказывать родителям и ФБР о том, что с ней случилось.","['2016', '—', '2019']",7.1,"['Брит Марлинг, Эмори Коэн, Джейсон Айзекс, Патрик Гибсон, Скотт Уилсон, Уилл Брилл, Зоя Тодоровская, Саша Фролова', 'США', '16 декабря 2016 (Мир)']"
254,https://kino.mail.ru/series_938737_obedaite_s_lyubovyu/,https://resizer.mail.ru/p/7d219b12-1d64-5bb9-bf55-1f25b6da246b/AQACcwdxn2Bbs4Kl-_722aDN70HNyekYUb-L5M0TQOGHaF5JtKmuX3BD5fRfp4fv96mgRdHHuXSoDNK75FEqvDcYk9g.png,Обедайте с любовью,['мелодрама'],"Властный и надменный директор компании по продаже свежих продуктов для продвижения бренда вынужден принять участие в кулинарном шоу. Готовить Ю Хао не умеет и не любит, а чтобы не тратить времени, снимается вместе с дублером. Однако его хитрость скоро становится известной, и занятой босс начинает учиться готовить по-настоящему. А помогает ему в этом новая сотрудница, отвечающая за рекламу, милая и обаятельная Су Кэ Лань. Постепенно ледяной начальник оттаивает и оказывается хорошим, но ранимым парнем с доброй душой.","['2022', '(Сериал', 'закончился)']",,"['Гао Ханьюй, Чжэн Цюхун, Хэ Лэй, Ван Пэйхань, Лу Лу, Жэнь Цзе, Дай Тин Жуй, Ву Цянь Синь, Ян Хуан Инь, Ван Янь Чжи', 'Китай', '18 +']"
255,https://kino.mail.ru/series_922362_otpusk_za_period_sluzhbi/,https://resizer.mail.ru/p/58334e51-988c-5b72-add5-5b9c5d911845/AAACOESdKepaUOlbjExS5UVZ-TqAkC1lqIjkjyHtKd4jGSjRKwfY0rUJxE5EoEG2yw2d0SkH6CEZoq9EEKbAcL6Y57Q.jpg,Отпуск за период службы,"['боевик', 'криминал']","Сержант-контрактник Игорь Беликов берет отпуск, чтобы навестить больного отца. По дороге он становится невольным участником разборок криминальных структур. Обороняясь, Игорь убивает нескольких бандитов и угоняет фургон, в котором находится ценный груз. За героем сериала начинается «охота», в которую включается и полиция. Выясняется, что отец Игоря вовсе не болен. Тогда что же заставило мужчину взять отпуск и куда он направляется?","['2019', '(Сериал', 'закончился)']",,"['Игорь Новоселов, Кристина Борейко, Оксана Чивелева, Александр Фисенко, Павел Харланчук, Марина Волкова, Александр Ефремов', 'Россия', '1 мая 2019 (РФ)']"
256,https://kino.mail.ru/series_814466_ottsovskii_instinkt/,https://resizer.mail.ru/p/f36cc9ba-0f8b-5efb-b137-35157947ce85/AAACvv1Nkfx5kwJe2G6DnZUkyE9IvjF2iZ520FaM9Ga_cpQ-sFjSm-1FbRGavyaRCORC406SIrwNLXyEz9Busx8gcj8.jpg,Отцовский инстинкт,"['драма', 'мелодрама']","Главный герой сериала «Отцовский инстинкт» Андрей Перевалов, работник ЖЭКа, очень любит свою жену Веру и с нетерпением ждет рождения малыша. Их молодая семья живет счастливо, беременность проходит нормально, отношения между супругами замечательные. Но однажды все меняется. Вера попадает в автомобильную аварию. Водитель погибает на месте, женщину в тяжелом состоянии доставляют в роддом, где врачам удается спасти лишь малыша. При этом все считают, что в аварии погиб и отец ребенка — водителя машины принимают за Андрея. А в больнице во время родов погибает ребенок наркоманки. Медсестра надевает его бирку на ручку сыну Переваловых...","['2012', '(Сериал', 'закончился)']",,"['Ирина Савицкова, Илья Шакунов, Геннадий Смирнов, Елена Кондулайнен, Леся Самаева, Олеся Жураковская, Дмитрий Суржиков, Нина Антонова, Игорь Рубашкин, Маркиян Захарченко', 'Украина', '12 +']"
