,url,poster,title,ganres,description,year,rating,cast
364,https://kino.mail.ru/series_916424_amerikanskii_vandal/,https://resizer.mail.ru/p/48057a97-95b1-53dc-8e3b-90ffd99c58c7/AAACREEvnqJmXgj-jDdbcdSpFRdl2STt_B6UUVojtlnKL3zHvMBC4gbHSQg1E4qVWJX19QK-ZIviC_gG_3zDPu44_-0.jpg,Американский вандал,['комедия'],"Школьник Питер Мальданальдо проводит собственное расследование инцидента, произошедшего на парковке школы, в результате которого двадцать семь автомобилей были разрисованы фаллическими символами. Руководство школы обвинило во всем проблемного старшеклассника Дилана Максуэлла, известного своей любовью изображать фаллосы. Однако Дилан все отрицает и заявляет о своей полной невиновности. В проекте представлены интервью с учителями и учащимися, а также шокирующие кадры с места преступления.
Мокьюментари-сериал «Американский вандал» пародирует популярный жанр документального детектива, знакомый зрителям по сериалам «Тайны миллиардера», «Создавая убийцу», «О. Дж.: Сделано в Америке», «Хранители» и многим другим.","['2017', '—', '2018']",,"['Тайлер Альварес, Джимми Татро, Эдуардо Франко, Габриэла Фрескес, Камилль Хайд, Карлос Луна, Джессика Хуарес, Лукас Гейдж, Женевьев Ханнелиус, Карли Ротенберг', 'США', '16 +']"
365,https://kino.mail.ru/series_788241_bakuman/,https://resizer.mail.ru/p/00066522-a637-5b54-a4ce-348ed6e2d86c/AAACGmREua4O8bykt2ZHFtFALrh4_tq4axvJt0_3W0Jp-NaNrmPE6YPm9Uphew-1FWZvReWCsjaxajyy4U-dv6zN6uE.jpg,Бакуман,"['аниме', 'мультсериалы']","Хорошие школьные оценки — престижный вуз — крупная корпорация: вот жизненный план большинства японских юношей и девушек. Но в каждом поколении находятся упрямцы, готовые сохранить индивидуальность и заняться любимым делом. Таковы юный художник Моритака Масиро и начинающий писатель Акито Такаги, которые пока оканчивают среднюю школу, но уже приняли непростое решение — посвятить жизнь созданию манги, уникального феномена японской культуры.
Герои сериала — фанаты манги, лауреаты юношеских конкурсов и знакомы с реалиями «взрослого» шоу-бизнеса, где наверх пробиваются единицы. Но когда еще рисковать, как не в 16 лет?! А тут Моритака, склонный к рефлексии, внезапно узнает, что его любимая и одноклассница, Михо Адзуки, хочет быть актрисой-сэйю, то есть работать по «смежной специальности». Будучи во власти эйфории, парень тут же предлагает девушке две вещи: сыграть когда-нибудь в аниме по их манге и… выйти за него замуж. Самое интересное, что Адзуки соглашается на то и другое — но в этой же строгой последовательности. Теперь творческому дуэту придется поставить на карту все — тяжкий труд, талант, потенциальную карьеру — и крепко верить в себя и свою удачу.","['2010', '—', '2013']",7.7,"['Крис Ниоси, Ацуси Абе, Айуми Фуджимура, Саори Хаями, Сатоси Хино, Кенью Хориути, Синдзи Кавада, Аяко Кавасуми, Хирофуми Нодзима, Кенджи Хамада', 'Япония', '12 +']"
366,https://kino.mail.ru/series_935096_beskonechnaya_noch/,https://resizer.mail.ru/p/6d617977-9be8-5313-b2be-ff9717747cea/AQACft71awVgB68BDzU50hvsQjiYt60DWkAyuuSkjOUec0aosCDmM9ZpI_Dj_5Xo1v7RyrhrKmhHwkr4jjWiJbhZZ0I.jpg,Бесконечная ночь,"['фэнтези', 'триллер']","Семнадцатилетняя Ева заводит дружбу с компанией молодых людей, которые с помощью специального препарата легко мигрируют между реальностью и собственными иллюзиями. Поначалу Еву такие путешествия увлекают, но со временем они становятся опаснее, ведь сны наяву превращаются в кошмары, а грань между жизнью и видениями истончается.","['2022', '(Сериал', 'закончился)']",,"['Салиф Сиссе, Аюми Ру, Томас Латур, Шина Тибо, Ханане Эль Юсфи', 'Бельгия', '18 +']"
367,https://kino.mail.ru/series_897846_briklberri/,https://resizer.mail.ru/p/521ee5bb-4586-584f-8f5b-ebb03c9a15bf/AAACKYFmpWXJq9_DJMh3QrbLZD8X2hWL3Vu5wEbnZNVV5OsfR2nAsh0z2aHKVEG4-kObZoUFAOZeh6EdYdxx-hgdA30.jpg,Бриклберри,"['комедия', 'мультсериалы']","Действие мультипликационного сериала развивается в живописном месте — национальном заповеднике. Именно здесь трудятся смелые рейнджеры, которым поручена благородная миссия — защищать обитателей национального парка. Все они довольны своей работой: самоуверенный и недалекий Стив Уильямс с детства мечтал охранять Бриклберри, Вуди Джонсон добивался своей должности три десятка лет, а афроамериканец Дензел Джексон просто счастлив от того, что находится на государственной службе. Но судьба приготовила для героев неприятный сюрприз — заповедник хотят закрыть... Сериал «Бриклберри» не рекомендован для семейного и детского просмотра.","['2012', '—', '2015']",7.3,"['Дэниэл Тош, Роджер Блэк, Дэвид Херман, Том Кенни, Вако О’Гуин, Джерри Майнор, Наташа Леджеро, Кэйтлин Олсон, Джон Ди Маджио', 'США', '16 +']"
368,https://kino.mail.ru/series_912095_bull/,https://resizer.mail.ru/p/f75452ad-6f3e-53d0-b342-cc4b4c6028f0/AAACAELc2Iv4_8VlgM6iqbpV1-Uext4iA9FYYk9aqFQ6NkYNhlVTO_xNGSp-FVNCGonA9Q9yWfEADABij40wd_lgdf8.jpg,Булл,['драма'],"Доктор Булл — блестящий, дерзкий и очаровательный манипулятор. Благодаря обширным знаниям в психологии и непревзойденной интуиции он точно знает, как повлиять на присяжных, адвокатов, свидетелей и обвиняемых. Вместе со своей командой он работает над подготовкой самых сложных судебных процессов.
Сюжет сериала основан на раннем периоде становления карьеры доктора Филлипа С. МакГроу, основателя одной из самых успешных фирм, которая оказывает психологические консультации адвокатам и юристам при подготовке и проведении судебных процессов.","['2016', '—', '2022']",7.4,"['Майкл Уэтерли, Фредди Родригес, Анна Люсия Аттанасио, Женева Карр, Кристофер Нил Джексон, Джейми Ли Киршнер, Данте Бриггинс, Тереза Тинг, Джимми Саито, Дена Тайлер', 'США', '16 +']"
369,https://kino.mail.ru/series_862518_vne_podozrenii/,https://resizer.mail.ru/p/297d24f8-a61b-50cd-9296-c2b1abf2361e/AAACJR_S7LjAU5IJZyIe3sy-TUXdBUzOlQO6Fk7XLItrK7IaqLhTo67J3ih5imvvmP7FrPNP-OwXwy_VRUeFDNv4C7k.jpg,Вне подозрений,"['драма', 'криминал', 'детектив']","Главная героиня сериала — детектив полиции Анна Трэвис (Келли Райлли). Девушка только заступила на службу. Ей предстоит работать под началом сурового суперинтенданта Джеймса Лэнгтона (Киран Хайндс). Анна мечтает добиться такого же успеха в работе, как и ее легендарный отец. Первым же серьезным и опасным делом для нее становятся поиски серийного убийцы. Она готова на все, чтобы поймать преступника. Даже стать приманкой для маньяка.
Британский криминально-драматический сериал «Вне подозрений» снят по мотивам произведений Линды Ла Планте.","['2009', '—', '2012']",7.3,"['Келли Райлли, Шон Дингуолл, Аманда Лоуренс, Селин Джонс, Надя Кэмерон-Блэйки, Киаран Хайндс, Мишель Холмс, Рэй Фиарон, Джоэнна Вандерхам, Даниэль Кальтаджироне', 'Великобритания', '18 +']"
370,https://kino.mail.ru/series_810780_vstrechnoe_techenie/,https://resizer.mail.ru/p/0e2feb2c-1166-552a-b109-5b3b155dbd64/AAACIOzZy3aJYeuWoO-flg4SYIrHrFdGDlQ_nTbwiDcUKf7nmiAtfsZtk35F6zBzB2ggozcd19e__yr6raSKJp6-7OY.jpg,Встречное течение,"['комедия', 'приключения', 'детектив']","Старший сержант Игорь Волошин по прозвищу Гарик откомандирован на службу в Санкт-Петербург, чтобы помогать местной водной полиции. Несмотря на то что он никогда не имел дела с водным подразделением, он изо всех сил старается влиться в коллектив и заслужить уважение командира, старшего капитана Маринина. Чтобы показать свой профессионализм и отвагу, Гарик активно участвует в раскрытии преступлений, которых на его долю выпадает немало. Параллельно главный герой сериала «Встречное течение» старается обратить на себя внимание красавицы Оксаны, самой молодой и привлекательной участницы полицейской команды.","['2011', '(Сериал', 'закончился)']",7.3,"['Игорь Ботвин, Дмитрий Луговкин, Мария Капустинская, Вадим Романов, Александр Баргман, Наталья Высочанская, Ярослав Иванов, Анна Пескова, Евгения Игумнова, Михаил Разумовский', 'Россия', '16 +']"
371,https://kino.mail.ru/series_925139_gore_ot_uma/,https://resizer.mail.ru/p/c3b32285-abe1-54a8-a77a-f19e671df4ff/AAACNRjqTJ88_3yjLwCokQQWjLS5WH9BIlROqRWhtXdnJWvhBtb_l4dhXsFE7ZashWcUiRTW6Xa3P38jLi1FIVL_NvE.jpg,Горе от ума,['драма'],"Погибает известный интернет-блогер Чацкий. Выяснить обстоятельства смерти поручают следователю по особым делам Порфирию Петрову. Расследование должно пройти в кратчайшие сроки, т. к. похороны Чацкого могут спровоцировать общественные волнения и беспорядки. Оказывается, что Чацкий нажил себе довольно много врагов, каждый из которых становится подозреваемым в этом деле. Ситуацию усугубляет смерть в прямом эфире еще одного блогера — Базарова, а также пропажа из морга тела Чацкого. У Порфирия Петрова есть всего три дня, чтобы разобраться в происходящем.","['2019', '(Сериал', 'закончился)']",6.3,"['Павел Прилучный, Мария Кожевникова, Федор Лавров, Даниил Спиваковский, Игорь Угольников, Сергей Медведев, Ольга Лерман, Сергей Юшкевич, Григорий Данцигер, Михаил Горевой, Юлия Сулес, Алексей Войтюк, Михаил Богдасаров, Анна Цуканова-Котт, Дмитрий Воронин', 'Россия', '16 +']"
372,https://kino.mail.ru/series_887941_zhanna_d_ark/,https://resizer.mail.ru/p/4699aaca-c4fc-5712-9bd9-3d94ebb79d12/AAACfIsfl234zjSo9kFSeATNJgjruM_prjnQdJ74NoROS_7AFeEzuVBccxDC09IO8OgsaCG4XyqbFa4W2WTDhei7Abw.jpg,Жанна д'Арк,"['драма', 'исторический', 'приключения', 'биография']","В 1412 году в небольшой деревушке Домреми, расположенной на севере Франции, в семье Жака д’Арк и Изабеллы де Вутон родилась дочь Жанна (Лили Собески). В 13 лет девочка начала слышать голоса святых, которые призывали ее возглавить борьбу против англичан и объединить Францию и Бургундию под правлением одного короля. Спустя три года Жанна твердо решила исполнить священный долг.
Канадский сериал «Жанна д'Арк» был номинирован на множество престижных наград, включая «Золотой глобус». Питер О’Тул, сыгравший епископа Пьера Кошона, был удостоен премии «Эмми» в категории «Лучшая мужская роль второго плана в мини-сериале или телефильме».","['1999', '(Сериал', 'закончился)']",6.8,"['Лили Собески, Питер О’Тул, Чад Виллетт, Питер Штраусс, Олимпия Дукакис, Нил Патрик Харрис, Пауэрс Бут, Жаклин Биссет, Максимилиан Шелл, Роберт Лоджа', 'Канада', '12 +']"
373,https://kino.mail.ru/series_777224_zhenskii_klub_po_rassledovaniyu_ubiistv/,https://resizer.mail.ru/p/e93a2a8f-7b14-5f84-8b20-3cf3ab741ae6/AAACT2Xth7jHMY8MewDfrcxYsXhInzv0Lz81pSYNPK--o4Jlo2Y1XMIpWQTmuD79d3oaBTSoykki94e_pwUU-QUDl3c.jpg,Женский клуб по расследованию убийств,"['драма', 'криминал', 'детектив']","Сериал «Женский клуб расследований убийств» снят по мотивам книг Джеймса Паттерсона. В центре сюжета четверо женщин, чья работа связана с расследованием убийств: детектив Линдсей, помощник следователя Джилл, судмедэксперт Клэр и журналист криминальной хроники Синди. Девушки очень разные по натуре, но это не мешает им быть лучшими подругами, а также гениальными сыщиками, способными раскрыть самые запутанные дела, применяя свой особый женский ум. В сериале «Женский клуб расследований убийств» вас ждут не только захватывающие расследования, но также любовь, дружба и прочие проявления взаимоотношений.","['2007', '—', '2008']",8.2,"['Энджи Хармон, Лора Харрис, Паула Ньюсом, Обри Доллар, Тайриз Аллен, Роб Эстес, Линда Пак, Коби Райан МакЛоин, Джонатан Адамс, Эвер Кэррадайн', 'США', '16 +']"
374,https://kino.mail.ru/series_835143_cherlidershi/,https://resizer.mail.ru/p/d8953f83-b8da-57e9-be00-7cdce79654b9/AAACheesa2ds9CjfCYdw10SpE7t6VW3KkCWtpKxbdyXWQJj0TVndAAw1KKexkPACj_7dFpJ-sE1QcXp5lWIw14bp_UE.jpg,Зажигай!,"['драма', 'спорт']","Сериал «Чирлидерши» рассказывает о танцевальной команде NBA Los Angeles Devil Girls. К ним присоединяется талантливая Аша, воспитанная матерью-одиночкой. Любовные романы между чирлидершами и баскетбольными игроками официально запрещены, но танцовщицы и члены команды все равно встречаются. Капитан «Дьявольских девиц» Елена пытается досадить Аше, потому что видит в ней соперницу. Один из игроков NBA хочет соблазнить девушку и увести от бойфренда. Аша должна пройти собственный путь, полный опасностей и интриг, чтобы узнать секреты, которые скрывает ее мать, и не поддаться искушениям, ведущим к карьерному провалу.","['2013', '—', '2018']",,"['Кимберли Элиз, Логан Браунинг, Кэтерин Бэйлесс, Валери М. Ортис, МакКинли Фриман, Дон Старк, Дин Кэйн, Лил Дж, Тейлор Пейдж, Роберт Кристофер Райли', 'США', '18 +']"
375,https://kino.mail.ru/series_815841_zvezda_lori/,https://resizer.mail.ru/p/8f52c2f4-d2b4-5d8f-b34e-d1ffe03c140a/AAACDLC6k9C14bD9ViOg-32bT0z_0lcJKL0S_CqbTi4HQU9Sj-g3vxxZh6tti8fII-_gMAe9MEnFyp4ypbq_5WKYb6w.jpg,Звезда Лоры,['мультсериалы'],"Однажды маленькая девочка по имени Лора смотрела из окна на небо. Она мечтала об удивительных и несбыточных вещах, как вдруг с неба упала звезда. И случилось невероятное — звезда и Лора подружились, и теперь девочке уже не было скучно или одиноко. Новая знакомая научила Лору жить полной жизнью, в которой есть место приключениям и настоящему волшебству. Истории звезды — удивительны и прекрасны, совсем как детские мечты. Теперь мечтательница Лора уверена в том, что у каждого человека должна быть звезда.","['1999', '—', '2008']",,"['Германия', '0 +', 'Клаус Баумгарт, Майкл Мадел, Анне Госенс']"
376,https://kino.mail.ru/series_918644_kobayasi_i_ee_gornichnaya_drakon/,https://resizer.mail.ru/p/76132fb5-913d-5648-9dc2-0fe2052dbb5d/AAACIoESIbBtlwMtfeoaQ4kLSxBnL6HF90rjRJP3zCYK2FSqrycyQdDXsSGMuwL2qHrhFEGEpD1cWXYxvzgC2uqMcBI.jpg,Кобаяси и ее горничная-дракон,"['фэнтези', 'комедия', 'аниме', 'мультсериалы']","Однажды утром, выходя на работу, одинокая офисная сотрудница Кобаяси обнаруживает на пороге своей квартиры огромного дракона, который трансформируется в красивую девушку в одежде горничной. Оказывается, накануне вечером во время пьяной прогулки в горы Кобаяси спасла дракониху Тору, вытащив из ее спины священный меч, и предложила пожить у нее и поработать домработницей. Обещание есть обещание: с неохотой, но все же Кобаяси впускает в дом дракона. Это решение оборачивается для героини аниме «Кобаяси и ее горничная-дракон» массой неприятностей. Во-первых, неординарные методы домоводства Тору иногда поистине пугающи, а во-вторых, теперь в квартиру Кобаяси регулярно наведываются другие драконы, боги и прочие мифические существа.","['2017', '(Сериал', 'закончился)']",,"['Муцуми Тамура, Юуки Кувахара, Мария Наганава, Юити Накамура, Даисукэ Оно, Минами Такахаси, Синя Такахаси, Каори Исихара, Като Эмири, Юки Такада', 'Япония', '16 +']"
377,https://kino.mail.ru/series_897501_maska/,https://resizer.mail.ru/p/da8e41da-71ca-5180-ad19-cb35afb7ad26/AAACrA2K3yHTg7OPq7_LL4WrO_uYz9d_4_WsVB4mKdASdTgfiEOTvIonKkEUQ-ikC8VIFZ5bvMkv3fMgxXFQepLbEP8.jpg,Маска,"['драма', 'мелодрама']","У красавицы Пен Чжи Сук (Су Э) непростая жизнь: она вынуждена скрываться от коллекторов из-за долгов отца. А ведь она всегда мечтала быть богатой и жить в роскоши. Однажды девушка знакомится с Со Ын Ха, родившейся в обеспеченной семье. Чжи Сук понимает, что очень похожа на эту женщину, и решает выдавать себя за нее. Но знакомство с крупным бизнесменом Чхве Мин У (Чу Чжи Хун) полностью меняет жизнь Чжи Сук... Сможет ли главная героиня сериала «Маска» сохранить свою тайну?","['2015', '(Сериал', 'закончился)']",8.1,"['Су Э, Чи Хун Чу, Ён Чжон Хун, Ю Ин Ён, Ли Хо Вон, Чон Кук Хван, Чон Дон-хван, Ли Чжон Нам, Пак Чун-гым, Йонг Су Парк', 'Южная Корея', '16 +']"
378,https://kino.mail.ru/series_885000_mislit_kak_prestupnik_za_granitsei/,https://resizer.mail.ru/p/d6d62583-a46f-55c8-a17c-1997d0eef85a/AAAC6cD3WQ7_YFKod-In30cRog_efjx1QztLReaR0XtP2zXNTdwAV0fvViUuNF100cZnoYfw1apoZZenbVazyRPvIi8.jpg,Мыслить как преступник: За границей,"['драма', 'криминал']","Спин-офф детективного сериала «Мыслить как преступник», рассказывающий о специальном отделе ФБР, который помогает американским гражданам, попавшим в неприятности за границей.","['2016', '—', 'по']",,"['Алана де ла Гарса, Анна Ганн, Дэниэл Хенни, Гэри Синиз, Тайлер Джеймс Уильямс, Энни Функе, Афшин Оляи, Келли Фрай, Эзра Дьюи', 'США', '16 +']"
