,url,poster,title,ganres,description,year,rating,cast
248,https://kino.mail.ru/series_828809_manhettenskaya_lyubovnaya_istoriya/,https://resizer.mail.ru/p/335d2892-6e4b-5fba-82e5-6841087a510d/AAACELJWxahqnJW_v5Ea-xzVUc9NRy0umITCSH_oRLcMnevIrdRdkcx_XrmYNBeHeFyKx94p4sNUs6GYLIz-rIpSH68.jpg,Любовь на Манхэттене,['комедия'],"Главные герои — парень и девушка, которые познакомились на свидании вслепую. Их первое свидание с треском провалилось, но последующие встречи положили начало новым прекрасным отношениям. Впереди их ждут Нью-Йорк, новые открытия, яркие эмоции и миллионы мимолетных и серьезных мыслей, которые зрители смогут услышать без купюр.
«Манхэттенская любовная история» — необычный комедийный сериал, в котором основной акцент сделан на внутренних монологах героев в процессе развития их отношений.","['2014', '—', '2015']",7.4,"['Лио Типтон, Джейк Макдорман, Курт Фуллер, Джейд Катта-Прета, Надя Дажани, Эджей Найду, Николас Райт, Хлоя Веппер', 'США', '14 января 2015 (РФ)30 сентября 2014 (Мир)']"
249,https://kino.mail.ru/series_868824_malenkii_zoomagazin/,https://resizer.mail.ru/p/2edae3a0-cba3-51d5-bf60-6ceedb26a427/AAACwVuYr2CHhT1AZfrrfu0EX40YDS628Paj8DFaoEgCiA7-5qtH2PhbnMhvIMlnpW862dv5iQ2iZe2D6MWjuzKUzSQ.jpg,Маленький зоомагазин,"['комедия', 'семейный', 'мультсериалы']","Девочка Блайс с отцом переезжает в городскую квартиру прямо над зоомагазином, в котором обитают разные виды животных, такие как панда, собака, еж, ящерица-геккон, скунс и даже мангуст. Однажды Блайс открывает в себе необычный дар — она может разговаривать с животными! С этого момента героиня мультсериала «Маленький зоомагазин» все свободное время проводит вместе со своими новыми друзьями. И вскоре у шумной компании появляется общая цель — помешать большому зоомагазину конкурентов вытеснить из бизнеса магазин маленьких зверушек.","['2012', '—', 'по']",,"['Эшли Болл, Сэм Винсент, Питер Нью, Кайл Райдаут, Кира Тозер, Николь Оливер, Табита Сен-Жермен, Жослин Ловен, Кэтлин Барр, Шеннон Чан-Кент', 'США, Канада', '0 +']"
250,https://kino.mail.ru/series_810994_moi_lyubimii_uchitel/,https://resizer.mail.ru/p/c9b98957-863a-55c3-bd90-4d868855cd0a/AAAC2GE-n3hIESjkcVnkxMgZyPdJpGh6zDsPuwNWVpsF-tcSdTfzPb12NzFwSO-V7OflKbaHp1nQJCfqOtn7g3_BBAQ.jpg,Мой любимый учитель,"['драма', 'мелодрама', 'комедия']","Главная героиня сериала — 25-летняя На Бо Ри. Она с детства влюблена в учителя рисования Джи Хён У и, несмотря на сложный характер, мечтает стать педагогом и вернуться в родную школу уже в качестве преподавателя. Но учителя не хотят видеть рядом коллегу: в школе ее помнят как трудного подростка, ведь ее выгнали из школы с позором за драку. Джи Хён У уговаривает свою сестру, директора, принять девушку на работу при условии, что она станет наставником ее пасынка, хулигана Пак Тхе Ин. Директор одобряет такое решение семейных и профессиональных проблем. На Бо Ри приступает к работе в школе. Но тут перед главной героиней сериала «Мой любимый учитель» возникает другая, личная проблема: Джи Хён У отвечает ей взаимностью, но и Пак Тхе Ин оказывается очень ранимым и одиноким и все больше нравится девушке. Кого же из них выбрать?","['2005', '(Сериал', 'закончился)']",,"['Кон Ю, Чхве Ё Чжин, Кон Хё-джин, Ый-чхоль Жонг, Чон Гю Ун, Ли Юн Джи', 'Южная Корея', '16 +']"
251,https://kino.mail.ru/series_869609_neposredstvenno_kaha/,https://resizer.mail.ru/p/219e3809-5f5a-5c1c-b9e9-33a40174e87a/AAACeWWFygAcaFvSVEpPtJnkg3mUMldHgjfIr16xfhKA5kmEXDvww5B10rjEr4wiZFzGInOTyyUdNZ8OOalo1vip0jY.jpg,Непосредственно Каха,['комедия'],"«Непосредственно Каха» — юмористический сериал, снятый в жанре мокьюментари, о простом парне из Сочи и его друзьях, которые каждый день попадают в забавные, а иногда и откровенно дурацкие ситуации. Выпутываться из них им предстоит самыми разными способами — порой очень нестандартными.","['2012', '—', '2013']",,"['Артем Каракозян, Данил Иванов, Артем Калайджян', 'Россия', '12 +']"
252,https://kino.mail.ru/series_802204_osobo_tyazhkie_prestupleniya/,https://resizer.mail.ru/p/32e37c94-92e1-504d-8a2b-065bbd911c1f/AAACsxnAtDeXZ2gQgvv4RMrMiW2EQaJzJ_EhFtCRkdyFMOuq5m4FgKu2C7mKh3hkDG7sO46uLT-1yZTKRx9ZpjRPz-c.jpg,Особо тяжкие преступления,"['драма', 'криминал', 'детектив']","В отделе по расследованиям особо тяжких преступлений города Лос-Анджелеса наступают тяжёлые времена, связанные со сменой руководства. На место Бренды Ли Джонсон назначают капитана Шэрон Рейдор, которая до этого возглавляла отдел внутренних расследований. Её подчинённые не слишком воодушевлены подобными изменениями. Шэрон необходимо завоевать доверие коллег, чтобы наладить работу отдела. Кроме того, она вынуждена взять на попечение подростка Расти Бека, являющегося важным свидетелем в деле, которое вела Бренда перед уходом со службы.
«Особо тяжкие преступления» — спин-офф известного детективного сериала «Ищейка». Пилотный эпизод проекта привлёк более семи миллионов зрителей, став наравне с «Далласом» самой наблюдаемой новинкой года на кабельном телевидении.","['2012', '—', 'по']",7.2,"['Мэри МакДоннелл, Дж. У. Бейли, Энтони Джон Дэнисон, Майкл Пол Чан, Грэхэм Патрик Мартин, Рэймонд Крус, Филлип П. Кин, Кирран Джованни, Роберт Госсетт, Джонатан Дель Арко, Надин Веласкес', 'США', '16 +']"
253,https://kino.mail.ru/series_772223_poslednii_chas/,https://resizer.mail.ru/p/e9fc0c2b-43f2-5d9e-9933-f1292d8628d4/AAACvbV6hr1W_ISZQGMDd7PAABwKDVntOwTxY3HqsmImjUUaTL3rw46Fk9_4X548LQj5Cqx7GJM5XupII3Yfu0sCZxQ.jpg,Последний час,"['драма', 'триллер', 'приключения', 'детектив']","Американский приключенческо-драматический телесериал с Энтони Эдвардсом в главной роли. Его герой — Хэнк, энтузиаст-издатель журнала о паранормальном «Современный скептик». Он тратил все свое время на то, чтобы разоблачать мистификаторов и раскрывать заговоры, но однажды окался втянут в одну из самых интригующих тайн в истории человечества. Супругу Хэнка похищают прямо из магазина антикварных часов. Начав поиски, в одних из часов, принадлежащих женщине, герой находит карту сокровищ. Он начинает расшифровывать символы и познавать тайны карты, стараясь, чтобы она не попала в руки сопернику Уайту Винсенту. С двумя юными союзниками и привлекательным агентом ФБР Беккой Хэнк отправляется на поиски любимой, открывая увлекательную гонку на время, чтобы найти жену и спасти человечество.","['2013', '(Сериал', 'закончился)']",5.3,"['Энтони Эдвардс, Кармен Эджого, Скотт Майкл Фостер, Эддисон Тимлин, Джасинда Бэррет, Микаэл Нюквист, Амир Арисон, Генри Келемен, Кен Люн, Клаудия МакЛэйн', 'США', '1 февраля 2013 (Мир)']"
254,https://kino.mail.ru/series_929733_razdelenie/,https://resizer.mail.ru/p/d0396139-b617-5ecc-b44c-08034d351650/AQACSwJIpUepJjBk743mHw_JFDyAzIMx5LPBY6l6grECHfnHTD3wG7VRj-1Xtid04UKe1y-DCWFUYoU30bsf_bkQRh0.jpg,Разделение,"['драма', 'триллер']","Компания Lumon Industries придумывает новый способ повысить эффективность сотрудников — «процедуру разделения», отделяющую рабочие воспоминания от обычных. Хелли соглашается на этот эксперимент, но вскоре начинает сомневаться в правильности своего выбора.","['2022', '—', 'по']",7.6,"['Патриция Аркетт, Зак Черри, Дичен Лакмэн, Бритт Лоуэр, Адам Скотт, Трэмелл Тильман, Джен Туллок, Джон Туртурро, Кристофер Уокен, Марк Геллер, Доминик Лоусон', 'США', '16 +']"
255,https://kino.mail.ru/series_934906_raitsentr/,https://resizer.mail.ru/p/5d364ae3-0427-5843-8ba6-78a68fa0633c/AQACfDSGNl6SFcQS3L3CVT7Itk5fvxh2qBuhIvoeHzRykHFCJBIG8yVx2cR1G4EXc8TDmAEJDcBuQiyd8yHN3G2rFGw.jpg,Райцентр,"['комедия', 'криминал', 'детектив']","Бывшие одноклассники собираются в деревне Вармалей, чтобы отметить 20-летие со дня окончания школы. В это же время из местного пруда вылавливают машину, пролежавшую на дне с того самого выпускного, а в ней — труп и осколок метеорита. Начинается расследование, которое вскрывает старые тайны и конфликты, осложняет запутанные отношения бывших одноклассников и их учителей и срывает маски с тех, кто умело прятался за ними 20 лет.","['2023', '(Сериал', 'закончился)']",6.3,"['Кристина Асмус, Иван Добронравов, Дмитрий Чеботарев, Карина Разумовская, Игорь Грабузов, Григорий Данцигер, Владимир Скворцов, Станислав Соломатин, Лариса Баранова, Екатерина Носик, Полина Райкина, Степан Абрамов, Николай Аузин, Артем Волобуев, Алексей Золотовицкий, Сергей Ююкин, Агриппина Стеклова, Александр Золотовицкий, Даня Киселев', 'Россия', '18 +']"
256,https://kino.mail.ru/series_776154_sestri_po_krovi/,https://resizer.mail.ru/p/c45b63c0-bf57-595b-9135-b1711590317f/AAACD2kSiSnSotRXNSXwgM-60pD0uZKJfxt97FrzPYIJLIzcAVSyVpyJQZSjuHgKWQWaQCTClWy0uNJ_FAyXbTL5XOA.jpg,Сестры по крови,"['драма', 'мелодрама']","Чем дорожим мы сегодня и что несем другим? Каков он, путь наверх? Ради чего мы живем? Извечные вопросы, волнующие людей любого сословия и социального положения. Доминика Никитина — успешная молодая бизнес-леди — попадает в аварию. Операция требует прямого переливания крови. Так в безоблачную и размеренную жизнь Доминики стремительно врывается ее «сестра по крови», торговка посудой, Ритка. Сталкиваются и переплетаются две женские судьбы, два женских характера. Умная, образованная, сдержанная Доминика. И девушка с темным прошлым — Маргарита — симпатичная, разбитная, острая на язык, любимица рынка и покупателей поэтесса-самоучка. ","['2006', '(Сериал', 'закончился)']",6.0,"['Елена Коренева, Мария Куликова, Наталья Лесниковская, Андрей Ташков, Ева Авеева, Сергей Астахов, Виктория Билан, Станислав Боклан, Анатолий Васильев, Вячеслав Василюк', 'Россия, Украина', '16 +']"
257,https://kino.mail.ru/series_921394_slabaya_silnaya_zhenschina/,https://resizer.mail.ru/p/da584153-65b0-5601-b07f-36fa479b11b2/AAAC_g9U71ix5a5ZOiAhi2hWmprlgNVGySySmhRdZXeXCncqVOVPtIicyFiMqjoa9KVnBYDtK6AlxkJHIb7fHlqRaWo.jpg,Сильная слабая женщина,['мелодрама'],"1989 год. Нина Голубева заканчивает школу в провинциальном городе и мечтает стать модельером. Но первая серьезная влюбленность оборачивается для нее беременностью и одиночеством. В начале 90-х Нина переезжает в неприветливую столицу, где ей приходится полагаться только на себя.","['2019', '(Сериал', 'закончился)']",7.2,"['Александра Власова, Сергей Перегудов, Дмитрий Власкин, Александр Константинов, Ольга Кабо, Владимир Гостюхин', 'Россия', '16 +']"
258,https://kino.mail.ru/series_936858_stoi_ne_to_mama_budet_gadat/,https://resizer.mail.ru/p/3fa61d06-8010-5f56-8f6f-1bbfa3819959/AQACLS9N9dhpBaHwD67Y4cMGHYZCUopv0PBpfX6D5S4epU3wgP44tVlk0vvtbfEZyvaNibPk3ePS1dViQj7XH4CE3PA.jpg,Стой! Не то мама будет гадать,"['комедия', 'детектив']","Татьяна Быстрова живет в Екатеринбурге и зарабатывает на жизнь тем, что выдает себя за экстрасенса. Но однажды ее раскрывают, и ей приходится в спешке покинуть город. Тогда Татьяна приезжает в Москву, где живет ее сын — следователь Артем Быстров. Не рассказав о причине своего внезапного визита, женщина всеми силами старается задержаться подольше в «однушке» Артема, в то же время замучив его своей заботой. Однажды она оказывается вместе с ним на месте преступления, и тут в ней неожиданно просыпаются настоящие сверхъестественные способности. С этого момента Татьяна помогает Артему раскрывать самые сложные и запутанные дела — часто вопреки его воле. Проводя совместные расследования, мать и сын учатся общаться без раздражения и уважать границы друг друга.","['2023', '(Сериал', 'закончился)']",7.2,"['Инга Оболдина, Михаил Кремер, Сергей Громов, Нино Нинидзе, Кристина Убелс, Антон Левин, Сергей Анненков, Александр Бобров, Екатерина Журавлева', 'Россия', '16 +']"
259,https://kino.mail.ru/series_905420_schastlivchik/,https://resizer.mail.ru/p/a7dad17b-c346-5ebf-a5b2-22af57883dc6/AQAC7k10keAgaBe6fzpRgQ3tjJl0xU8_FRM2iuRS6mDMx6qAkI11lyalr6qUmfzmqwwjoussnz7fyWZYWs9ZhScLUtg.jpg,Счастливчик,"['драма', 'фантастика', 'мистика']","Гарри Клейтону (Джеймс Несбитт) не везет в работе и личной жизни. Сотрудник лондонского департамента розыска никак не может построить карьеру, да и отношения с женщинами совсем не ладятся. Но все меняется в один миг: загадочная незнакомка дарит Клейтону старинный браслет, с помощью которого можно привлечь удачу. Главный герой сериала «Счастливчик» рад подарку и не хочет даже думать о том, что за все в жизни нужно платить, а цена может оказаться слишком высокой...","['2016', '—', 'по']",7.5,"['Джеймс Несбитт, Стефен Хэйгэн, Джозеф Гатт, Лиза Диллон, Ли Николас Харрис, Мэтт Таунсенд, Эндрю Ли Поттс, Пол Блэкуэлл, Гарри Марриотт, Лаура Свифт, Стивен Томпсон', 'Великобритания', '16 +']"
260,https://kino.mail.ru/series_777726_fishki_dengi_advokati/,https://resizer.mail.ru/p/2902e5e0-c059-58ee-9cc5-b66d76548001/AAACjDoju16ekW1Z_-iJCgxvfSzwtsRUhu_hCLr1xhpB1wp_D8cLMlseSkF9L4-Ay4Q0ViepHQuiFdVUOFiGyDSnbSc.jpg,Фишки. Деньги. Адвокаты,['драма'],"«Фишки. Деньги. Адвокаты» — американская драма-комедия, рассказывающая о двух адвокатах из Лас Вегаса, ставящих интересы своих клиентов превыше всего. Ник Морелли (Джеймс Белуши) — адвокат-трудяга, и Пит Кацмарек (Джерри ОКоннел), обожающий не только право, но и красивых женщин и гоночные машины, совместными усилиями защищают своих клиентов в Городе греха. После расширения бизнеса к Нику и Питу присоединяются молодая, полная энтузиазма юристка Лиза Тайлер, в прошлом экзотическая танцовщица, а также милая и немного инфантильная ассистентка Софи. Юристы, помимо активной юридической практики, также пытаются устраивать свою личную жизнь.","['2010', '—', '2011']",7.4,"['Джеймс Белуши, Джерри О’Коннелл, Джерни Смоллетт, Таня Фишер, Тедди Сирс, Моннае Майчелл, Ниалла Гордон, Куно Беккер, Глинн Термен, Джулиан Акоста', 'США', '28 января 2011 (РФ)22 сентября 2010 (Мир)']"
261,https://kino.mail.ru/series_912948_chernii_les/,https://resizer.mail.ru/p/cdcf771c-26a1-5cd5-ab0e-5f70dfa5323b/AAACpBAvN0J7QqlnfPNMwQaZQ92LQakaeRwfV2Zr3itPua8LAMn2RyfzmwT-5PVDzx05MofHHg24NG9BJb6CQzPHzsg.jpg,Черный лес,"['триллер', 'детектив']","Небольшую деревню в Галисии, которая получила название Черный Лес, всколыхнуло страшное известие — погиб один из влиятельных лесозаготовщиков. Всем местным жителям известно, что уже достаточно давно две богатые семьи соперничают, пытаясь поделить бизнес и увеличить объем заготовки леса. Сержант Марга Нейра (Лусия Регейро) начинает расследовать преступление, к ней на помощь отправляют опытного полицейского Диего Базана (Мигель Анхель Бланко). Профессионалам оказывается непросто найти общий язык, ведь каждый из них — сильная личность, готовая отстаивать собственные взгляды. Главным героям сериала «Черный лес» предстоит разобраться, какие тайны хранит эта спокойная на первый взгляд деревня...","['2014', '—', '2019']",6.7,"['Сабела Аран, Мигель Анхель Бланко, Уксия Бланко, Тито Асорей, Мигель Боринес, Ксабьер Дейв, Мариана Экспозито Кастаньо, Сесар Гольди, Санти Прего, Лусия Регейро', 'Испания', '16 +']"
262,https://kino.mail.ru/series_930845_ya_idu_tebya_iskat/,https://resizer.mail.ru/p/1b167aa8-48a3-5a52-a0f5-b84ff6189d79/AQACMUiig7UmPbTTkuH5l01F6xWQ3jOxCbrOTRvaVi40_62YxqZjz-VYW_IrAhOvhZWfqsUdg4DYNumfWNCqwvFqaB8.jpg,Я иду тебя искать,['детектив'],"Без пяти минут выпускница юридической академии Мила Пятница попадает на практику в Управление МВД. Там ее руководителем становится опытный следователь Максим Швец. Вместе с ним Мила расследует необычные и запутанные дела, зацепки для которых часто находятся в архиве.","['2021', '—', 'по']",6.3,"['Софья Хилькова, Петр Рыков, Данила Рассомахин, Александр Тютин, Анна Шкиль, Ольга Хохлова, Анна Попова, Лиона Филиппова, Валентина Муравская', 'Россия', '16 +']"
