,url,poster,title,ganres,description,year,rating,cast
118,https://kino.mail.ru/series_901253_nepodsudnie/,https://resizer.mail.ru/p/bad3c107-bb27-5ce2-a130-d570f59ec29c/AAAC_PWNn7KKcIPMnVqlyvcpj-_2F5l5O15aufy6qOdSr9AnTLgOS6zFNOdhCRJcfrSp-q9jPlbQ_I-1nKMtiFWwv-U.jpg,Неподсудные,['триллер'],"Российские спецслужбы расследуют крупное дело о коррупции в госаппарате. Нечестные чиновники, замешанные в этой истории, представляют угрозу для всей страны. Под следствием оказывается бывший офицер госбезопасности Андрей Воронов, которого обвиняют в пособничестве одному из центральных фигурантов дела. Чтобы доказать свою невиновность, главному герою сериала «Неподсудные» предстоит провести собственное расследование, подвергая себя серьезной опасности.","['2015', '(Сериал', 'закончился)']",7.6,"['Игорь Петренко, Кирилл Плетнев, Сергей Бурунов, Леван Мсхиладзе, Николай Добрынин, Даниил Спиваковский, Сергей Газаров, Антон Хабаров, Елена Николаева, Евгений Князев', 'Россия', '16 +']"
119,https://kino.mail.ru/series_811745_nepridumannoe_ubiistvo/,https://resizer.mail.ru/p/7262f468-58d8-5ed5-87ff-c764bf7d6d89/AAACZQWk1unnpjoF1w-T4S93paWFUHo-We9epwMxVPZUg9id3Ufm8ZdC_HS9dwBjP-Q1tC7RDemEKuF_46EiFaPvt2k.jpg,Непридуманное убийство,"['мелодрама', 'детектив']","Героиня сериала «Непридуманное убийство» Наталья, скромная сотрудница турагентства, подбирает на улице потерявшегося ротвейлера. Придя по адресу, написанному на ошейнике собаки, Наталья не обнаруживает хозяев и, открыв дверь ключом, найденным в почтовом ящике, остается в квартире. Вскоре Наталья обнаруживает, что этажом ниже живет писатель Воронов, детективами которого она зачитывается. Случайно найденный ротвейлер не только дарит встречу с любимым писателем, но и вовлекает героиню в расследование убийства влиятельного банкира и исчезновения его возлюбленной Дарьи — хозяйки квартиры и собаки.
Сериал «Непридуманное убийство» снят по роману Виктории Платовой «Смерть на кончике хвоста».","['2009', '(Сериал', 'закончился)']",7.6,"['Светлана Иванова, Андрей Ильин, Александр Боев, Юлия Зимина, Олег Кассин, София Каштанова, Вячеслав Гугиев, Кирилл Игнатов, Александр Хващинский, Антон Аносов', 'Россия', '16 +']"
120,https://kino.mail.ru/series_917215_cherno_belii_tanets/,https://resizer.mail.ru/p/9a7cf4a6-d419-5740-a2bf-2eaa8537ec6a/AAACgaET70YC8LhKpraHPvDUvtzK5YDTLxD-EpieZKaWUN22O02ImDzeuh-qa026xA75XXtA2yKyqV7KKBEE5TITcwQ.jpg,Одна жизнь на двоих,"['мелодрама', 'детектив']","События детектива происходят в 1980-е годы. Главный герой сериала «Одна жизнь на двоих» — парень из провинции Арсений, который недавно приехал в столицу. Молодой человек влюбляется в москвичку Настю, девушку из обеспеченной семьи. Родственники Насти не в восторге от ее выбора. А вскоре происходит чудовищное преступление — кто-то убивает бабушку и дедушку Насти. Арсений становится обвиняемым в убийстве...","['2018', '(Сериал', 'закончился)']",7.2,"['Александр Зельский, Борис Чистяков, Сергей Паршин, Анна Каменкова, Анастасия Чистякова, Артем Крылов, Алиса Лозовская, Виктория Малекторович, Егор Кутенков', 'Россия', '16 +']"
121,https://kino.mail.ru/series_930225_ohota_monte_perdido/,https://resizer.mail.ru/p/de89005a-0468-5906-90b6-6ccb9782331a/AAACJ0cLkOas7VFHaJ9PbgZa3ZvYJ8M9Xb5pspQp4PGn5A9UiLWcFaQVvIskP2BJsc8W-rkAJf5Di-oo6zv3b79RUa0.jpg,Охота. Монте-Пердидо,"['драма', 'криминал', 'детектив']","Действие разворачивается в испанском городке Монте-Пердидо в Пиренеях. Две девочки, Анна и Лусия, пропадают по дороге из школы. Надеясь на то, что подруги просто заблудились, местные жители и полиция прочесали все окрестности, но тщетно. Спустя пять лет Анна неожиданно возвращается: ее находят без сознания, с серьезной травмой головы. Расследование возобновляется, его ведут Сара Кампос и ее наставник Сантьяго Баин из Мадрида. Вместе с полицейскими Монте-Пердидо опытные следователи пытаются разобраться в том, что произошло с девочками, и найти Лусию.","['2019', '—', '2021']",7.0,"['Меган Монтанер, Ален Эрнандес, Беатрис Карвахаль, Франсис Лоренсо, Феликс Гомес, Беа Сегура, Сара Риверо, Пабло Дерки, Ллум Баррера, Пэтси Фрейтез', 'Испания', '16 +']"
122,https://kino.mail.ru/series_931749_prizvanie/,https://resizer.mail.ru/p/b69a10e9-f892-5203-ba24-266c2dc58e1e/AQAC_Xk3DebxCghQUfECVhYw2NN1uzQgXkSt2K4_2IZ7F5ZYbrGe3wCnkKQ5niHB024B3vu7y65eNHKVsESOt-hSK2A.jpg,Призвание,"['криминал', 'детектив']","Москва, середина 80-х. Старшего оперуполномоченного МУРа Владимира Чеянова назначают начальником следственной группы по расследованию убийства семьи Лошкаревых в собственной квартире. В живых остался лишь младший сын, прятавшийся во время преступления в диване. Там же, в диване, следователи находят большую сумму денег, что вызывает массу вопросов, ведь у советской семьи, глава которой работал простым водителем, таких денег быть не могло.
В основу сюжета легли реальные события, которые произошли в Советском Союзе в 1977 году.","['2023', '(Сериал', 'закончился)']",7.6,"['Дмитрий Миллер, Денис Васильев, Ольга Веникова, Екатерина Приморская, Леонид Громов, Артем Осипов, Софья Донианц', 'Россия', '16 +']"
123,https://kino.mail.ru/series_926063_radi_lyubvi_ya_vse_smogu/,https://resizer.mail.ru/p/e2ed6193-567e-5f0a-9604-3f0a0df8e564/AAACmDkF-0-CGrWLpmd1Nvh_Yz1hWjXwl40KAWOFA1fUjM51JR13I9gxCzbQ9vJe2kBQ6AMsRpa3dJ_IL9nQjTeRNNo.jpg,Ради любви я все смогу,['мелодрама'],"Чтобы финансово поддержать семью, скромная студентка Маша Ильина бросает учебу и устраивается на две работы: утром она заправляет машины, а вечером разносит заказы в кафе. Но этого оказывается недостаточно, когда отец Маши смертельно заболевает, его фирму объявляют банкротом, а на квартиру накладывают арест. Ильину нужна пересадка печени, а для этого требуется огромная сумма денег. Злобные мачеха и сводная сестра кладут на плечи Маши всю ответственность за спасение папы. В отчаянии девушка соглашается стать суррогатной матерью. Ее «заказчицей» становится несчастная женщина Елена Городецкая: попрекаемая свекровью, она очень страдает из-за своего бесплодия и готова на все, лишь бы подарить мужу Ростиславу наследника. Судьбы двух семей переплетаются, когда Маша знакомится с братом Ростислава, добрым и обаятельным Костей Городецким...","['2015', '—', '2016']",6.6,"['Кристина Казинская, Кирилл Дыцевич, Дмитрий Пчела, Юлия Майборода, Наталия Васько, Ирина Мельник, Алена Яковлева, Кирилл Козаков, Неонила Белецкая, Олег Савкин', 'Украина', '16 ноября 2015 (Мир)']"
124,https://kino.mail.ru/series_797228_svaha/,https://resizer.mail.ru/p/8ba69c91-5962-559d-a890-d7de453b49ab/AAACEq4WZfgy3GdiN_3fAuLdYn3o-eMp4aMeVghpGjVgd1J08bHG17cNlYQ_2nqRGsneveeuBPkR6Wbr0H-Tq8N0Vvg.jpg,Сваха,"['мелодрама', 'комедия']","Главные герои сериала «Сваха» — работники брачного агентства. Их всего четверо: хозяйка агентства Анна Полонская — основной генератор идей, продвинутый молодой фотограф Максим по прозвищу Bluetooth, умудрённая опытом Нина Петровна по прозвищу Хризантема и  Роман. На фоне калейдоскопа знакомств и влюблённостей клиентов брачного агентства разворачивается история жизни и любви самой Анны и всей её команды.
Когда-то Анне не повезло с личной жизнью, она рассталась с мужем, и у неё на руках остался маленький сын. Эта личная трагедия побудила её открыть агентство и помогать другим людям. Максим мечтает стать кинооператором, учится на вечернем и видит себя в Голливуде. У него сложные и противоречивые отношения со своей девушкой Наташей и от этого частые конфликты с Анной. Нина Петровна несёт в себе нравственный потенциал того поколения, она совершенно иначе смотрит на современную действительность, но её точка зрения иногда бывает просто необходима для решения той или иной ситуации. В сериале действует и десятилетний сын Анны — Гоша, который доставляет немало хлопот матери и её друзьям своей страстью разбирать любые механизмы.
Агентство Полонской — своеобразный центр кипения человеческих страстей. Люди приходят сюда со своими надеждами и сомнениями, здесь искренность соседствует с лицемерием, а настоящая любовь — с интригами и расчётом.","['2007', '(Сериал', 'закончился)']",5.5,"['Анна Большова, Людмила Гаврилова, Рустэм Юскаев, Александр Сигуев, Полина Лунегова, Петар Зекавица, Екатерина Авдеева, Андрей Лебедев, Василий Фролов, Евгения Бордзиловская', 'Россия', '12 +']"
125,https://kino.mail.ru/series_925042_sled_lisitsi_na_kamnyah/,https://resizer.mail.ru/p/de3dc872-6e4a-5f2e-9d81-23615ee795a2/AAACmKFuR_4AMEJBbTjfDZ0alznPO862bTUkQAHD3H_lxtZCwI6tHnt0RKQA86h9neYSEDj7ajpddObAQiIq9Ex7TbI.jpg,След лисицы на камнях,"['криминал', 'детектив']","Андрей Калашников вложил все свое состояние и всю душу в восстановление полуразрушенного старинного терема в деревне Камышовка. И вот однажды к нему приходит Вера Бакшаева, сестра бывшей владелицы, и заявляет, что терем на самом деле принадлежал ей. Не выдержав удара, Калашников теряет сознание, а очнувшись, обнаруживает рядом труп Веры. В ужасе мужчина закапывает тело, но раскаивается и приходит в полицию с повинной. Однако Бакшаеву так и не находят, ни живой, ни мертвой. Калашников нанимает частных детективов Макара Илюшина и Сергея Бабкина, чтобы те разобрались в этой странной истории.
Сериал снят по мотивам романа Елены Михалковой из цикла «Приключения Бабкина и Илюшина».","['2019', '(Сериал', 'закончился)']",7.0,"['Евгений Пронин, Алексей Вакулов, Светлана Смирнова-Кацагаджиева, Иван Жвакин, Евгений Славский, Татьяна Казючиц, Татьяна Полонская', 'Россия', '16 +']"
126,https://kino.mail.ru/series_774284_turetskii_dlya_nachinayuschih/,https://resizer.mail.ru/p/fafc498b-8a36-5b8c-a3d3-feafc0444de7/AAAC2Ii9O7WeUFP_hUOx4bUqMQSu0OVWLONHQJ7zOofuQuaVGG_6x6OcjNoB8VhyNkpepENwrbWLYU9BrjONRRKEwGc.jpg,Турецкий для начинающих,['комедия'],"Лена и Нильс — родные брат и сестра, которые воспитываются матерью без отца. Они — самые простые немецкие подростки и они привыкли к такой жизни. Но в один прекрасный день, мать делает им заявление, что она намерена привести в их дом своего возлюбленного, который теперь будет жить с ними. Это храбрый полицейский Метин. Метин — немец с турецкими корнями и также, как и мать Лены и Нильса, он в одиночку воспитывает двоих своих детей — Чема и дочь Ягмур. Чем стремится во всем походить на настоящего горячего турка, а Ягмур — истинная мусульманка, которая ходит постоянно в хаджабе, сторонится мужчин и молится, как и заведено — 5 раз в день. Лена и Нильс испытали шок, ведь теперь Метин, Чем и Ягма будут жить вместе с ними и станут их семьей! И проблемы не заставляют себя долго ждать: Чем и Ягмур пытаются «наставить на путь истинный» Лену, которая обожает откровенные наряды и общение с парнями. А Лена с Нильсом стремятся найти Чему девушку и наладить его личную жизнь. И за всей этой комедией строго наблюдает Ягмур. Немецкий телесериал «Турецкий для начинающих» с триумфом прошел на немецком канале ARD и стал победителем нескольких международных конкурсов.","['2006', '—', '2008']",8.0,"['Йозефине Пройсс, Анна Штиблих, Элиас ЭмБарек, Аднан Марал, Пега Феридони, Арнел Таки, Катарина Каали, Карл Хайнц Хойнски, Эмиль Рейнке, Аксель Шрайбер', 'Германия', '6 +']"
127,https://kino.mail.ru/series_828757_falsifikatsiya/,https://resizer.mail.ru/p/52266d6b-e588-5596-9f5a-649eac798144/AAACx6dpxOrCl5POqrpfW6jVZ3jjW_AWThfcXVNzAMnczaR7vkis4iG59qTEi3UTRvQ8GoEaAEznM5ENyxCJ3WipAKw.jpg,Фальсификация,['комедия'],"Героини сериала «Фальсификация» Карма и Эми — явно не самые популярные девушки в школе. Но, как и все подростки, они буквально помешаны на идее попасть в число лучших девчонок. Однажды на вечеринке их принимают за влюбленную парочку, и подруги поначалу все отрицают. Но внезапный повышенный интерес к их персонам вынуждает Карму и Эми пойти на поводу у школьных товарищей. Лучшие подруги притворяются парой, несмотря на то что им обеим нравятся парни. Но что если им действительно хорошо быть друг с другом?","['2014', '—', '2016']",6.9,"['Грегг Салкин, Бейли Бюнтейн, Майкл Дж. Виллетт, Сента Моусес, Эрика Лопез, Ребекка МакФарланд, Рита Волк, Кэти Стивенс, Кортни Като, Энтони Палашиос', 'США', '12 +']"
128,https://kino.mail.ru/series_924480_hozyaika_gori/,https://resizer.mail.ru/p/4247e4c3-57d6-51df-a7ca-47973a27cd0f/AQACZpQ02FO_WrU03isyMJjeWzoVVROhuLsIxstz88xD3b2YuFE9qSNdX7fLPA6eqNsnxejQp4iV2iIo5qsR4l2hsXc.jpg,Хозяйка горы,['мелодрама'],"Действие ленты разворачивается в 90-е годы в поселке Каменный. Каждый житель поселка знает легенду о Хозяйке горы, зеленоглазой княжне Тумановой, и ее шкатулке с редкими уральскими изумрудами. Во время революции Туманова спрятала свое сокровище и прокляла любого, кто захочет им завладеть. Теперь люди с опаской произносят имя княжны, опасаясь навлечь беду на свой дом. И только местная красавица 17-летняя Аленка бесстрашно бросает вызов Хозяйке горы. В тот же день в шахте ее отец находит шкатулку. С этого момента меняется жизнь не только семьи главной героини, но и всего поселка.","['2021', '—', 'по']",6.9,"['Виктория Толстоганова, Анна Снаткина, Сергей Перегудов, Евгений Пронин, Дмитрий Власкин, Наталья Аринбасарова, Анастасия Куимова', 'Россия', '19 июля 2021 (РФ)']"
129,https://kino.mail.ru/series_894466_holodnoe_blyudo/,https://resizer.mail.ru/p/20e10b0a-c2b4-5fe2-921b-18d3b8594f27/AAAC_LxZB0TXFIvQcvYTvQjfVIAFGoUXn0GRhlYzUAdyOT4UGJXdrC_jAA_es5ea4bmOvcAUMRqxG6qP-FrSzUGVXKA.jpg,Холодное блюдо,['мелодрама'],"Мечты Евгении о долгой семейной жизни рушатся в один миг: ее жених Олег погибает в автокатастрофе. Виновником оказывается сын местного олигарха Константин Стрельцов. Однако связи влиятельного бизнесмена помогают Косте избежать ответственности за совершенное им преступление. Тогда героиня сериала «Холодное блюдо» решает взять правосудие в свои руки. Вместе с заместителем Стрельцова-старшего она разрабатывает хитроумный план, цель которого — обвинить зарвавшегося богатого отпрыска в подготовке заказного убийства.","['2015', '(Сериал', 'закончился)']",,"['Евгения Нохрина, Алексей Демидов, Павел Яскевич', 'Россия', '12 +']"
130,https://kino.mail.ru/series_924673_vlechenie/,https://resizer.mail.ru/p/df582333-aa43-5d88-b9b7-96f191ddaef5/AAACT3yqFjyR4IjtAdt7y7rWsPFG_2mk2wZikvVG-xgdMvzSY62u8aDXRQ2DEC6Viw2zkizBu8i28DQIM6gAYEe54bk.jpg,Влечение,"['детектив', 'мистика']","Марко Маура — глава успешной технологической компании, выпускающей дорогие спорткары. Он популярен, харизматичен, богат и привлекателен. Но совершенно одинок. Его отдушина — закрытый секс-клуб, в который он ходит, чтобы реализовать свои потаенные желания.","['2019', '(Сериал', 'закончился)']",,"['Марио Касас, Ингрид Гарсия Йонсон, Сильвия Алонсо, Мирйам Гальего, Джон Ариас, Бруна Кузи, Оскар Касас, Эльвира Мингес, Лола Дуэньяс, Марко Санс', 'Испания', '16 +']"
131,https://kino.mail.ru/series_917097_zhdite_neozhidannogo/,https://resizer.mail.ru/p/d2026472-2934-5287-b597-36717b73866b/AAACEyeonmptN9T4uz2QTT8WycAyg-mPis0agcCgtq_lFkBoci0j-6V_cy5MLBNB68wx1pbCCM_WuWq-8gCXbYNadRA.jpg,Ждите неожиданного,"['мелодрама', 'детектив']","Таша отправляется в речной круиз в надежде хорошо отдохнуть и набраться сил. Однако долгожданная поездка оборачивается для нее чередой загадочных и пугающих происшествий. Сначала она спасает выпавшего за борт мужчину с собакой, затем у одной из пассажирок пропадает чемодан с драгоценностями, а в довершение ко всему погибает судовой доктор. Таша уверена, что эти события как-то связаны друг с другом, и решает самостоятельно во всем разобраться.
Сериал «Ждите неожиданного» снят по одноименному произведению Татьяны Устиновой.","['2017', '(Сериал', 'закончился)']",6.3,"['Анна Васильева, Сергей Перегудов, Алена Хмельницкая, Андрей Егоров, Эра Зиганшина, Галина Сумина, Сергей Яценюк, Олег Рязанцев, Людмила Бояринова, Андрей Полищук', 'Россия', '12 +']"
