,url,poster,title,ganres,description,year,rating,cast
380,https://kino.mail.ru/series_781810_nebo_i_zemlya/,https://resizer.mail.ru/p/66d01df1-9063-5c87-9dcb-a2f41cfe359b/AAACAPR17gFHBq8Nb9qe6B8kcEKMWvzc2co8WGNigeL9AlPMUOKUkHB-cWzjmlRm2T8DREpHun7tlRq13orMNTWZ4Ew.jpg,Небо и земля,"['мелодрама', 'криминал']","Действие сериала разворачивается в вымышленном российском городе Сурдянске, внутри компании «Авиаком». Главные герои — сотрудники местного аэропорта: пилоты, стюардессы, таможенники, находящиеся по долгу службы между небом и землёй. За их, на первый взгляд, монотонной и обыденной работой скрывается множество драматических событий. То двигатель у пассажирского самолета загорится, то записки с угрозами во время полета обнаружатся, то вместо поисковой собаки обезьяну пришлют. Одним словом, скучать не приходится.","['2004', '(Сериал', 'закончился)']",,"['Владислав Галкин, Мария Голубкина, Екатерина Гусева, Владимир Вдовиченков, Дарья Михайлова, Борис Романов, Александр Балуев, Наталия Фиссон, Елена Ксенофонтова, Александр Подобед', 'Россия', '0 +']"
381,https://kino.mail.ru/series_936694_petroniks/,https://resizer.mail.ru/p/bf97ca99-d7d5-5f1c-812c-84366598b4af/AQACXRWZ6pyqE4CDX0x5CyDzwxXUTWQnMmuJ6ADIuEB4VBeXx2q4fni4hclXplxQ2er6EhkFKN3F5kwUTH-R0sSesvE.jpg,Петроникс,"['приключения', 'для детей', 'мультсериалы']","Французский мультсериал о юных супергероях, спешащих на помощь любым животным, оказавшимся в беде. Мэтт, Джиа, Эмма и Тим из обычных школьников превращаются в волшебных спасателей и помогают всем, от огромного слона до миниатюрной мышки. Отважным малышам не страшны жаркие тропики и холода Антарктиды, ведь они способны выполнить любое задание!","['2022', '—', '2023']",,"['Франция', '0 +', '2022 год (Мир)']"
382,https://kino.mail.ru/series_772459_chempion/,https://resizer.mail.ru/p/10eee9cf-9b62-5638-839c-ca166719aade/AAACB4w4bh0xJUSgmdjIoVsSA8_CKzXUyL4KrDS90JbG78rwtePqDXuag3jQjQ_RdFuXAwKEctkLROpLDZlo8awZXXc.jpg,Чемпион,['мелодрама'],"Главный герой сериала «Чемпион» — футболист Жига (Саша Жигулев), который ради спортивной карьеры бросает свою девушку Тину. Проходит 10 лет. Повзрослевшая, в корне изменившая свою жизнь и даже внешность, Тина вновь встречает Александра. Теперь она — состоятельная дама, жена нефтяного магната, хозяйка клуба, в котором играет Жигулев. Беды, которые она пережила из-за Жигулева, толкают ее на жестокую месть бывшему возлюбленному, но незабытая любовь, в конце концов, берет верх. Оба по натуре — лидеры. Оба предъявляют друг другу суровый счет: Тина из-за Жигулева не может иметь детей, Жигулев из-за козней Тины потерял профессию, которая значила для него больше жизни. Все переплелось в их жизни — любовь и ненависть, страсть и футбол.","['2008', '(Сериал', 'закончился)']",,"['Елена Корикова, Виктор Добронравов, Михаил Мамаев, Олег Шкловский, Евгения Добровольская, Григорий Сиятвинда, Максим Коновалов, Наталья Рычкова, Борис Щербаков, Дарья Белоусова', 'Россия', '16 +']"
383,https://kino.mail.ru/series_934369_chernaya_ptitsa/,https://resizer.mail.ru/p/8e97d5a0-b40a-5baa-8997-fe634fd40cde/AQAChTxU7A0KlILVn6wBGHspy3p7R_9XmFLDdIzNvxo9vKjpHNY_m4cfl87D9oneu7TNUKL03lbveNRZHRqeVcLtC2w.jpg,Черная птица,"['драма', 'криминал', 'триллер']","Сыну полицейского Джеймсу Кину, отбывающему десятилетний срок за продажу наркотиков, предлагают сильно смягчить приговор. Для этого парню необходимо перейти в тюрьму строгого режима, сблизиться с серийным убийцей Ларри Холлом и узнать побольше о преступлениях, в которых тот подозревается. А в идеале — добиться от Холла полного признания. Для Кина это единственный шанс выйти на свободу, но маньяк затевает с ним хитрую психологическую игру. 
Сериал основан на реальных событиях.","['2022', '(Сериал', 'закончился)']",8.0,"['Тэрон Эджертон, Райан Фридкин, Рэй Лиотта, Грег Киннир, Пол Уолтер Хаузер, Джэйк МакЛафлин, Чарльз Грин, Кваджелин Браун, Робин Малкольм, Джеймс ДюМонт, Джо Уильямсон, Роберт Дьяго Дукуй, Александр Бабара, Лоуренс Тернер, Рэйчел Уитман Гровс, Джон Джебели', 'США', '18 +']"
384,https://kino.mail.ru/series_773904_alibi_na_dvoih/,https://resizer.mail.ru/p/13f4020b-534d-5a23-999c-0fb69182c5e7/AAACmPESon_DAEezbvjZge_dEFcbZ595BYG1wnOI68q6AeT-o9MwwrHbug7S04LnLyl_TdbqnglWQiYCx7ENBM7AbeE.jpg,Алиби на двоих,"['комедия', 'детектив']","Вместе с подельником, жулик Гоша решается украсть скрипку Гварнери. Но по причине предательства своего напарника, он остается не только без украденной скрипки, но и оказывается главным фигурантом дела о краже. Это дело ведет младший следователь Вера. Однако вскоре она попадает под увольнение из-за ссоры со своим шефом, подполковником Гузиным. Раскинув мозгами Гоша приходит к выводу, что остаться на воле он сможет лишь сдавшись милиции и оказывая всяческую помощь следствию. Не найдя лучшего варианта, он приходит сдаваться на квартиру к Вере. Мошенник-простофиля и следователь, главные герои сериала «Алиби на двоих», желающий восстановить справедливость берутся за собственное расследование этой кражи. Вас ждут опасные, зачастую даже комические ситуации, которые неизбежно закончатся хеппи-эндом для наших героев.","['2010', '(Сериал', 'закончился)']",,"['Павел Майков, Светлана Антонова, Владимир Стержаков, Александр Воробьев, Алексей Гришин, Денис Яковлев, Михаил Чепуров, Александр Робак, Ольга Ефремова', 'Украина', '16 +']"
385,https://kino.mail.ru/series_836093_bezmolvie/,https://resizer.mail.ru/p/d22d1d40-7402-583d-b52a-65e5c0195eb0/AAAC9wfV3ias4fhcnzVe3EePS_JiIcjC4r332hDBtw4wfoBTOz64vabINr7lidA3I8JcNIPXTh7ozU58rIQBfkaQA-c.jpg,Безмолвие,"['драма', 'боевик', 'криминал', 'триллер']","Герои сериала «Безмолвие» Зеки, Биляль, Ибо и Эджевит — четверо подростков, которые росли вместе и были очень дружны. Но их детство в один момент было разрушено: они попали под следствие и по приговору суда оказались в ужасной тюрьме. Там им пришлось пережить насилие и издевательства, которые наложили отпечаток на всю их последующую жизнь. Выйдя на свободу, герои решили больше никогда не встречаться, но спустя много лет им пришлось увидеться вновь. Они столкнулись с собственным прошлым и оказались не в силах противостоять ему...","['2012', '(Сериал', 'закончился)']",,"['Сарп Аккая, Мерт Асутай, Пелин Догру, Мурат Гарибагаоглу, Тугай Мерджан, Аслы Энвер, Мурат Йылдырым, Барис Онер, Мехмет Озгюр, Берк Хакман', 'Турция', '16 +']"
386,https://kino.mail.ru/series_835659_bronetehnika/,https://resizer.mail.ru/p/ffb22358-5cb5-5d14-bcdf-0999980bb7d3/AQACGpzMRaU7ZeiNVmMoa44uBQijhP2um7Nbm7I_Re_FZbYTqewRQY8z4Dpsp-Ndp5jVTS1-KogE8H82nUd_eg3CSVU.jpg,Бронетехника,"['документальный', 'исторический', 'военный']","Документальный цикл научно-популярных фильмов посвящен истории создания и боевого применения легендарных и наиболее интересных образцов военной техники времен Второй мировой войны. Сериал «Бронетехника» охватывает следующие темы: особенности конструкции, инженерные решения, сравнительная оценка, различная экспериментальная техника и многое другое. Также приведены подробные тактико-технические характеристики. Фильм содержит огромное количество хроникальных кадров, ранее недоступных широкому зрителю.","['2010', '(Сериал', 'закончился)']",8.0,"['Россия', '6 +', '2010 год (РФ)']"
387,https://kino.mail.ru/series_913999_genii/,https://resizer.mail.ru/p/83a21c68-85d5-554b-8923-2d9d9b160a98/AAACLEsqzfIiV2viTSCGXho5HPdxQcup6cMHRCmNARIoZmSU7cG-j4J9k4Oh-_OZwTmTs55_i-pBhwa4xyEIGB60yhA.jpg,Гений,"['драма', 'исторический', 'биография']","Американский сериал-антология, рассказывающий о выдающихся исторических личностях, и первый художественный сериал канала National Geographic. Каждый сезон не связан с предыдущими и раскрывает детали биографии известного человека, который считается гением в своей области.
Главный герой первого сезона — знаменитый ученый-физик Альберт Эйнштейн, его взлеты и падения и открытие теории относительности. Второй сезон посвящен долгой и насыщенной жизни испанского художника Пабло Пикассо. В центре третьего сезона — американская певица, «королева соула» Арета Франклин. Центральными персонажами четвертого сезона стали борцы за права чернокожих Мартин Лютер Кинг и Малкольм Икс.","['2017', '—', 'по']",6.8,"['Джеффри Раш, Джонни Флинн, Эмили Уотсон, Саманта Колли, Майкл МакЭлхаттон, Николас Роу, Клара Иссова, Юджин Саймон, Алисия фон Риттберг, Сильвия Бухбайер, Джордж Уэбстер, Люси Чаппель, Тейлор Фрост, Джошуа Хоган, Джон Флетчер', 'США', '12 +']"
388,https://kino.mail.ru/series_925533_govoryaschii_tom_i_druzya/,https://resizer.mail.ru/p/a5cc662b-d524-58a4-971f-ed2402d844ac/AQACY27DBqloMuxGlMueq8RDRLrlQo-nCE2HR0_wWVTDwArhlqWPNBmdPt9rQ6A5XoI6sRG8bmx5iQbxN10myCliWgk.jpg,Говорящий Том и Друзья,"['комедия', 'для детей', 'семейный', 'мультсериалы']","Том — гениальный кот, у которого всегда есть грандиозные идеи. Он проводит целые дни в гараже вместе с друзьями Беном, Анджелой, Джинджер и Хэнком и разрабатывает игру, которая принесет ему мировую славу и богатство. Том трудится изо всех сил, но ему часто приходится отвлекаться, ведь вокруг происходит столько захватывающего и интересного.
Мультсериал основан на популярной мобильной игре для детей «Говорящий Том».","['2014', '—', '2020']",,"['Колин Хэнкс, Том Кенни, Джеймс Адомиан, Лиза Шварц, Мария Бэмфорд, Дэйв Уиллис, Джордж Бэк, Лорейн Ньюмен, Данна Фейнгласс Фирман, Карлос Аласраки', 'Кипр', '6 +']"
389,https://kino.mail.ru/series_847893_dar_nebes_14_dnei/,https://resizer.mail.ru/p/ae091a25-6439-5535-9e4f-83eed0c750f6/AAACq9hGcSUh4vEaVpbh-Ahj0JbC5rGFJG5Rktiwz2GaRujU3AA9_9Ip2SN5tIuDZgvY60wl7XyoEc22Mlk4m_JEaZo.jpg,Дар небес: 14 дней,"['драма', 'триллер', 'детектив']","Ким Су Хен пережила страшную трагедию: ее девятилетнюю дочь похитили и жестоко убили. Женщина вне себя от горя. Но небеса дают ей шанс вернуться в прошлое, чтобы спасти своего ребенка. У нее есть всего лишь две недели на то, чтобы найти убийцу и предотвратить страшные события.
В поисках дочери героине сериала «Дар небес: 14 дней» будут помогать заботливый и внимательный муж — Ким Тэ У, частный следователь — Чо Сын У, детектив и первая любовь Су Хен — Чон Ге Ун. Несмотря на такую поддержку, женщина не может никому доверять, ведь каждый из них может оказаться убийцей.","['2014', '(Сериал', 'закончился)']",,"['Ли Бо-ен, Чо Сын-У, Ким Тхэ-у, Чон Гю Ун, Баро, Чон Ын Пё, Кан Щин-иль, Гу Шин, Чже-ук Ён, Ю Бин Ким', 'Южная Корея', '16 +']"
390,https://kino.mail.ru/series_777194_dva_korolya/,https://resizer.mail.ru/p/9af6c18d-a193-5e7a-9984-8a7ee94cb0d0/AAACmj3JLt0W3ZhxD7vE3e5cUhsimAYisiuzvlOKjzb8puIFQdGy984oyn0PMvVvVFARymi8Cbwykcb8YVQfRFFVREg.jpg,Два короля,['комедия'],"Сериал рассказывает о двух братьях Бреди и Бумере, паре 16-летних двойняшек, воспитываемых тётей и дядей в Чикаго и живущих обычной жизнью. Когда Мейсон, королевский советник острова Кинкоу прибывает в их школу, они узнают, что являются наследниками престола короля острова. После того как Мейсон рассказывает Бреди и Бумеру об их происхождении, они начинают понимать, что их жизнь может кардинально измениться. Братья переезжают в Кинку (американская часть Полинезии), чтобы властвовать над островом, который хранит множество обычаев и суеверий. Вскоре оказывается, что трон должен был занять только старший брат, но кроме родителей, которые уже умерли, никто не знает, кто из двоих близнецов — Бреди или Бумер — старше, поэтому у острова Кинкоу будет два короля.","['2010', '—', '2013']",,"['Райан Очоа, Лерреми Док Шоу, Келси Чоу, Гено Седжерс, Митчел Муссо, Дж.Д. Хайэм, Адам Хикс, Ясин Джефферис, Тони Страдлин, Джеймс Хонг', 'США', '6 +']"
391,https://kino.mail.ru/series_772914_dorogaya_masha_berezina/,https://resizer.mail.ru/p/77b4fadd-288b-52ea-b6c2-7e91acbba123/AAACeVj_1jcHrConcwmV3oTiABAD3QLBJeo4JIpPTXqFdzniUc552m5DHyqf1DqS-w-kHZiPJ_T9srzEm82Sji1pn0w.jpg,Дорогая Маша Березина,['мелодрама'],"Маша Березина окончила обычную московскую школу и поступила на работу в модельное агентство, решив попытать счастья на подиуме. Через восемь лет упорного труда бывшую скромную школьницу уже не узнать — русская модель покорила Париж, Милан, Лондон, Берлин… работала с лучшими домами моды. Но вот она решает вернуться в Москву. За прошедшее время многое изменилось. Она встречается с подругами, с одноклассниками, даже с первой школьной любовью — Димой Романовым. Увидев перед собой звезду из другого мира, Дима рассказывает Маше, что всё это время скучал по ней, и признается в любви, надеясь на взаимность. Но сердце Маши уже занято другим. В откровенном разговоре с родителями она признается, что во Франции у нее остался годовалый ребенок, а отец ребенка — Венсан де ла Ранта, владелец международного модельного агентства, — готов на всё, чтобы вернуть Машу во Францию. «Дорогая Маша Березина» — российский оригинальный мелодраматический телесериал производства компании Амедиа. Снимали сериал по американской технологии: съемки велись параллельно с эфиром.","['2004', '(Сериал', 'закончился)']",4.8,"['Анна Азарова, Валерий Николаев, Мария Шукшина, Александр Тютин, Борис Невзоров, Валерий Гаркалин, Олег Басилашвили, Виктор Вержбицкий, Елена Бондарчук, Степан Морозов, Александр Песков', 'Россия', '12 +']"
392,https://kino.mail.ru/series_798293_zakon_i_poryadok_otdel_operativnih_rassledovanii/,https://resizer.mail.ru/p/693110c3-3ed7-5502-9625-0d1dc70ed292/AAAC-q0Ocv9C251zuyCAmc18RgKbGna-K-mq8wamO3g79hWe-NZxgnZw3iA46IMJueQ73m25_X17pHeWPtmhURu51DU.jpg,Закон и порядок: Отдел оперативных расследований,"['драма', 'криминал', 'детектив']","Сериал «Закон и порядок» — российский вариант одного из самых удачных проектов американского телевидения. В основе российской версии сериала — американский сценарий, полностью адаптированный под русский язык, юридическую систему и российские реалии. «Закон и порядок» — динамичный и эмоциональный сериал, описывающий работу нескольких детективов, пытающихся раскрыть преступления, совершенные на сексуальной почве.","['2006', '—', '2010']",6.7,"['Алиса Богарт, Елена Березнова, Дмитрий Брусникин, Максим Глотов, Анна Данькова, Марина Ерисова, Марина Капралова, Роман Кириллов, Татьяна Мазур, Юрий Маслак, Иван Оганесян, Павел Меленчук, Инна Пиварс, Валерий Трошин, Владимир Фирсов, Виталий Хаев', 'Россия', '16 +']"
393,https://kino.mail.ru/series_935855_kiber_ivan/,https://resizer.mail.ru/p/9466ae0c-422b-59b6-8d98-6026ea37f7e4/AQACYTwdJwaIuGBh_AxEKMd0F4RJ7Essb_ywRurnfPqVSUa3Wsx-Jr6WUu_a8ZybtTX_y7hTG5U1Uv5iTtAbRfAF7pw.jpg,Кибер Иван,['комедия'],"Иван — актер-неудачник, которому не очень везет в профессии и в жизни. А его отец — инженер-изобретатель, который создал уникального андроида-помощника «И-One» с внешностью своего сына. Когда Иван случайно ломает новенького робота, ему достается первая по-настоящему серьезная роль: герою предстоит отправиться в дом регионального министра инноваций Бориса, которому предназначался первый «И-One», и изображать андроида. Иван постоянно борется с риском разоблачения, который вырастает десятикратно, когда юноша влюбляется в своенравную дочь чиновника.","['2023', '(Сериал', 'закончился)']",6.4,"['Александр Метелкин, Камиль Ларин, Янина Студилина, Дмитрий Астрахан, Анастасия Акатова, Анжелика Каширина, Сергей Неудачин, Андрей Назимов, Борис Дейков', 'Россия', '16 +']"
394,https://kino.mail.ru/series_931786_koteika/,https://resizer.mail.ru/p/27651d6f-6b40-51e4-ad8a-e3ca9f31b469/AQACN0EDXV8sPPKAmLnUcemVNmzV0GcRgxdp7TT1_g1vXfcKjvPyEMzyURjEWkkIQr83wevzFar_zBuL6UqauxAOV8s.jpg,Котейка,['детектив'],"Ветеринар Катерина днюет и ночует в клинике. В одну из смен ей приносят больную кошку, найденную на улице. Катерина выясняет, что причина недомогания кошки — отравление. Понимая, что кошка домашняя, Катерина начинает поиски владелицы «котейки» и оказывается втянута в расследование убийства.","['2021', '(Сериал', 'закончился)']",6.3,"['Мария Машкова, Анна Тараторкина, Дмитрий Миллер, Даниил Спиваковский, Антон Вохмин, Ксения Радченко, Сергей Черданцев, Валентина Нейморовец, Владислав Дунаев, Константин Шелягин, Эдуард Галеев', 'Россия', '16 +']"
