,url,poster,title,ganres,description,year,rating,cast
252,https://kino.mail.ru/series_784575_lednikov/,https://resizer.mail.ru/p/2bb5e6ef-17b6-5ac6-9f3a-a176f1acbc03/AAAC3MfPgbRxbVv93bkskPEk_R-JIs5Wf0R6RnBgFxNHoVLGBoD4R0NVarZV0gZ-b83NCtF17T3K4rs7b0XBuyJpH1c.jpg,Ледников,"['драма', 'криминал', 'детектив']","Главный герой сериала «Ледников» — в прошлом блестящий следователь прокуратуры. Пережив тяжелую психологическую травму, он работает криминальным журналистом и, вопреки желанию ни во что не ввязываться, раскрывает преступления быстрее своих старых знакомых из УВД.
Сериал снят по мотивам произведений Александра Звягинцева.","['2013', '(Сериал', 'закончился)']",7.3,"['Андрей Чернышов, Станислав Дужников, Вячеслав Разбегаев, Елена Захарова, Наталья Рычкова, Михаил Тарабукин, Полина Сидихина, Анастасия Клюева, Павел Делонг, Юлия Ковалева', 'Россия', '16 +']"
253,https://kino.mail.ru/series_939150_leto_1990/,https://resizer.mail.ru/p/0924ec1c-8b97-59ff-af5f-a3011a739746/AQACFjJ7yfsbAMqlmlnphku7pp-vbm9SeDAA0ZV1swMUR5ckYj9wk1OdHscV9L7gLmICFlVVd2uFgsSl3BwjhQq_wgY.jpg,Лето 1990,"['драма', 'триллер', 'мистика']","Летом 1990 года Элио пережил тяжелую психологическую травму: во время похода с друзьями исчезла девушка, в которую он был влюблен, — Арианна. Элио был настолько шокирован и подавлен, что его разум вытеснил воспоминания о случившемся. Спустя 30 лет герою приходится все же столкнуться со своим прошлым: тело Арианны находят на территории старого лагеря, а Элио становится главным подозреваемым. Как юрист Элио прекрасно понимает, как выглядит и чем грозит его «избирательная» амнезия. Но вскоре происходит нечто странное: Элио попадает в автокатастрофу и переносится в то самое лето 1990 года — в себя 18-летнего. У мужчины появляется шанс выяснить, что произошло с Арианной, и предотвратить трагедию.","['2023', '(Сериал', 'закончился)']",6.8,"['Лино Гуанчале, Филиппо Скотти, Клаудия Пандольфи, Николь Гримаудо, Антония Фотарас, Паоло Пьеробон, Анна Ферцетти, Джиневра Франческони, Алессио Пратико, Тобиа Де Ангелис, Мартина Гатти', 'Италия', '18 +']"
254,https://kino.mail.ru/series_797287_moya_devushka_kumiho/,https://resizer.mail.ru/p/b66be0fa-388a-5de5-aee4-256011d2f7a2/AQACXLB089-GT2QABV2QxWWG51q3cB6kh5RG33_a1iyGnpPGIIAO5jrhWeu58tjJBDuUN1VvqV-wQoFl3Y7j0zFhEm0.jpg,Моя девушка – кумихо,"['мелодрама', 'фэнтези', 'комедия']","Пять веков назад в наш мир пришла кумихо. В отличие от остальных лис, жестоких и коварных существ, питающихся человеческой печенью, она желала стать человеком. Но ее нечеловеческая красота стала проклятьем. Женщины, которые не могли вынести того, что их мужья и сыновья очарованы кумихо, обратились к ее бабушке с просьбой лишить лисицу подобных сил... 500 лет томилась дева, заточенная в картину до тех пор, пока ее не спас Чха Тхэун — молодой человек, удравший из семьи ради того, чтобы стать актером. Образ главной героини сериала «Моя девушка — Кумихо» основан на корейских мифах.","['2010', '(Сериал', 'закончился)']",7.9,"['Шин Мин А, Ли Сын Ги, Но Мин У, Пак Су Чжин, Сон Дон-иль, Мин Чжун Хён, Чон Ун Тхэк, О-ми На, Пак Син Хе, Пён Хи-бон', 'Южная Корея', '16 +']"
255,https://kino.mail.ru/series_759461_schaste_po_retseptu/,https://resizer.mail.ru/p/19683d98-1d92-587c-8f1e-d67f2c0d69bd/AAAC5aJVPQfe6-O9yvF0Z3y59AzTdh1sQn07g0ArB00G3Xn6X-S3bii9jm55nObfkpOICvEt3Lbka2aFi4Y6EcgX_J4.jpg,Счастье по рецепту,['мелодрама'],"Элла — успешная женщина, востребованный адвокат, но ужасно неудачливая в личной жизни. Она не имеет ни минуты свободного времени и вертится, как белка в колесе, а между тем ее бестолковый бойфренд вечно пытается спихнуть свои проблемы на хрупкие женские плечи. Знакомые и друзья бессовестно намекают уставшей от ежедневной беготни Элле, что пора бы ей заняться своим внешним видом. Но она не желает выслушивать пустые советы и уверена, что со всем справиться сама. В основе сюжета «Счастье по рецепту» лежит любовный роман Екатерины Вильмонт «Курица в полете».","['2006', '(Сериал', 'закончился)']",7.4,"['Евгения Добровольская, Екатерина Васильева, Владимир Симонов, Ада Роговцева, Елена Проклова, Игорь Бочкин, Ирина Апексимова, Игорь Золотовицкий, Антон Кукушкин, Юлия Жданова', 'Россия', '12 +']"
256,https://kino.mail.ru/series_796927_hozyaika_sudbi/,https://resizer.mail.ru/p/6bc24fae-875c-57b2-a029-00f29fa8e315/AAACUMqG4JQuTyQJ_uo33jmt96ONxMxHdQp3lgtYUs9CYOHE_f1TbyEpXOooQ0We9AjJRuFD9dvGEtgbOm4ijvHVsZA.jpg,Хозяйка судьбы,['драма'],"«Хозяйка судьбы» на сегодняшний день самый рейтинговый сериал 2000-х годов в Бразилии.
Он состоит из двух частей: в первой события происходят в 1968 году, а во второй действие переносится в наши дни. Мария ду Карму — бедная женщина из маленького городка Белен де Сан-Франсишку — бьется изо всех сил, чтобы как-то прокормить своих пятерых детей. Ее муж год назад уехал на заработки в Сан-Паулу. С тех пор от него нет вестей. Находясь почти на грани отчаяния, Мария с детьми решает отправиться в Рио-де-Жанейро, где живет ее брат, в надежде найти работу. Преодолев нелегкий путь почти через всю страну, герои сразу же оказываются в гуще трагических событий 1968 года. В стране военный переворот: на улицах танки, вооруженные солдаты, протестующий народ, флаги, крики, дым. Потеряв в суматохе клочок бумаги с адресом брата, Мария ду Карму не представляет, как его отыскать и что делать. Судьба наносит ей жестокий и незаслуженный удар: в этом хаосе у Марии крадут новорожденную дочь...","['2004', '—', '2005']",7.1,"['Сюзана Виейра, Жозе Вилкер, Жозе Майер, Рената Сорра, Каролина Дикманн, Леонарду Виейра, Эдуарду Московиш, Леандра Леал, Марселло Энтони, Летиция Спиллер', 'Бразилия', '12 +']"
257,https://kino.mail.ru/series_914761_volnaya_gramota/,https://resizer.mail.ru/p/df3fab40-a3d2-53d7-8e96-57f2369fcab3/AAAClYnSCetG-YGUuIydulJZkg4-SZRK9vBL91GIUZyixnIqK_3_JrhZ1Ddfk97VSfvv1aLaZByt2dcK_WShRZTroRI.jpg,Вольная грамота,"['мелодрама', 'исторический']","Главная героиня сериала «Вольная грамота» — Полина Лебедева — воспитанница бездетного князя Алексея Петровича Головина и самая завидная невеста Ямбургского уезда. Но судьба уготовила девушке нелегкие испытания. Во время бала в ее часть Алексей Петрович умирает от внезапного сердечного приступа. Полина, образованная, воспитанная как подобает барышне, числится крепостной и вместе с другой собственностью князя переходит во владение непутевого племянника покойного, игрока и пропойцы Сергея Головина. Чтобы покрыть карточные долги, новый владелец имения спешно продает его вместе со всеми крепостными душами соседу и давнему врагу дяди — графу Кречетскому. Уездное общество теперь смотрит на Полину с презрением, жених предает, а новый хозяин настойчиво добивается близости...","['2018', '(Сериал', 'закончился)']",7.1,"['Татьяна Бабенкова, Артем Крылов, Владислав Абашин, Иван Добронравов, Ксения Разина, Артем Ткаченко, Владислав Ветров, Катарина Шпиринг, Иван Шибанов, Анна Лутцева, Александра Власова, Александр Обласов, Николай Качура', 'Россия', '19 февраля 2018 (РФ)']"
258,https://kino.mail.ru/series_793534_muzhchina_korolevi_in_hyon/,https://resizer.mail.ru/p/e88c5f8a-5478-5ed9-a4b2-5e97f8802843/AQACqgRuj8i4tnqTRA5tN0pUvMZzeWBMSDxOll-xNKJ88cN1CvtbzWqa6gSQBqdk7u-oxuCqrALR1MD3OIkr-rBhmSo.jpg,Рыцарь королевы Ин-хен,"['мелодрама', 'фантастика', 'комедия']","Главный герой корейской фантастической мелодрамы «Мужчина королевы Ин Хён» — ученый Ким Бун До, который живет в эпоху Чосон. Именно вокруг него и развиваются все события. Жизнь Ким Бун До — одно сплошное приключение. В прошлом он помог воссесть на трон королеве Ин Хён, но не так давно в королевстве случился переворот. Законная королева стала жертвой коварного заговора и была свергнута, а вместо неё престол был отдан любимой наложнице короля Сукчона. Это очень осложнило жизнь и самого Ким Бун До, ведь именно он способствовал приходу к власти Ин Хён. Но ученый не намерен просто так отдавать власть и он придумывает оригинальный способ изменить существующее положение вещей. Ким Бун До намерен отправиться на 300 лет вперед и так он попадает в наше современное время, оказавшись в Сеуле. Здесь он знакомится с молодой и привлекательной актрисой Чхве Хи Чжин. Она только начинает свою карьеру и имеено ей досталась роль королевы Ин Хён, в фильме, съемки которого должны вот-вот начаться.","['2012', '(Сериал', 'закончился)']",7.5,"['Ким Джин-у, Ю Ин На', 'Южная Корея', '16 +']"
259,https://kino.mail.ru/series_764114_vozdeistvie/,https://resizer.mail.ru/p/ef8bce32-37fc-50ba-b0e5-3b9508b9fda5/AAACmaqERz4BKw96DnY6MXiVIT8BUOVcrS-IMMHvXA1CP4oOfhhDbxbA9J4fzap198avpga3Mx7ovSgyotqQt9XAdmU.jpg,Грабь награбленное,"['боевик', 'криминал', 'детектив']","Нейт Форд, бывший следователь страховой компании, возглавляет команду в которую входят актриса и мошенница Софи Деверо, специалист широкого профиля Эллиот Спенсер, воровка Паркер и хакер Алек Хардисон. Эта команда помогает людям, пострадавшим от рук нечистоплотных богачей или, если вежливо, — сильных мира сего, а попросту — воров. Их работа требует не только своебразного набора познаний и навыков, но и осторожности. Выкрадывать обратно то, что уже было украдено, — опасное занятие. Например, к Нейту Форду обращается за помощью управляющий аэрокосмической корпорации. У него украли его секретные стратегические разработки. Форд и команда возвращают разработки. И тут — их главным врагом становится заказчик, пытающийся избавиться от тех, кто слишком много знает.
Сериал «Воздействие» (или «Грабь награбленное») впервые вышел на экраны в 2008 году и по плану должен был ограничиться одним сезоном, однако после успешного дебюта был продлен.","['2008', '—', 'по']",7.9,"['Тимоти Хаттон, Джина Беллман, Кристиан Кэйн, Бэт Рисграф, Элдис Ходж, Марк Шеппард, Джери Райан, Питер Робертсон, Шон Гудел, Джералд Дауни', 'США', '12 +']"
260,https://kino.mail.ru/series_856229_derevenschina/,https://resizer.mail.ru/p/25a89633-60d3-5b9d-89f7-4d4fd9a264d8/AAACjtKE_XayHgGMlZI5kHjHqQv-L9HEot_PDPUp-oAekdbd0zgdelTzwDgIQJ7KYr74waGeljV3QTtdf964T84UyKg.jpg,Деревенщина,['мелодрама'],"Простая и скромная девушка Лида (Анна Михайловская) живет с мамой в деревне. После окончания школы она мечтает стать стюардессой и решает поехать в столицу к отцу, ученому-химику. Папа встречает Лиду с радостью, но его высокомерная жена и капризные дочери не в восторге от приезда деревенской родственницы... Сможет ли главная героиня сериала «Деревенщина» воплотить свою мечту и найти счастье в городе?","['2014', '(Сериал', 'закончился)']",6.7,"['Анна Михайловская, Александр Константинов, Дмитрий Пчела, Елена Бирюкова, Даша Русакова, Виталий Герасимов, Вера Васильева, Евгений Редько, Марина Есипенко, Вероника Вернадская', 'Россия', '12 +']"
261,https://kino.mail.ru/series_770984_molodozheni/,https://resizer.mail.ru/p/1a552b2c-0352-549a-bf38-11f91fe3a1c9/AAACa83_WNq9VFH6osNIXX7wPUC_FmPYWY4XXjsahKQrflkgD22rRKLyDUK0FQOH4uULMySL87053kSoV2tbWm5R5pc.jpg,Молодожены,['комедия'],"Гланвые герои сериала «Молодожены» — Лера и Лёша. Они искренне любят и заботятся друг о друге. Они прожили в браке год. Лёша работает водителем-курьером, а Лера — секретарем в юридической фирме. Они живут в Химках в Подмосковье. Лера зовет мужа в столицу, но Лёше нравится жить в Химках. Их семейная лодка так и идет по волнам: то вверх, то вниз. Они постоянно пытаются выяснить, кто же лодкой управляет и куда она, собственно, должна плыть. Так их дни и проходят — за решением бытовых проблем и выяснением отношений. Но всё это кажется неважными мелочами, ведь им ещё нет и 30 лет, так что серьезная семейная жизнь ещё может и подождать. И пока они только задумываются о наследниках, у них появляется один очень вредный «ребенок». Это Лерин отец Андрей Петрович, ему около 60. Он ещё очень бодр и полон жизни, и конечно же, он лучше знает, как надо жить, чем часто взвихряет и без того бурную жизнь молодой семьи.","['2011', '—', '2012']",5.4,"['Оскар Кучера, Любовь Тихомирова, Илья Олейников, Дмитрий Ермак, Иван Шмаков, Пётр Маркин, Татьяна Пискарева, Андрей Капустин, Мария Сластенкова, Александр Суворов', 'Россия', '16 +']"
262,https://kino.mail.ru/series_786332_turisti/,https://resizer.mail.ru/p/bfef3dd6-3925-5d11-9130-6f3dbb7d4a50/AAACwtICl3QTpbYfGb6o5Tc14TLI3B3xfOfOJyoFyyLpwBG2dDKHVD-J71QLlgfTZcfx_QB0hhnixN7OdJB_7EZKRmQ.jpg,Туристы,['комедия'],"Сюжет сериала «Туристы» закручивается вокруг группы российских туристов, отправившихся на отдых в Турцию. Море в Турции кажется очень голубым, а базары — бесконечными. Здесь разворачиваются курортные романы, а служащие отелей пытаются нажиться на глуповатых туристах. Сериал расскажет о непростых отношениях между героями Ольгой и Артуром, которые попадут в детективную ситуацию.","['2005', '(Сериал', 'закончился)']",6.4,"['Александр Макогон, Ольга Фадеева, Сергей Астахов, Валерий Прохоров, Александр Карпов, Алексей Федотов, Борис Щербаков, Владимир Фоков, Нина Персиянинова, Александра Живова', 'Россия', '12 +']"
263,https://kino.mail.ru/series_911496_kaznit_nelzya_pomilovat/,https://resizer.mail.ru/p/7350a993-2369-5e4d-a62f-16126b828518/AAACOSPrNtrsKEJ_RbUZpCtYoMV4gHNjbeDi5CtTNof5CijsG5V8rAfmaCVuGjf3bOuMn64UcaZOoIKdWPrak6XcOF4.jpg,Казнить нельзя помиловать,"['исторический', 'детектив']","Бывшая разведчица Нина Колосова после войны оказывается в Ленинграде, где царят преступность и криминал. Любимого мужа Нины убивают прямо на улице. Поняв, что милиция не способна разобраться в этом деле, героиня решает самостоятельно вычислить и наказать злодеев. Хладнокровно расстреливая воров и убийц, героиня наводит ужас на город. За расследование совершенных ею преступлений берется майор Борис Грановский.","['2017', '(Сериал', 'закончился)']",7.4,"['Мария Кожевникова, Дмитрий Паламарчук, Дмитрий Астрахан, Максим Меркулов, Кирилл Рубцов, Андрей Перович, Сергей Кудрявцев, Надежда Некрасова, Сергей Яценюк', 'Россия', '6 декабря 2017 (РФ)']"
264,https://kino.mail.ru/series_770031_grach/,https://resizer.mail.ru/p/67ad0d6b-9271-5c9f-a05d-42f4506d8971/AAACrJoXlvA3D2r1UDAJeRO3Eam-avfxegxYxERd9T1GIvpL8AzgIV3Z6Yek-3clX_Od6uUJk3yOLkWWEI2tlQRrsqw.jpg,Грач,"['триллер', 'детектив']","Операция по освобождению заложников заканчивается для майора МВД Сергея Грачева по прозвищу Грач трагически — его тяжело ранят в голову. Врачи не могут прооперировать его, и пуля остается в голове майора. Грач выживает, но после ранения его жизнь кардинально меняется.
Во время операции Грач пережил клиническую смерть и на себе испытал все те ощущения, о которых говорят люди, побывавшие на грани жизни и смерти. После этого он начал видеть мертвых. К майору приходят призраки невинно убитых людей, убийцы которых и по сей день гуляют на свободе безнаказанными. Грачев чувствует, что обязан помочь этим душам обрести покой, и с помощью даваемых ими подсказок он начинает повторное расследование «висяков». Это влечет за собой большие проблемы как на работе, так и в личной жизни майора. От него уходит супруга, его увольняют со службы. Но Грач чувствует, что обратной дороги нет, ведь призраки не оставляют его в покое — они просят найти виновников их смерти.
Российский сериал «Грач» основан на телевизионном фильме «Греко».","['2012', '—', '2013']",7.4,"['Павел Трубинер, Светлана Иванова, Игорь Старосельцев, Алексей Лонгин, Александр Баширов, Иван Охлобыстин, Вадим Демчог, Дмитрий Марин, Ангелина Добророднова, Илья Трусковский, Ирина Вилкова, Юлия Мельникова', 'Россия', '16 +']"
