,url,poster,title,ganres,description,year,rating,cast
120,https://kino.mail.ru/series_776823_dalnoboischiki/,https://resizer.mail.ru/p/fa4d0350-990d-5d10-94ba-5cce4a3455a8/AAACSR2E_hDKwKOz4kAl9Qa6ffiFnqpIdcQZ8Iqe9_LyFBhcH5X-SGmHA_PZjBkzSY10VC46Fzkr6rehsvwauyK_WcA.jpg,Дальнобойщики,"['драма', 'мелодрама', 'комедия', 'боевик', 'приключения']","Для любого дальнобойщика рейс — это не только доставка груза из пункта А в пункт Б, но и маленькое приключение. По пути встречаются разные люди со своими историями, поэтому говорят, что дальнобойщики хорошо знают жизнь. Федор, который много лет работает на фуре, получает в напарники молодого парня Сашу, который кажется ему слишком легкомысленным и беззаботным. Конфликт поколений перерастает в ссоры и стычки, но постепенно каждый из них проникается глубоким уважением друг к другу. Федору и Сашке предстоит пережить немало приключений в долгой дороге.","['2001', '—', '2011']",7.2,"['Владимир Гостюхин, Владислав Галкин, Иван Агапов, Кристина Бабушкина, Ярослав Бойко, Николай Чиндяйкин, Ольга Дегтярева, Юрий Дуванов, Михаил Глузский, Борис Химичев, Сергей Шеховцов', 'Россия', '16 +']"
121,https://kino.mail.ru/series_922592_sinii_traktor/,https://resizer.mail.ru/p/0e6b1c88-f19d-5603-9fa2-a3b8539f4b66/AAAC38qDeckKUXAuCCMRVFT4T8q1qY6bHr_d9uNsys6AmSZzxtakhRtyQprKIwlQwGlIdwzC46DJSYU7nL0r-_3vW3Q.jpg,Синий трактор,"['для детей', 'мультсериалы', 'музыкальные']","В каждом эпизоде сериала «Синий трактор» в игровой форме и с помощью веселой песенки объясняются различные понятия: названия окружающих нас явлений и предметов, цвета и формы, «право» и «лево», размеры и расстояния. В мультсериале можно встретить разных персонажей, но один из них появляется чаще других — это любимый детьми и их родителями жизнерадостный Синий трактор.","['2014', '—', '2016']",6.8,"['0 +', '2014 год (РФ)', 'Артур Днепровский']"
122,https://kino.mail.ru/series_925030_devushki_s_makarovim/,https://resizer.mail.ru/p/b0974012-6716-58ab-870d-b2d2c84d3478/AQACaJCvY47NIp4jdvahD-Stbh5XTRzIT-4Z2tVI4TsfhdHMC2dAUG7Jyg8Bbb0G5sqIcgTAWrkrBvFaPjPnkgp_S9Y.jpg,Девушки с Макаровым,"['комедия', 'криминал']","Из-за конфликта с руководством Павлу Макарову, лучшему полицейскому худшего района Москвы — Капотни, — в качестве стажеров дают четырех молодых выпускниц вуза. Неопытные, но дерзкие девушки раздражают Макарова, пытаясь отстоять свое право служить в полиции. Матерый оперативник, у которого всегда были напряженные отношения с женщинами, всеми силами пытается избавиться от подопечных.","['2021', '—', 'по']",6.9,"['Павел Майков, Алевтина Тукан, Валерия Астапова, Влада Ермолаева, Елена Полянская, Георгий Дронов, Дмитрий Лысенков, Андрей Пынзару, Сергей Астахов, Никита Тарасов, Олеся Судзиловская, Наталья Бардо, Андрей Финягин, Нелли Неведина, Руслан Ягудин, Михаил Кремер, Татьяна Орлова, Максим Иванов', 'Россия', '16 +']"
123,https://kino.mail.ru/series_805810_korolyok_ptichka_pevchaya/,https://resizer.mail.ru/p/4698b1e7-1bc3-5168-bd08-e34c062f0528/AQACZ2iq__bVauPwbmfcdzWVExrU1eNPSo9xIUo60BsE9yu738p1V1yxkj2lq2X-wzWkEEG_Lmc5Q56-2pcnb5mJPOs.jpg,Королек — птичка певчая,"['драма', 'мелодрама', 'исторический']","Главная героиня сериала — Фериде, которую в детстве прозвали корольком за непоседливость, осталась сиротой. Она учится в пансионе, а каникулы проводит в доме своей тетки Бесиме вместе с кузенами Неджмие и Кямраном. Проходят годы, и повзрослевшая Фериде влюбляется в своего кузена, который стал врачом. Обычно открытая, живая и вспыльчивая, Фериде скрывает свои чувства и подчеркнуто вежливо общается с Кямраном. Сможет ли юная Фериде стать счастливой и обрести взаимность? Сериал «Королек — птичка певчая» снят по мотивам одноименного романа Решата Нури Гюнтекина.","['2013', '(Сериал', 'закончился)']",7.1,"['Фахрийе Эвджен Озчивит, Пынар Чаглар Генчтюрк, Гюнес Хаят, Эбру Хелваджиоглу, Бурак Озчивит', 'Турция', '16 +']"
124,https://kino.mail.ru/series_902137_olga/,https://resizer.mail.ru/p/0bc4d40d-dd8f-5037-ad1e-8e6290c0eda3/AAACYkGn5NKEqvSfHGsZTg2xEZ5dqsa6yqYpv6TdhOY-yU1z-DZw-k2nCvdMjSayvWW88FLt8ZLy-FLiCHjIp2YyBhs.jpg,Ольга,['комедия'],"Главная героиня комедийного сериала — жизнерадостная женщина Ольга (Яна Троянова), в одиночку воспитывающая двоих детей, отцы которых забыли об их существовании. Судьба каждый день испытывает героиню сериала «Ольга» на прочность. Проблемы на работе сменяются новыми сюрпризами, которые преподносят сестра и отец, неравнодушный к алкоголю. Но Ольгу не пугают сложности...","['2016', '—', '2023']",7.2,"['Яна Троянова, Фархад Гусейнов, Василий Кортуков, Алина Алексеева, Ксения Суркова, Максим Костромыкин, Сергей Романович, Филипп Ершов, Мухаммед Абу-Ризик, Роза Хайруллина, Юра Борисов, Павел Майков', 'Россия', '16 +']"
125,https://kino.mail.ru/series_930735_cherno_belaya_lyubov/,https://resizer.mail.ru/p/bc9cb9f0-7767-5b62-bf4c-2e54ffa977ec/AQACLlrcQKDHnEmJOcp13c4cFQejniYxAvVMJKkaT3CNiHlZh3yE3bMe5vthVbsaOz9KGuJZ3ywIaJ-eMYtNfKlTz10.jpg,Черно-белая любовь,"['драма', 'мелодрама', 'боевик']","Аслы — врач, спасающая людям жизни. А Ферхат — человек, зарабатывающий на жизнь тем, что убивает людей. Их пути пересекаются, когда Аслы насильно привозят в загородный дом, чтобы она провела операцию раненому. Но девушка случайно становится свидетельницей убийства, и теперь сама должна умереть. Однако у Ферхата не поднимается рука убить ее, поэтому мужчина дает Аслы шанс на спасение.","['2017', '—', '2018']",6.9,"['Ибрагим Челиккол, Бирче Акалай, Мухаммет Узунер, Джахит Гок, Эдже Диздар, Дениз Джелилоглу, Тимур Олкебаш, Синем Унсал, Арзу Гамзе Килинч, Нихан Асичи, Озлем Зейнеп Динзел, Бурчу Каврар, Гехан Сойлу, Угур Аслан', 'Турция', '16 +']"
126,https://kino.mail.ru/series_760249_zhizn_i_priklyucheniya_mishki_yaponchika/,https://resizer.mail.ru/p/7fa7d06f-75bb-5e1a-b188-97d1d5f23c5d/AAACCAmd_HXbH8eXL-N3evG-34SksGgVdZy5uur9JOPfBWJv5VsbxL9EoV2tbGl3u179I9tMwICdcx7Ao4KwhMMIPr8.jpg,Жизнь и приключения Мишки Япончика,"['драма', 'мелодрама']","Три года из жизни известного одесского вора-налетчика, действовавшего в начале XX века. Стать королем воров, держать в страхе весь город и одновременно быть народным любимцем мог только человек неординарный. Его популярность была колоссальна — в нем видели «Робин Гуда», который радеет за народ, он утвердил свой «кодекс налетчика»: бедняков не грабить, не трогать врачей, юристов, артистов. Его налеты становятся все более артистичными и остроумными, как маленькие спектакли. Япончик расчетлив, рационален, но у него широкая душа: он закатывает пиры для всей Молдаванки, материально обеспечивает безработных грузчиков, помогает деньгами и продуктами молодоженам, сиротам, бездомным и даже семьям жертв бандитских налетов. Сериал «Жизнь и приключения Мишки Япончика» впервые был показан на российском телевидении в 2011 году.","['2011', '(Сериал', 'закончился)']",7.6,"['Евгений Ткачук, Валентин Гафт, Артем Ткаченко, Игорь Савочкин, Олег Школьник, Ирина Токарчук, Екатерина Рубашкина, Сергей Романович, Валерий Бассэль, Елена Шамова', 'Россия', '16 +']"
127,https://kino.mail.ru/series_788174_korabl/,https://resizer.mail.ru/p/f4946dee-7289-5586-892c-b86736538230/AAACKTPU7BTieFOVWg6_9oLSVJXqxyip_PqZmg76W2j2s5PfBuwCPHNStqPAvxTVlD7Q0uqEGnOW7iXMdYAMIH5zvss.jpg,Корабль,"['мелодрама', 'фантастика', 'приключения']","Двадцать молодых курсантов на учебном парусном судне «Бегущая по волнам» отправляются в плавание, готовые веселиться дни напролет, но их беззаботный отдых длится недолго. Взрыв, произошедший в Большом адронном коллайдере, приводит к глобальной катастрофе, в результате которой все материки уходят под воду. Возможно, единственными выжившими людьми на планете оказались пассажиры «Бегущей по волнам». Корабль становится их единственным домом. Правила жизни меняются. Никто не знает, что будет завтра.
Спутники цивилизации: города с людьми, магазины с продуктами и компьютеры с интернетом — все бесследно исчезло. Вместо этого — цунами, рыбы-мутанты, вулканы и дикие птицы. Героям предстоит растягивать провизию на неопределенный срок и делить с друзьями последнее яблоко. Но со временем все эти проблемы теряют значение. У курсантов есть парусник, надежное плечо друга и шанс найти настоящую любовь. Все чувства обостряются, а страсти начинают закипать, ведь каждый день может быть последним.
Российский сериал «Корабль» является адаптацией популярного испанского телесериала «Ковчег».","['2014', '—', '2015']",5.9,"['Дмитрий Певцов, Илья Любимов, Владимир Виноградов, Роман Курцын, Ирина Антоненко, Юлия Агафонова, Агриппина Стеклова, Ингрид Олеринская, Матвей Зубалевич, Сергей Друзьяк, Александр Пугачев', 'Россия', '16 +']"
128,https://kino.mail.ru/series_767044_rim/,https://resizer.mail.ru/p/79e303d4-ed7f-5b29-9722-09f9b436c396/AAACWhCZedcRneHpN-Ed6uglPERrS9owUjR3gk8ynIOIO6T5Hqk_czhkrxO1o5t6dwZ-ShyCuzlZODRNkZm2wdvJ2zM.jpg,Рим,"['драма', 'мелодрама', 'боевик', 'исторический', 'военный']","52 год до н.э.: после восьмилетней войны Гай Юлий Цезарь завоевал Галлию и готовится возвращаться в Рим. Племянница Цезаря Атия с тревогой ждет его возвращения. Патриции в смятении — они боятся, что возвращение Цезаря нарушит статус-кво, что их благополучию, которого они добились за счет притеснения плебса, будет положен конец. В сенате лидеры патрициев убеждают старого друга Цезаря, Помпея, что Цезарь представляет угрозу для процветания Рима. В это время два незадачливых легионера, Люций Варен и Тит Пуло, затевают авантюру, которая, в случае успеха, значительно повысит их благосостояние. Чем ближе легионы Цезаря к Риму, тем выше напряжение в отношениях солдат и мирных жителей — близится к развязке конфликт, который навсегда изменит историю. Сериал «Рим» был снят по заказу «Би-би-си» на итальянской киностудии «Чинечитта».","['2005', '—', '2007']",8.1,"['Кевин МакКидд, Рэй Стивенсон, Полли Уокер, Керри Кондон, Джеймс Пьюрфой, Иэн МакНис, Корал Амига, Линдси Дункан, Лидия Бионди, Тобайас Мензис', 'США, Великобритания', '18 +']"
129,https://kino.mail.ru/series_914771_krovavaya_barinya/,https://resizer.mail.ru/p/46f009fa-460f-561d-ac22-d5525a6a9e86/AAACJQn9fvTmgHYug3GRRSO8OQF9WdjXAv97o3ri0m93nDoiGZE95KshnZc4JUcVXgEGpcwgVdinOJnauLxqE2WfzrE.jpg,Кровавая барыня,"['драма', 'исторический']","В центре сериала «Кровавая барыня» — история жизни Дарьи Салтыковой, прозванной крепостными Салтычихой. Помещица зверски замучила около полутора сотен крестьян, за что «русская Эржебер Батори» была заключена в земляной тюрьме, где провела 33 года вплоть до своей смерти.","['2018', '(Сериал', 'закончился)']",7.4,"['Юлия Снигирь, Марта Кесслер (Тимофеева), Федор Лавров, Сергей Шеховцов, Александр Никольский, Кристина Бабушкина, Екатерина Копанова, Юрий Цурило, Северия Янушаускайте, Петр Рыков, Юрий Шлыков, Влад Соколовский', 'Россия', '16 +']"
130,https://kino.mail.ru/series_929730_bdenie/,https://resizer.mail.ru/p/cf0390f0-f5ff-55d3-8138-974c4c93fb0c/AQAChlUAsIAt4dq0ymZwj1PIxC6mnPm91EjJj1nptq89eOlGeucFv6fv2EViLmGcFKyZIeQ4lW6kfmGfvKpKDeM5QFw.jpg,Дежурство,"['драма', 'триллер']","Шотландский рыболовный траулер исчезает без следа. На борту атомной подводной лодки «Трайдент» совершено убийство. Эти два не связанных на первый взгляд события приводят к конфликту между американским военно-морским флотом и британскими спецслужбами. Расследование на суше и на море ведет детектив Эми Сильва. Она обнаруживает заговор, который угрожает всей британской политике ядерного сдерживания.","['2021', '(Сериал', 'закончился)']",6.8,"['Сюранна Джоунс, Лолита Чакрабарти, Адам Джеймс, Роуз Лесли, Рубен Джозеф, Орла Рассел, Лорни МакФадьен, Кэл Макэнинк, Шон Эванс, Коннор Суинделлс', 'Великобритания', '18 +']"
131,https://kino.mail.ru/series_790144_klon/,https://resizer.mail.ru/p/defd8ea6-5b3e-546f-98a9-b8066d39b37c/AAACR_yqJmPpfD9IxUoWJVLBxkBtYvimgp2pneLhBYys8QJ0Bk78QnZPyzODZYi8GEo0D5bNk-kH5TjWdkmBuq5oo94.jpg,Клон,"['мелодрама', 'фантастика']","18-летняя красавица Жади (Джованна Антонелли), выросшая и воспитанная в Бразилии, после смерти матери вынуждена переехать в Марокко, в семью своего дяди Али (Стениу Гарсия). Веселой и жизнерадостной Жади неуютно в чужом мире. Теперь ей мучительно приходится привыкать к тому, чего не было в прежней, счастливой, жизни: новому дому, незнакомым людям, другой культуре. Но именно там она встречает свою любовь. Знакомство с молодым бразильцем Лукасом Ферраза (Мурилу Бенисиу), приехавшим в Марокко вместе с отцом, предпринимателем Леонидасом (Реджиналду Фариа), и братом-близнецом Диогу (Мурилу Бенисиу) вызвало в душе Жади чувства, доселе ей не знакомые. Лукас и Жади полюбили друг друга с первого взгляда…
Сериал «Клон» впервые в истории бразильской телеиндустрии подробно показывает уклад мусульманской семьи, затрагивает тему клонирования и наркотической зависимости.","['2001', '—', '2002']",7.2,"['Мурило Бенисио, Джованна Антонелли, Вера Фишер, Режинальдо Фария, Даниэла Эскобар, Адриана Лесса, Неуза Боржес, Жандира Мартини, Марселлу Новаес, Маркус Фрота, Лусиано Шафир, Стенио Гарсиа', 'Бразилия', '16 +']"
132,https://kino.mail.ru/series_761493_oboroten/,https://resizer.mail.ru/p/8d5185ad-4d1a-5c82-b980-0fb2cb1125de/AAACfPoPX9ts50U7aa-0g4WVL1KFpeU1MNifpptqafx3MRov74XYflplXNLzICaRDm_axzL7WjUBge11Ab1OcaKrWbk.jpg,Оборотень,"['драма', 'мелодрама', 'комедия', 'ужасы', 'триллер']","Шестнадцатилетний подросток Скотт МакКолл ночью оказывается в лесу, где на него нападает зверь, напоминающий волка. Вскоре Скотт начинает замечать в себе некоторые изменения — в несколько раз улучшается слух, растет сила, развиваются способность к быстрой регенерации и ускоренные рефлексы. С помощью своего лучшего друга Стайлза Стилински и загадочного оборотня Дерека Хэйла он должен научиться контролировать себя, чтобы суметь защитить свою семью, друзей и девушку Эллисон Арджент от Альфы — оборотня, который обратил его. Мистический сериал «Волчонок» был снят на волне успеха и по мотивам одноименного фильма и вышел на экраны в 2011 году.","['2011', '—', '2017']",7.6,"['Тайлер Пози, Кристал Рид, Дилан О’Брайен, Холлэнд Роден, Колтон Хэйнс, Тайлер Хэклин, Линден Эшби, ДжейАр Борн, Мелисса Понцио, Эдди Уильямс', 'США', '16 +']"
133,https://kino.mail.ru/series_759169_karpov/,https://resizer.mail.ru/p/bb4b1c67-cefc-537f-be4a-3d488af3f55c/AAACczwtYvXTXS40wsDCqUE44fE7AAceeUk0WvPgKVqMrG1shIKIS0crAaWArli4S-roxbPkTz4bruTCCoTEfNpPuRI.jpg,Карпов,"['драма', 'криминал', 'детектив']","Подполковник в отставке Стас Карпов выходит из психиатрической лечебницы. Лишившись положения, друзей, денег, бывший подполковник пытается исправить прошлые ошибки и найти свою новую судьбу. Расшатанная психика и преследующие кошмары не дают ему жить нормальной жизнью. Карпов устраивается на работу охранником на складе. Он постепенно восстанавливает связи и тяжело возвращается к работе. Увидев криминальный репортаж по телевидению он узнаёт одного из тех, за кем охотятся правоохранительные органы. Карпов решает снова вернуться в ряды борцов с преступностью, занявшись частными расследованиями, и начинает формировать свою команду. К помощи детектива прибегают обычные граждане и силовые структуры, его известность растёт. Неожиданно в его доме появляется девушка Лера, которая называет Стаса Карпова своим отцом...
Сериал «Карпов» — спин-офф популярного телесериала «Глухарь», вышел на экраны в 2012 году.","['2012', '—', '2014']",7.5,"['Владислав Котлярский, Степан Рожнов, Виктория Тарасова, Николай Козак, Дмитрий Блажко, Максим Щеголев, Юлия Майборода, Анна Михайловская, Ольга Кузьмина, Сара Окс', 'Россия', '16 +']"
