,url,poster,title,ganres,description,year,rating,cast
355,https://kino.mail.ru/series_773061_kto_v_dome_hozyain/,https://resizer.mail.ru/p/e6e810bc-a767-5c30-aa21-39bbb88595d9/AAACUgdMEj-Z1Mz0ceVvA0-fiwmohyOJUUnh722HyNLtSyHEYDG3Lb_PV-qW8j4OD72jJzNyx_VLtVW-TKhYtwsXNeI.jpg,Кто в доме хозяин?,"['комедия', 'семейный']","Никита Воронин — бывший футболист, оставивший спорт из-за травмы. Чтобы обеспечить своей дочери Веронике достойное образование, он вынужден искать новую работу, а вместе с ней и жилье, вдалеке от родного города Вавиловска — в Москве. И Никита находит эту работу, но назвать ее «мужской» можно лишь с большой натяжкой. Провинциальный отставной футболист Hикита стал домохозяином в доме успешной бизнесвумен Дарьи. Какие отношения сложатся между этими непростыми людьми — и представить невозможно! Стирка, уборка, кухня и другие домашние дела — таков теперь круг обязанностей бывшей звезды футбола, ведь у его хозяйки нет времени даже на воспитание сына Жени — Дарья поглощена своей карьерой и бизнесом. Симпатия между главными героями сериала «Кто в доме хозяин?» неизбежна, но возникает она далеко не сразу. Отношения хозяйки и домоработника развиваются по законам жанра, и до наступления счастливой развязки зрителю предстоит провести много веселых часов в компании героев. Картину дополняют инфантильный сынок Дарьи — Женя и бойкая дочка Никиты — Вероника, а также мама хозяйки Антонина Петровна. Эта женщина совершенно не собирается стареть, неплохо владеет подростковым жаргоном, на равных общается с внуком, одевается по последней моде и хочет быть в курсе всех дел.","['2006', '—', '2008']",6.0,"['Людмила Артемьева, Дарья Бондаренко, Ярослав Гарнаев, Анна Невская, Андрей Носков, Сергей Бадичкин, Мария Баева, Эвелина Бледанс, Сергей Векслер, Петр Винс, Лидия Арефьева', 'Россия', '12 +']"
356,https://kino.mail.ru/series_759985_tatyaninden/,https://resizer.mail.ru/p/bbeb1fc7-fd7a-5e6e-94f3-7fa1f08a094e/AAACbvtBhpz6jww78H7nmV4aIQZFa6ffUN4pGF5Amybaya-bzkjhXZDSsCrnBYAuC09Nija4wbnOhxvJrJYMcSgVO34.jpg,Татьянин день,['мелодрама'],"Татьяна Разбежкина вместе с матерью переезжает из Саратовской области в столицу, выиграв конкурс студенческих работ. Татьяна — умная и целеустрёмленная девушка, но по-провинциальному наивная, и это ей мешает. В столичном институте Татьяна знакомится с избалованной дочерью богатого и влиятельного чиновника Татьяной Бариновой, которой суждено стать её главной соперницей. Две Татьяны заводят крепкую дружбу и даже начинают делиться друг с другом тайнами из личной жизни. Таня Разбежкина, не скрывая восторженных чувств, рассказывает о знакомстве со своим новым коллегой. Некоторое время назад она в поисках заработка устроилась на работу в одну строительную фирму. Таня Баринова, в свою очередь, рассказывает подруге о мужчине, который нравится ей самой. Через некоторое время одной из девушек становится понятно, что всё это время они рассказывали друг другу об одном и том же человеке. Сергей же, узнав, что его новые пассии Татьяны — лучшие подруги, решает продолжать вести двойную игру...
Сериал «Татьянин день», вышедший на экраны в 2007 году, — это адаптация колумбийской мелодрамы La Guerra de las Rosas («Война Роз»), ранее с успехом прошедшей в Латинской Америке.","['2007', '—', '2008']",5.8,"['Анна Снаткина, Наталья Рудова, Кирилл Сафонов, Наталья Данилова, Валентина Панина, Вадим Колганов', 'Россия', '12 +']"
357,https://kino.mail.ru/series_841171_smeshariki_novie_priklyucheniya/,https://resizer.mail.ru/p/ab87641c-a425-5644-9ee3-43f60bfcb633/AAAClQJHBsiSlmhmUa29o7f22c7Py3mPySHohCEWky_ETGym71SjAQ7POleC5XzTIIy1vDc_xgKibiZfhfdsZdFkEOw.jpg,Смешарики. Новые приключения,"['приключения', 'для детей', 'мультсериалы']","Крош, Ежик, Бараш, Нюша и другие жизнерадостные круглые друзья продолжают веселиться, путешествовать и познавать мир, постоянно попадая в разнообразные нелепые и смешные ситуации. В мультсериале «Смешарики. Новые приключения» старые знакомые предстают в новом трехмерном формате.","['2012', '—', '2013']",7.2,"['Владимир Постников, Вадим Бочанов, Ксения Бржезовская, Светлана Письмиченко, Сергей Мардарь, Михаил Черняк, Сауле Искакова', 'Россия', '0 +']"
358,https://kino.mail.ru/series_765608_hor/,https://resizer.mail.ru/p/86baf919-3693-514c-a940-af395709c4e9/AAACpXVVAVkDfu7oZPr5GiRZgvcQiB2sS_uKeDEAeTv2SAz7Su8jxjYJetWWNffTIja4k3sxr9-ZpgCmuh-OrY7p8ZQ.jpg,Хор,"['драма', 'комедия', 'музыкальные']","Молодой и талантливый преподаватель испанского языка Вилл Шустер пытается возродить к жизни школьный хоровой кружок. Во времена, когда он сам был учеником, слава хора гремела на весь штат. Теперь это пристанище для неудачников и аутсайдеров — тех, кого не берут на модные школьные тусовки. Поначалу, несмотря на старания учителя, хор привлекает по большей части лишь тех, кто подвергается издевкам со стороны одноклассников. Но постепенно Шустер раскручивает хор и к нему присоединяются другие участники, уже не испытывающие проблем в отношениях со сверстниками. Становясь командой, хористы обретают уверенность в себе и вырабатывают иммунитет против циничных шуточек одноклассников, привыкших делить мир на «популярных» и «неудачников». Сериал «Хор», также известный под названием «Лузеры», впервые вышел на экраны в 2009 году и номинировался на множество престижных премий.","['2009', '—', '2015']",7.2,"['Брэд Фалчук, Кори Монтейт, Мэттью Моррисон, Крис Колфер, Джейн Линч, Дианна Агрон, Ная Ривера, Джейма Мейс, Эмбер Райли, Кевин МакХэйл, Марк Саллинг, Лиа Мишель, Грант Гастин', 'США', '18 +']"
359,https://kino.mail.ru/series_924870_psih/,https://resizer.mail.ru/p/c0111f84-454a-5cf2-a21f-721ea7eb6f3f/AAACeO_52VYh0Nf1xc3wHmxjUBH84KbTIrpa1DxkDD9QqT4ExDLro1PLbF_6B89KcpkYk6r9_FgwKEQ_XOtiuWKwB48.jpg,Псих,['драма'],"К известному столичному психотерапевту Олегу в очередь выстраиваются пациенты со всего центрального округа Москвы. Однако ему самому не помешала бы помощь. Медикаментозная зависимость, кризис среднего возраста, раздражительность и нарастающая агрессия уже стали его постоянными спутниками. Однако все меняется, когда Олегу приходится оказывать людям экстренную психологическую помощь.","['2020', '(Сериал', 'закончился)']",6.7,"['Константин Богомолов, Елена Лядова, Анна Чиповская, Роза Хайруллина, Марина Александрова, Ксения Раппопорт, Александр Горчилин, Олег Меньшиков, Игорь Верник, Евгения Громова, Владимир Симонов', 'Россия', '18 +']"
360,https://kino.mail.ru/series_772922_chernie_volki/,https://resizer.mail.ru/p/ee8bdcf2-56d9-534d-80db-a4a63865534e/AAACd8pNqG7HCWhOvVk02yuAjgXs5V5Zokk_08hJzUJMrMRHXBUXSr3ZuviMPfEOJC1QOuE5IcwKH3e5E-gbpUTmdfU.jpg,Черные волки,"['драма', 'криминал', 'детектив']","Действие криминального сериала «Черные волки» происходит в Ярославле в пятидесятых годах прошлого века. Главный герой, бывший следователь УГРО Павел Хромов (Сергей Безруков), был осужден на восемь лет за преступление, которого не совершал. Освободившись, Павел узнает, что его сестру убили «Чёрные волки», — так провинциальные жители назвали организованную группировку, которая держит в страхе весь город. На месте преступления, как черную метку, бандиты оставляют волчью голову. Хромову предстоит найти и обезвредить банду и вернуть себе честное имя капитана милиции. Съёмки фильма проходили в Переславле и Ярославле, в реальных бараках, домах и квартирах (павильонных съёмок не было). За основу сценария взята история о несуществующей воинской части, которую возглавлял аферист высшей пробы полковник Павленко. Банда «Чёрные волки» и Павел Хромов были придуманы автором сценария.","['2011', '(Сериал', 'закончился)']",7.6,"['Сергей Безруков, Александр Коршунов, Дарья Мороз, Владимир Юматов, Владимир Капустин, Александр Голубев, Алена Хмельницкая, Дмитрий Мухамадеев, Анатолий Кот, Кристина Бабушкина', 'Россия', '16 +']"
361,https://kino.mail.ru/series_769317_volshebniki_iz_veiverli_pleis/,https://resizer.mail.ru/p/0a8467fd-af99-56b0-839a-44b48ae774fb/AAACRq9nVBU2fxxqNMpqnxxYmItIoiwHJCxh2rfhNypLw3ei0mfQpHzP2T5fYU317Nt6ArIXn23_DCBFizwRXlTV3-M.jpg,Волшебники из Вэйверли Плэйс,"['фэнтези', 'комедия', 'семейный']","Тереза и Джерри Руссо живут в Нью-Йорке и воспитывают троих детей подросткового возраста. С первого взгляда их семья кажется совершенно обычной, типичной американской семьей. Но это лишь на первый взгляд. Их дети, как и все американские подростки, любят разного рода шалости и приколы, как все они влюбляются и дружат, и, конечно же, ходят в школу. Однако, на самом деле их отличает от обычных мальчишек и девчонок очень существенная деталь: Макс, Джастин и Алекс — волшебники! Обычные подростки не летают на коврах-самолетах и не умеют останавливать время. Старший из всей троицы — Джастин — прилежно пытается овладеть всеми премудростями магического искусства. А вот его сестра Алекс не так усердна и часто из-за несколько нескладного применения своих волшебных способностей попадает в затруднительные ситуации. Ну а младший брат Макс и вовсе не намерен сильно обременять себя знаниями. И всё было бы хорошо, если бы не маленькое но … Достигнув 18-летия только один из них сможет сохранить свои магические способности, тогда как остальные двое их попросту утратят. Так кто же станет тем избранным? Сериал «Волшебники из Вэйверли Плэйс» производства канала Дисней так же имеет полнометражный вариант «Волшебники из Вэйверли Плэйс в кино».","['2007', '—', '2012']",6.9,"['Селена Гомес, Дэвид Генри, Джейк Т. Остин, Дженнифер Стоун, Мария Кэнелс-Баррера, Дэвид ДеЛуис, Дэн Бенсон, Билл Чотт, Грегг Салкин, Йен Эберкромби', 'США', '6 +']"
362,https://kino.mail.ru/series_937333_slovo_patsana/,https://resizer.mail.ru/p/a3d67e94-bbff-5e2e-88d7-89ecc42e8725/AQACbLUAWubGycyTxhZoRNV4fw7H47YvAUPuZ3vQDY6H0ovaW9GbRle3Sa0DWD1nyKtLw_hTF67-oZzJeJxy8fHDxZY.jpg,Слово пацана. Кровь на асфальте,['драма'],"Действие сериала разворачивается в конце 1980-х. В стране кризис и нищета, перестройка в разгаре, Советский Союз умирает, а вместе с ним старые правила и ограничения, но появляются свобода, предчувствие перемен и надежды на будущее. Главный герой Вова возвращается из Афганистана и понимает, что привычного ему мира больше не существует. Ему нужно найти место в новой реальности, в которой взрослые люди борются за выживание, а их брошенные дети сбиваются в уличные группировки и бьются друг с другом за территории и право контролировать все, что на них происходит.","['2023', '(Сериал', 'закончился)']",7.7,"['Иван Янковский, Леон Кемстач, Рузиль Минекаев, Сергей Бурунов, Елизавета Базыкина, Никита Кологривый, Лев Зулькарнаев, Анастасия Красовская, Анна Пересильд, Иван Макаревич, Ярослав Могильников, Григорий Дудник, Ольга Лапшина, Юлия Александрова, Антон Васильев, Даня Киселев, Артем Борзовский, Роман Борзовский, Слава Копейкин, Варвара Куприна, Андрей Максимов', 'Россия', '18 +']"
363,https://kino.mail.ru/series_765353_ubiistvo/,https://resizer.mail.ru/p/b91c961a-3c2a-5998-93ec-0df47d00c68f/AAACdVsiPEHlnZUdpdS_ak1wT6Q6o8naRvunON3XurFwHaYolHHJjcqsH_3MOvfL8ayKh7tzOJXjRUK4G8ECv_78DFo.jpg,Убийство,"['драма', 'криминал', 'детектив']","Жестокое убийство молодой девушки Рози Ларсен влечет за собой затяжное полицейское следствие. Детектив Сара Линден, собиравшаяся вслед за женихом переехать из Сиэтла в Калифорнию, вынуждена остаться, чтобы расследовать это дело. Первое подозрение падает на Джаспера — молодого распутного богача, который встречался с Рози, и его друга Криса, распространителя наркотиков, который был с Рози на вечеринке в ту ночь, когда она пропала без вести.
«Убийство» является американским ремейком одноименного датско-шведского сериала, вышедшего на экраны в 2007 году.","['2011', '—', '2014']",8.0,"['Мирей Инос, Юэль Киннаман, Брент Секстон, Мишель Форбс, Билл Кэмпбелл, Кристин Леман, Эрик Ладин, Джэми Браун, Том Батлер, Кэти Финдлей, Элиас Котеас', 'США, Канада', '16 +']"
364,https://kino.mail.ru/series_890178_tabu/,https://resizer.mail.ru/p/84306ec3-be07-57de-8362-24c4de730040/AAACITpOdaRA5SVNugFVxGKMhGYxUB-HUQEwcj4A_yCuOGL_ahljSkEHmnswMLW9UBSNPBgS2oa-LfW_9MNFrhhKlKg.jpg,Табу,"['драма', 'криминал', 'исторический', 'приключения']","Действие драматического сериала начинается в 1813 году. Путешественник Джеймс Делейни (Том Харди) возвращается в Англию. Авантюрист везет из Африки алмазы, которые добыл нечестным путем. Джеймс хочет отомстить за смерть отца, в которой виновата могущественная Ост-Индская компания, мечтающая заполучить семейный бизнес Делейни. Главный герой сериала «Табу» затевает опасную игру, вступая в противодействие с могущественной компанией. Джеймс начинает расширять собственную торговую фирму, оказавшись в эпицентре борьбы двух крупных держав, Америки и Великобритании...","['2017', '(Сериал', 'закончился)']",7.9,"['Том Харди, Джонатан Прайс, Уна Чаплин, Лео Билл, Дэвид Хеймен, Ричард Диксон, Майкл Келли, Марк Гейтисс, Эдвард Хогг, Джесси Бакли, Джейсон Уоткинс, Стивен Грэм, Франка Потенте', 'Великобритания', '18 +']"
365,https://kino.mail.ru/series_911650_rasskaz_sluzhanki/,https://resizer.mail.ru/p/4458439f-4260-54a5-a0c9-a743574bfcdf/AAACgSxdZRglSy-659do0CGP29ZVdkqFOuTKOJoEmzrgOW9xr9S0c45dzHVktLHtpAf62pnOFeNLOeDWaxZRZDtTeYI.jpg,Рассказ служанки,"['драма', 'фантастика']","Республика Галаад когда-то была частью США, но в результате военного переворота к власти пришли религиозные фундаменталисты и установили диктатуру, при которой всем заправляют исключительно мужчины, а единственное предназначение женщины — родить здорового ребенка от своего хозяина, Командора. Однако из-за катастрофической экологической обстановки многие женщины стали бесплодными, а те немногие, кто еще способен выносить ребенка, объявляются собственностью государства. Они живут в специальных лагерях, где их готовят к зачатию и рождению детей для представителей привилегированных слоев населения. Одна из них — Оффред (Элизабет Мосс), которая оказывается в лагере после неудачной попытки бегства из Галаада.
Сериал «Рассказ служанки» снят по мотивам одноименного романа Маргарет Этвуд.","['2017', '—', 'по']",7.3,"['Элизабет Мосс, Джозеф Файнс, Самира Уайли, Энн Дауд, Ивонн Страховски, Макс Мингелла, Алексис Бледел, О. Т. Фагбенли, Аманда Бругел, Мадлен Брюэр, Грэйс Манро', 'США', '18 +']"
366,https://kino.mail.ru/series_787716_dmb/,https://resizer.mail.ru/p/016a0087-dd90-5a26-b972-98bb995ec7fc/AAACBmUP_bT2ZL1g11kxqIKvqTqA5bSD7Xnv4i4Ylm9dQO0hBuYZfTT_9wZf9vi-0J-vxnSFiayLFHO4NeOShJ3x4gc.jpg,ДМБ,['комедия'],"На призывном пункте судьба сводит совсем не похожих друг на друга парней. Один — бывший студент, отправившийся по повестке, после того, как переспал с женой декана прямо на кафедре в аудитории. Другой — рабочий с завода. Вот только работать ему больше негде, потому что по его вине завод сгорел дотла. Третий — в долгах как в шелках, и спасение от занудливых кредиторов одно — армия. В армии их всех научат, как стать настоящими мужчинами. В продолжении телевизионного фильма «ДМБ» был снят мини-сериал состоящих из четырёх серий: «ДМБ-002», «ДМБ-003», «ДМБ-004» и «ДМБ-снова в бою». Полюбившихся героев снова ожидают нелепые ситуации, наряды вне очереди и многие другие приключения.","['2000', '—', '2001']",7.2,"['Виктор Павлов, Сергей Арцибашев, Петр Коршунков, Станислав Дужников, Алиса Гребенщикова, Сергей Петров, Игорь Письменный, Михаил Полицеймако, Алексей Ошурков, Владислав Копп', 'Россия', '16 +']"
