,url,poster,title,ganres,description,year,rating,cast
125,https://kino.mail.ru/series_905440_semeinii_albom/,https://resizer.mail.ru/p/4d381e15-1374-5944-8c4d-c9f001d13afe/AAACoqQ2sdE3_KgvJEP6kF6GsBBGtXXzY5SjLUyKrzK4bMQBFJ2OsJnRiWaGIIydRbH54yyl8W_n5-7bbDTyJo5GlRc.jpg,Семейный альбом,"['мелодрама', 'исторический', 'семейный']","Действие семейной саги начинается в 1950-годы под Ленинградом. Академик Колокольцев с супругой, сыном, его женой и двумя внучками, Катей и Олей, живут на даче. Колокольцев-младший является известной фигурой в области физики, он успешно трудится над новым проектом. Но неожиданно проект, результат которого должен произвести настоящую революцию в научном мире, закрывают. А вскоре и сам Колокольцев объявляется погибшим при странных обстоятельствах. Герои сериала «Семейный альбом» оказываются перед сложным нравственным выбором: остаться ли верными родине и семье или же предпочесть карьеру и новые увлечения?","['2016', '(Сериал', 'закончился)']",7.7,"['Игорь Скляр, Татьяна Черкасова, Даниил Страхов, Екатерина Олькина, Ксения Суркова, Иван Шибанов, Борис Романов, Эра Зиганшина, Евгений Сидихин, Зоя Буряк', 'Россия', '12 +']"
126,https://kino.mail.ru/series_792762_klassnaya_shkola/,https://resizer.mail.ru/p/864d40cd-d47e-5ef7-a8df-ab8cc87a117f/AAACB07yvPyQwOPzIlyBpNIYVgJOBTpQBFJANnN8hF-pPW0rQCnd90e67dbwuCKGh3jNwWJmE7cezBk2Z61NO4rygj8.jpg,Классная школа,"['комедия', 'скетч-шоу']","«Классная школа» — динамичное скетч-шоу для школьников разного возраста, а также их родителей. Каждый выпуск — это один день из жизни школы. Место действия — обычная-необычная школа. Обычная потому, что все ситуации и герои знакомы каждому школьнику. Необычная — в ней преподают не совсем обычные преподаватели, которые максимально изобретательно подходят к своим предметам.","['2013', '(Сериал', 'закончился)']",6.6,"['Петр Винс, Алёна Галлиардт, Павел Кабанов, Михаил Богдасаров, Ольга Николаева, Иван Орлов, Роман Хан, Денис Ясик, Руслан Щедрин, Анастасия Завитухина', 'Россия', '6 +']"
127,https://kino.mail.ru/series_773417_legavii/,https://resizer.mail.ru/p/7f70ad4e-51fd-5d50-bf5a-240ef772c538/AAAC0n-_E8BWGmIqgI7pNUwqNvda14lwoyQ2CnbxKLwYJd0WRgXTD8VCe0vBJUkzfnXfUCZX3GU6AlViyVS37oJHbDY.jpg,Легавый,['детектив'],"Действие сериала происходит в 1948 году. Бывший фронтовой разведчик, капитан Юрий Козырев (Эдуард Флёров), попавший в плен в последний день войны и получивший за это срок, выходит из лагеря. Теперь он полностью оправдан и восстановлен в правах. Но возвращение домой не приносит ему большой радости. Юрий узнает, что его отец пропал без вести на фронте, мать умерла, а любимая девушка Лариса вышла замуж за другого...
В остросюжетном сериале «Легавый» трудности послевоенного быта сменяются новыми расследованиями. Юрий становится частью весьма опасного треугольника между бывшими товарищами по оружию, коллегами по новой службе и преступниками.","['2012', '—', '2013']",7.6,"['Эдуард Флеров, Михаил Павлик, Николай Козак, Оксана Гуляева, Анастасия Макеева, Елена Коровчук, Анатолий Кот, Игорь Филиппов, Александр Резалин, Михаил Горевой', 'Россия', '16 +']"
128,https://kino.mail.ru/series_771214_napoleon/,https://resizer.mail.ru/p/1731e2ec-6e69-5d54-b8d4-b1de36c76e45/AAACRJgy0zMfrJtGkUqDPYb53JWbI05-Adgwk0U4qE7c6mCWA8J8pD8HZFifOPuoprpoc_H1_vpbk2gY7scgN0Nq8dk.jpg,Наполеон,"['драма', 'исторический']","Сериал «Наполеон» где, молодой доблестный генерал французской республики, командующий Итальянским корпусом в 1795 году, Наполеон Бонапарт направляется в Египет, чтобы пронести славу французской революции по Северной Африке. Благодаря таланту и невероятным человеческим качествам Наполеон к 1798 году покоряет Египет, а в 1804-м он уже император Франции и в замыслах его — господство над Европой и всем миром! Наполеон в ходе войн значительно расширил территорию Франции, но в результате проигранной войны 1812 года с Россией потерял все и остаток жизни провел в изгнании на острове Св. Елены...","['2002', '(Сериал', 'закончился)']",7.1,"['Питер Бартфей, Франк Хекерброк, Кристиан Клавье, Изабелла Росселлини, Жерар Депардье, Джон Малкович, Анук Эме, Хайно Ферх, Себастьян Кох, Эннио Фантастичини, Александра Мария Лара, Тэмзин Эджертон', 'США, Венгрия, Германия, Испания, Италия, Канада, Великобритания, Франция, Чешская Республика', '12 +']"
129,https://kino.mail.ru/series_841289_smeshariki_mir_bez_nasiliya/,https://resizer.mail.ru/p/cc1627d9-ab28-5be8-9748-5c0ebe534e72/AAACR5Xl-_H5X25SEjThm2pnHTKSZ8wVGax7yVlQpy-RsGYt876HK93SE-Ew-4kOZQRnRH2xMHutdF9JFfjsi1YBwyE.jpg,Смешарики. Мир без насилия,"['приключения', 'для детей', 'мультсериалы']","Наш мир поистине огромен, в нем живут самые разные люди и... инопланетяне. Как нужно общаться с ними, чтобы никого не обидеть? Смешарики помогают юным зрителям правильно расставлять приоритеты, рассказывают, как сдерживать раздражение и злость, как стать добрее и завести новых друзей. Благодаря сериалу «Смешарики. Мир без насилия» дети узнают, что такое толерантность, почему грубить и обижать младших — это плохо и зачем нужно помогать взрослым.","['2011', '—', '2012']",7.6,"['Антон Виноградов, Владимир Постников, Светлана Письмиченко, Вадим Бочанов, Михаил Черняк', 'Россия', '0 +']"
130,https://kino.mail.ru/series_935426_abrek/,https://resizer.mail.ru/p/373c2ea4-482e-5c01-937c-da177fd8e94e/AQACsmDzpKoLqFmJ2dXuISzwAkS6gmajxVKwJGRiZ3FjhRuxpN9vKolgzmLEfCClCAKMJy1OCPQt7brvS5MYU08QTRA.jpg,Абрек,['драма'],"Действие разворачивается в 2001 году. Волк Абрек вырос среди людей, и худшие из них втянули его в жестокие и кровавые собачьи бои. Следуя инстинктам и законам природы, Абрек становится учителем для чеченского мальчика Халида и русского сапера Володи, помогая им разобраться в себе, в своих ценностях и принципах.
Сериал «Абрек» снят по мотивам одноименной повести чеченского писателя Джамбулата Умарова.","['2023', '(Сериал', 'закончился)']",6.9,"['Артур Сопельник, Алина Рачковская, Стив Форман, Дмитрий Богдан, Эндрю Уинн, Махмуд Цагаев, Хава Ахмадова, Сулейман Ахмадов, Асхаб Джабраилов, Хамид Азаев, Ангелина Пахомова, Анатолий Журавлев, Владимир Стеклов, Валентин Смирнитский, Борис Каморзин, Антон Батырев', 'Россия', '16 +']"
131,https://kino.mail.ru/series_784750_tugaya_struna/,https://resizer.mail.ru/p/775bf538-0bec-591e-b903-e049ebce39d9/AAACb0UZ16fXh1QJZ-3ggjh1vyjs2RzJtDTJBLf4BOmFaYmuBr3AQ54T9_-J-NOu4VPlhYQWzmFObGGGZKkPuQyVxuw.jpg,Тугая струна,"['драма', 'криминал', 'триллер', 'детектив']","Доктор Тони Хилл, герой сериала «Тугая струна», работает клиническим психологом и старается изучить собственную темную сторону, для того, чтобы осторожно суметь проникнуть в сознание серийных убийц. Работая вместе с детективами полиции, Тони не боится даже самых сложных дел. Его хобби — это изучение собственного темного «я», чтобы суметь смоделировать поведение и мысли закоренелых преступников. Клиника находится в Брэдфилде, в Северной Англии, в котором происходят страшные преступления, и полиция пока не в состоянии их раскрыть. Начав работать с инспектором полиции Кэрол Джордан и группой детективов, Тони, используя свою методику, пытается разгадать цепочку страшных преступлений, чтобы обезвредить преступников и прекратить начинающуюся в городе панику.","['2002', '—', '2008']",7.9,"['Робсон Грин, Марк Летерен, Эмма Хэнди, Марк Пенфолд, Симон Лабиб, Гермиона Норрис, Алан Стокс, Том Чэдбон, Томас Бирн, Майкл Смайли', 'Великобритания', '16 +']"
132,https://kino.mail.ru/series_902138_taina_russkoi_zhemchuzhini/,https://resizer.mail.ru/p/c528b8e0-9ca3-561c-b10b-f3eb5eb40a08/AAACRtcKta1VuLIdfzOZRMF-ySlxcfId0p_jYpqvYJjGonFWE_ah6t4Ygg5eQjBfCAhiqeMiM3Dpl8NWxjhLof3mf-M.jpg,Жемчуга,['мелодрама'],"Счастливая жизнь малышки Жени изменилась в один миг. Родители погибли, а девочка сначала оказалась в доме жестоких опекунов, а потом и в детском доме. От прошлой жизни у главной героини сериала «Жемчуга» осталась только семейная реликвия — ожерелье. Спустя годы взрослая Женя оказывается в особняке художника Князева в качестве няни. Вскоре девушка понимает, что роскошный дом хранит мрачный секрет, разгадка которого таится в одной из комнат...","['2016', '(Сериал', 'закончился)']",6.0,"['Полина Сыркина, Александр Домогаров, Афина Кондрашова, Анна Якунина, Сергей Ланбамин, Мария Куликова, Артем Осипов, Юлия Галкина, Елена Захарова, Любовь Германова, Мария Голубкина, Виталия Корниенко, Ольга Никольская', 'Россия', '12 +']"
133,https://kino.mail.ru/series_918433_ledenyaschie_dushu_priklyucheniya_sabrini/,https://resizer.mail.ru/p/d229b02d-e534-5471-948a-309b4aca1fdd/AAACBqFaRyw3D5zobR_33GPaZMj6MS1iNICERufHBwhvsCjLTb_eg4dcaDAEu7IGvg9Hzt1-O2SwZZYAERVVTyvpiY0.jpg,Леденящие душу приключения Сабрины,"['фэнтези', 'ужасы', 'триллер', 'приключения', 'мистика']","Ремейк популярного сериала про приключения маленькой ведьмы Сабрины раскрывает зрителям темную сторону истории взросления героини. Девушка пытается принять свою двойственную натуру — наполовину ведьма, наполовину смертная, — одновременно противостоя злым силам, угрожающим не только ей, но еще и ее семье, и всему миру.
Сериал «Леденящие душу приключения Сабрины» снят в темных тонах и включает в себя элементы хоррора и триллера.","['2018', '—', '2020']",7.4,"['Кирнан Шипка, Джаз Синклер, Мишель Гомес, Ченс Пердомо, Люси Дэвис, Миранда Отто, Ричард Койл, Маккенна Грейс', 'США', '16 +']"
134,https://kino.mail.ru/series_760307_odessamama/,https://resizer.mail.ru/p/e9aca54f-c2f5-515c-ab7e-ba6569df25d2/AAACWzML3mVFEH6nqgMtCAELo9S89D568Iw_61FhwNHqHNGmo_0G91-0w9xmfKg2RflFd1ADf7tS9F6Fy3Q0lccqaAk.jpg,Одесса-мама,"['криминал', 'детектив']","Одессу называли по-разному: «Жемчужина Черного моря», «Маленький Париж», «Южная Пальмира», однако репутация «главной воровской столицы страны» прочно закрепила за этим живописным городом еще одно название — «Одесса-мама». Приморский город с его колоритным юмором, особым свободолюбивым духом и неиссякаемой коммерческой жилкой издавна становился приютом для тех, кто не в ладу с законом. И совсем не удивительно, что в историю города вписаны не только знаменитые мошенники, бандиты и воры, но и отважные стражи правопорядка… Сериал «Одесса-мама», снятый на Украине, впервые был показан в России в 2012 году.","['2012', '(Сериал', 'закончился)']",6.7,"['Дмитрий Дюжев, Екатерина Гусева, Эвклид Кюрдзидис, Петр Федоров, Светлана Устинова, Александр Доронин, Тимофей Трибунцев, Олеся Жураковская, Альберт Филозов, Игорь Ясулович, Сергей Калантай, Станислав Боклан', 'Украина', '12 +']"
135,https://kino.mail.ru/series_884915_shou_toma_i_dzherri/,https://resizer.mail.ru/p/d6cff147-b889-5b8d-b584-353fda34d9bb/AAACkwZ53cbmHk2nWdVxSwsdJcZpLxKL19fXVoDp1XuwCcQ2F5pFMIHEvmbXUzmBNkzEJloljzv1qPl6DnIAQ94QFKo.jpg,Шоу Тома и Джерри,"['комедия', 'мультсериалы']","Каждый день неугомонный кот Том ломает голову, как ему поймать проворного мышонка Джерри. Но маленький Джерри готов обойти все ловушки, заботливо расставленные Томом, да еще и отомстить своему обидчику.
Комедийный сериал «Шоу Тома и Джерри», который является продолжением мультипликационного сериала «Том и Джерри: Сказки», будет интересен как маленьким, так и взрослым зрителям.","['2014', '—', '2021']",6.8,"['Том Кенни, Рик Зефф, Гэри Коул, Саймон Хелберг, Рене Мухика, Джули Уитнер, Джейсон Александр, Джои Д’Аурия, Грэй Гриффин, Рэйчел МакФарлейн', 'США', '0 +']"
136,https://kino.mail.ru/series_934658_yuzhnii_veter_na_granitse/,https://resizer.mail.ru/p/0127d3ef-3953-5a97-8947-56a7c1a64c3a/AQACS4QRyY5_AtxI-wUcJbCRBqb0qRWJPPgi3SmVJ6kyvNHxVfTUoQn0YM-tO2rqHfouaaUnT6cUvRhiYj4KX-fzukE.jpg,Балканский ветер,"['боевик', 'криминал', 'триллер']","В центре сюжета — конфликт вокруг участка земли в сербской глубинке, где должна пройти трасса газопровода. Строительство трассы приводит к противостоянию между американскими и российскими спецслужбами, а также к вражде между белградским наркобароном Петаром Марашем и могущественным куратором сербского криминального мира по кличке Красный. Спасаясь от наемников Красного, Мараш приезжает в Россию, где знакомится с секретным агентом Ларисой и становится виновником гибели ее брата. Теперь на Петара охотятся сербские, американские и российские спецслужбы, а также мафиозные кланы всей Юго-Восточной Европы.
Сериал «Южный ветер. На границе» — это часть франшизы «Южный ветер» о бывшем автоугонщике Петаре Мараше.","['2023', '(Сериал', 'закончился)']",6.8,"['Милош Бикович, Оксана Акиньшина, Эрик Робертс, Уильям Болдуин, Миодраг Радонич, Йована Стоилькович, Мики Манойлович, Алексей Гуськов, Алексей Гришин, Александр Устюгов', 'Россия, Сербия', '18 +']"
137,https://kino.mail.ru/series_784466_poroki_i_ih_poklonniki/,https://resizer.mail.ru/p/c5ad4bae-8736-537d-89b6-a72689eed4c4/AAACXqwNfhRFXEzgB4fkg6i_dkPKPAVz6WQa_TaLtGrY8ueiG3stYzJwUx71P6m_68V3KqpmZgRbo9_VO4Oms4XEFYI.jpg,Пороки и их поклонники,"['криминал', 'детектив']","Герой сериала, Владимир Архипов, работает программистом в собственной процветающей фирме. У него есть верный друг — мастиф Тинто, который все понимает, только не разговаривает. И вдруг его размеренную жизнь нарушает соседка по площадке, Лизавета Петровна — женщина с большими странностями, говорящая белым стихом. У неё предчувствие, что скоро она умрёт, и поэтому просит Архипова, которого считает хорошим человеком, позаботиться о девочке-сиротке. Лизавета Петровна взяла ее на воспитание пятнадцать лет назад, но Архипов почему-то никогда ее не видел. И действительно, на следующий день после разговора с Архиповым Лизавета Петровна умирает. Владимир решает самостоятельно расследовать этот странный случай.
Сериал «Пороки и их поклонники» снят по одноимённому роману Татьяны Устиновой.","['2006', '(Сериал', 'закончился)']",7.6,"['Владислав Галкин, Галина Польских, Игорь Ясулович, Ольга Волкова, Евгений Князев, Лариса Руснак, Давид Бабаев, Глафира Тарханова, Дмитрий Бикбаев, Олег Треповский', 'Россия', '16 +']"
138,https://kino.mail.ru/series_770137_pyataya_gruppa_krovi/,https://resizer.mail.ru/p/d0173cb4-4aac-5591-8c31-4f079c1ad93f/AAAC9A_TerHWCxEmLWBN4NQtpt_y-GXgbvjnY2o2Y3CKVSb031xTuph6N77CmWf3LOSdj31rwYlN5uIDb9C5kxTMEnY.jpg,Пятая группа крови,['мелодрама'],"Начало многосерийной эпопее «Пятая группа крови» было положено в середине 60-х годов прошлого века, когда главные герои этой истории — Руслан и Анфиса даже не подозревали, что скоро в их жизни произойдут большие перемены: у них на свет появится дочь по имени Динка, которой суждено вырасти и превратиться в очень неординарного сильного человека. На ее долю выпадет немало испытаний. Все они — встречи и расставания с близкими людьми, рождение собственных детей, поиск настоящего счастья станут сюжетом для захватывающего житейского романа, действие заключительных сцен которого происходит в наши дни.","['2010', '—', '2011']",7.4,"['Серафима Огарева, Шамиль Хаматов, Яна Есипович, Дмитрий Паламарчук, Анастасия Сметанина, Анна Арефьева, Роман Ладнев, Тамара Абросимова, Михаил Трясоруков, Олеся Бережная', 'Россия', '16 +']"
139,https://kino.mail.ru/series_766106_vrata/,https://resizer.mail.ru/p/6620963f-0d90-569a-b3d0-809f4a12af38/AAACfZetFHG7cFFHRqtAMBvei9Sjoi5jDDFwnPseN7IQleQtEqSVrTlziOnBCXC96dZcOpixOrqvwah4gTdpQmFGEbA.jpg,Врата,"['драма', 'криминал', 'триллер', 'детектив']","Детектив Ник Монахан вместе с женой Сарой и двумя детьми Чарли и Даной переезжает из суетливого Чикаго в тихий, охраняемый четырехметровыми воротами, поселок, чтобы занять место начальника местной полиции. Однако вскоре Монаханам становится ясно, что за живописной оболочкой из хорошеньких домиков и ухоженных газонов поселка скрываются темные тайны. Их соседи — совсем не те, кем кажутся. Поселок населяют вампиры, ведьмы, оборотни, и суккубы. Сериал «Врата» впервые был показан на телевидении в 2010 году.","['2010', '(Сериал', 'закончился)']",7.4,"['Рона Митра, Фрэнк Грилло, Марисоль Николс, Люк Мэбли, Трэвис Колдуэлл, Скайлер Сэмюэлс, Чандра Уэст, Колтон Хэйнс, Янина Гаванкар', 'США', '19 октября 2010 (РФ)20 июня 2010 (Мир)']"
