,url,poster,title,ganres,description,year,rating,cast
372,https://kino.mail.ru/series_790160_kroshka_dorrit/,https://resizer.mail.ru/p/68de6e1a-f0f7-55c3-a8bb-21b6b9122bab/AAAC_Z3zQ5Viwxi6AHXHk2dBR4d2FTYpwYeYhdw9Jo32lDheEkwrjhXhlulqGSbmKUxJjZwFcO1plLCrFvVmZtEjQ9U.jpg,Крошка Доррит,"['драма', 'мелодрама']","Сериал «Крошка Доррит» начинается с истории тщеславного банкрота по имени Уильям Доррит, которому «посчастливилось» около 20 лет провести в английской долговой тюрьме Маршалси. Его младшая дочь Эмми родилась в тюрьме, собственными глазами видя ужас и жестокость. Однако девушка выросла доброй, верной и застенчивой и привыкла от чистого сердца помогать людям.
В это время некий Артур Кленнэм вернулся обратно в Англию после длительных странствий, и, оказавшись в доме своей матери, познакомился с Эмми. Она сразу ему понравилась, поэтому он оказывает поддержку героине, которая быстро к нему привязывается. Но вскоре в жизни Эмми начинают происходить странные вещи — она узнает, что огромные долги ее брата кем-то выплачены, и вскоре получает предложение о замужестве от Джона Чивери.
«Крошка Доррит» — это экранизация одноименного романа Чарльза Диккенса.","['2008', '(Сериал', 'закончился)']",7.7,"['Клер Фой, Мэттью Макфэдиен, Том Кортни, Эмма Пирсон, Кингсли Фрэнсис-Грей, Алан Армстронг, Джуди Парфитт, Эдди Марсан, Энди Серкис, Рози Кавальеро', 'Великобритания', '16 +']"
373,https://kino.mail.ru/series_760188_devichnik/,https://resizer.mail.ru/p/0dc5acce-74b3-529c-9e11-054f99866725/AAACKUMPkdKlF2xnAeUBDjK6vXoCh700jQFgsYPyKaefxWNhNVOlvQZjJUTt9CB0xSBRyla-Wvybq-IjCnpikmrjTxA.jpg,Девичник,"['мелодрама', 'комедия', 'детектив']","Бывшие однокурсницы — Катя, Вика, Люба и Маруся — дружат почти пятнадцать лет. Когда-то они вместе закончили факультет журналистики МГУ, но сейчас журналистикой занимается только Катя. Вика и Люба — успешные бизнес-вумен, а Маруся сама себя называет «работающей домохозяйкой». Подруги часто встречаются и, если нужно, помогают друг другу. Есть у них и своя традиция — регулярно собираться на «девичник». Случается так, что накануне одного из таких «девичников», судьба сталкивает каждую из четырех героинь с каким-то тяжелым испытанием… Вика теряет ребенка и расстается со своим мужчиной. Катя уходит от мужа, обнаружив, что тот втайне торговал её именем и влиянием на телевидении. Люба, всего два года назад выставившая своего экзотического, но трусливого японского мужа, переживает очередное разочарование в мужчинах. А терпеливая и преданная Маруся забирает двух маленьких детей и уходит от мужа, с которым прожила больше десяти лет...
Сериал «Девичник» впервые был показан на российском телевидении в 2009 году.","['2009', '—', '2010']",7.1,"['Наталия Курдюбова, Любовь Толкалина, Елена Панова, Эльвира Болгова, Андрей Кузичев, Борис Шевченко, Игорь Бочкин, Евдокия Германова, Татьяна Лютаева, Илья Рутберг, Мария Ильюхина', 'Россия', '16 +']"
374,https://kino.mail.ru/series_921091_taini_gospozhi_kirsanovoi/,https://resizer.mail.ru/p/ef75731a-0638-579a-bc89-9ed7ad4a9e3d/AAAClgpoJUCgHtlzTN_QsWkHm7M3LmHRYsrgLo-855a3YkMHmmq4l6yjxOUTtajYOglbLhpLSSDkMcunDAoJC2zvJaY.jpg,Тайны госпожи Кирсановой,['детектив'],"1878 год. В небольшой уездный город Богородск в поисках пропавшего жениха приезжает молодая учительница математики Лариса Дмитриевна Кирсанова. Молодой дворянин Павел Бестужев таинственно исчез за день до венчания, не попрощавшись и не оставив никакой весточки. Родом Бестужев из Богородска, где до сих пор живет его старушка мать. Здесь же проживает и любимая тетка Ларисы — Лизавета Прокофьевна. Лариса Дмитриевна даже не догадывалась о том, что именно приезд в Богородск в корне изменит ее жизнь. Здесь в полной мере раскроются ее удивительные способности, ум и характер. А жизнь отныне будет наполнена загадками, риском и раскрытием громких преступлений!
«Тайны госпожи Кирсановой» является спин-оффом детективного сериала «Анна-детективъ».","['2018', '(Сериал', 'закончился)']",7.8,"['Ольга Лерман, Евгения Симонова, Максим Битюков, Андрей Евдокимов, Валерий Рожков, Ольга Плешкова, Илья Ильиных, Александр Городиский, Дмитрий Белоцерковский, Анна Соловейчик, Софья Зайка', 'Россия', '3 декабря 2018 (РФ)']"
375,https://kino.mail.ru/series_777435_doktor_martin/,https://resizer.mail.ru/p/5a318690-9315-5266-8bd9-416420b09090/AQACdWviRSyBGHZ1XOSO-0EFj2znHHPYv2l2Vkd1p-bvRL8l6sCIG0aH1MYRtrYkZKUdb4FGjGOE6EHZNQwjjtwLULQ.jpg,Доктор Мартин,['комедия'],"Британский сериал на медицинскую тему. Знаменитый доктор Мартин решает оставить практику в Лондоне и кардинально изменить свою жизнь. Он переезжает в сонную деревушку в графстве Корнуолл и начинает осваивать должность сельского врача. Доктор Мартин — обладатель блестящего опыта, но вот с людьми он ладить совершенно не умеет. Отсутствие у него врачебного такта начинает раздражать новых пациентов, и скоро Мартин понимает, что для примирения с сельской жизнью ему никак не обойтись без союзников. Но где их найти, когда даже секретарша доктора — самая неопытная на свете?","['2004', '—', '2022']",7.4,"['Мартин Клунес, Кэролайн Катц, Иэн МакНис, Джо Эбсолом, Стефани Коул, Кэтрин Паркинсон, Джон Маркес, Селина Каделл, Стюарт Райт, Лия Уильямс', 'Великобритания', '16 +']"
376,https://kino.mail.ru/series_937528_otchayannaya_nevesta/,https://resizer.mail.ru/p/e9b5d111-4e35-510c-9435-202eea86e084/AQAC301q2woqMuPd-mdZgHnIlLoheA1TbRbUvN6PDdI1sMpDqERQpT0aQr4NXJJX12XcJq1LELppGTxMa2Z_2LNmHpE.jpg,Отчаянная невеста,"['драма', 'комедия']","В свои 33 года Алиса все еще ищет себя. Она учится на режиссерском факультете киношколы и находится в мучительных отношениях с женатым Лукасом, который последние пять лет обещает, что вот-вот разведется. Но когда выясняется, что жена Лукаса ждет третьего ребенка, Алиса понимает, что нужно что-то менять. Ее мать обеспокоена тем, что часики тикают, и на то, чтобы обрести семью, у Алисы практически не осталось времени. Тогда героиня заключает с мамой пари: если в течение года она не найдет мужчину мечты и не забеременеет, она будет рожать от лучшего друга Паши — умного, талантливого, но неуспешного в отношениях. Алиса начинает поиски партнера, который удовлетворит ее не только духовно, но и физически (а она открыта сексуальным экспериментам), и снимает про свою миссию документальный фильм, который станет курсовой работой.","['2023', '(Сериал', 'закончился)']",6.8,"['Анна Зайцева, Василий Михайлов, Юлия Ауг, Игорь Черневич, Пьер Бурель, Михаил Евланов, Екатерина Агеева, Иван Мулин, Максим Белбородов, Данила Рассомахин, Павел Рассомахин, Полина Цыганова, Никита Абдулов, Григорий Данцигер, Анастасия Кербенген', 'Россия', '18 +']"
377,https://kino.mail.ru/series_918187_strannii_angel/,https://resizer.mail.ru/p/0dc21ea9-0b23-58b7-958a-51a749c5230f/AAAC6njKyqYluFP_TkBaK3CGtgzFd5lSmYIJF490VBOB1olcXbfG_XSPMvXxLmyCFM7emy35_L90BcBvow7t1BV9bVE.jpg,Странный ангел,"['драма', 'фантастика']","Сериал «Странный ангел» рассказывает об инженере-ракетостроителе и оккультисте Джеке Парсонсе. Начинавший уборщиком на химическом заводе, этот амбициозный юноша оказался у истоков ракетостроения и стал одним из тех, благодаря кому человек начал осваивать космос. Непреодолимая тяга к звездам обратила его внимание на оккультизм и религиозное учение телема. Парсонс проводил религиозные обряды и руководил Орденом восточных тамплиеров. Жизнь этого удивительного и эксцентричного человека была полна тайн, сексуальных увлечений и фантастических событий, до сих пор вызывающих немало споров.
Сериал основан на романе Джорджа Пендла «Странный ангел: Потусторонняя жизнь ракетостроителя Джона Уатсайда Парсонса».","['2018', '—', '2019']",6.8,"['Джек Рейнор, Руперт Френд, Фил Абрамс, Коллин Фой, Луис Мустилльо, Белла Хиткот, Питер Марк Кендалл, Майкл Гэстон, Грег Уайз, Раде Шербеджия, Зак Перлман', 'США', '18 +']"
378,https://kino.mail.ru/series_776268_u_kazhdogo_svoya_voina/,https://resizer.mail.ru/p/809bd17d-d2f7-5758-a857-7aee07b1a410/AAACxEBOfOHgJZiC5JLX4hQcd86sMaKdxZXqHIfJWFzrMCP8VnNWAPPIY2OtL9hBaZSNci_-DYvD6s5UepotEspRVHs.jpg,У каждого своя война,"['драма', 'исторический', 'военный']","Экранизация повести Эдуарда Володарского «У каждого своя война». В центре сюжета — трогательная история подростковой любви, неразделенных чувств школьника Роберта к красавице Милке. Девушка не может ответить ему взаимностью, потому что у нее уже есть ухажер — атаман замоскворецкой шпаны. Роберта манит мир улиц и темных подворотен, и он присоединяется к компании ребят, живущих шальной жизнью. Действия сериала развиваются в 50-е годы прошлого века. Фоном для романтической линии служат истории соседей, интриги в коммунальных квартирах и военные воспоминания. Этот антураж хорошо знаком послевоенному поколению москвичей.","['2010', '(Сериал', 'закончился)']",7.9,"['Юра Борисов, Александр Мохов, Полина Кутепова, Леонид Бичевин, Константин Лавроненко, Александр Бухаров, Игорь Петренко, Юлия Куварзина, Сергей Газаров, Евдокия Германова', 'Россия', '16 +']"
379,https://kino.mail.ru/series_781280_ya_vernus/,https://resizer.mail.ru/p/6e9bd4e1-2b07-5eee-a5b8-de0163408246/AAACcrI3y-nX0w3U5GWL4pYopkXrDeqytZ6p902umocFnBvhgjKb9lXf_vRTTQ_Ef_vG9NbdJ67WQWjUBYykpumbnDE.jpg,Я вернусь,"['драма', 'исторический', 'военный']","Сериал «Я вернусь» рассказывает про начало Великой Отечественной войны. Главную героиню, восемнадцатилетнюю девушку Мусю немцы угоняют в Германию, и только счастливая случайность позволяет ей остаться в живых. Муся очень хочет жить, особенно сейчас, когда появился Митя, ее первая любовь. Но всякой войне когда-то приходит конец. И, вернувшись , Муся узнает, что её возлюбленного Митю все считают дезертиром, а сам он вынужден скрываться под чужим именем. И именно своей чистой и беззаветной любовью девушке удается помочь Мите вновь обрести веру в себя и добиться справедливости.","['2008', '(Сериал', 'закончился)']",7.6,"['Елизавета Боярская, Роман Полянский, Ирина Агейкина, Юлия Борилова, Ирина Бразговка, Екатерина Васильева, Ульяна Ворожейкина, Жанна Егорова, Никита Емшанов, Роман Кириллов, Степан Морозов', 'Россия', '16 +']"
380,https://kino.mail.ru/series_775937_zastivshie_depeshi/,https://resizer.mail.ru/p/7eb2e0bc-86fd-591a-af43-28c08f4fe8a0/AAAChbZH6y0EK3CdiL9S-L4b5IZjLmPUFf2Y7TU63AQJv7q4rkeszdn3T2slmQhqu-esokHsoRD2U5qxCYz5VApK37E.jpg,Застывшие депеши,"['боевик', 'детектив']","Криминальные авторитеты подставляют секретного агента Службы Финансовой Безопасности — героя криминальной саги «Застывшие депеши» Дмитрия Громова. Теперь он вынужден не только скрываться от своих, но и попытаться в одиночку вычислить «крота» в своем отделе. В игру вступает бывший сотрудник СФБ, генерал в отставке Аргунов. С его помощью Громов узнает о секретной организации, которая готовит покушение на Советника по финансовой безопасности правительства РФ. Чтобы выйти на главу этой организации, нужно завербовать «крота» для своих целей. Тем временем в жизни Громова появляется Марго, которая поначалу не вызывает у героя доверия.","['2010', '(Сериал', 'закончился)']",6.9,"['Дмитрий Нагиев, Елена Ксенофонтова, Константин Тополага, Александр Боковиков, Дмитрий Комов, Александр Орловский, Сергей Астахов, Константин Демидов, Владислав Шкляев, Екатерина Шпица', 'Россия', '16 +']"
381,https://kino.mail.ru/series_772978_lichnie_obstoyatelstva/,https://resizer.mail.ru/p/e374327b-78ed-5da8-a1c8-84d1364da600/AAACsEDo-rSR_46qeV7j9ont8gAfOTEMFBJ0gZjbppxvzMG3zDGc39hijpgfM4u8tLnGW9Lz7Vdzv2HY0wObyTmZ4cM.jpg,Личные обстоятельства,"['мелодрама', 'криминал']","Врач Герман Кузнецов, герой сериала «Личные обстоятельства» становится свидетелем ДТП: пьяная дочь олигарха Сундукова врезается в стоящую на перекрестке легковушку. Итог трагедии — двое погибших, а 8-летнюю девочку после помощи Германа в тяжелом состоянии отправляют в больницу. Пытаясь осадить наглую виновницу аварии, Кузнецов срывается и бьет девицу по лицу. Полиция, прибывшая на место происшествия, составляет протокол. Один из свидетелей, трагедии мотоциклист Вася снимает все происходящее на мобильный телефон и через час выкладывает свой репортаж в Интернете. Кузнецов как обычно продолжает заниматься своей медициной, но вечером следующего дня, его похищают охранники Сундукова. Они убедительно просят Германа подписать протокол аварии и дать признательные показания о виновности в ДТП. Но герой не желает идти против собственных принципов. В его жизни наступает нелегкое время.","['2012', '(Сериал', 'закончился)']",7.6,"['Владимир Меньшов, Олеся Судзиловская, Андрей Соколов, Валентина Лукащук, Игорь Николаев, Нелли Попова, Иван Краско, Филипп Чевычелов, Ирина Сотикова, Татьяна Ткач', 'Россия', '16 +']"
382,https://kino.mail.ru/series_811028_ver_mne/,https://resizer.mail.ru/p/e0e8ecbb-b1eb-5405-850e-5140021a7199/AAACNOA0avBHv3TXJbkwcUEm1tqK0M74ejsJ8T7iMvAknHa-lYqJHoeU_thh8PmWM4Z5Q-eqSYOqprxQGXhpD-MjUWc.jpg,Верь мне,['мелодрама'],"Главные герои сериала «Верь мне» — супруги Максим и Екатерина. У них прекрасная жизнь: крепкий брак, любимый сын Ванечка. Все меняется, когда Ваня внезапно заболевает. Мальчику срочно нужна донорская почка, иначе очень скоро он умрет. Катя и Макс пытаются сделать все, чтобы спасти сына, но это непросто. В их, казалось бы, счастливой, открытой семье есть свой скелет в шкафу. Когда тайное становится явным — жизнь семьи рушится. Кате и Максу предстоит пережить многое: ссоры, упреки, расставания, но, когда они поймут, что только вместе возможно победить беду, у них все получится.
Съемки сериала «Верь мне» проходили в Москве и в Твери.","['2014', '(Сериал', 'закончился)']",6.6,"['Анастасия Веденская, Александр Волков, Любовь Тихомирова, Александр Пашков, Наталья Лукеичева, Александр Клюквин, Антон Батырев, Михаил Химичев, Елена Мельникова', 'Россия', '3 февраля 2014 (РФ)']"
383,https://kino.mail.ru/series_783486_ermolovi/,https://resizer.mail.ru/p/e431c1bd-545e-5f21-b81f-21b6cf2b843c/AAACeqCZwxJ7c3-gj5PUf5hu-2NR4J7BTy_fpci6eJ2zTBepI-IjgtXw-Dr94mFjnY4exdJMtIE9_faJ7nx06zpcl0M.jpg,Ермоловы,"['драма', 'мелодрама']","Основная интрига сериала «Ермоловы» построена на родовом проклятии московского семейства Ермоловых, корни которого идут от известного генерала Константина Ермолова. Совершив в молодости непростительную ошибку, он тем самым обрек своих потомков и членов семьи на мучительные страдания из-за любви и измены. Действие охватывает период с 20-х годов прошлого века до наших дней и происходит в Москве, провинциальной России, Италии, Белоруссии, Крыму и Средней Азии. Герои разных поколений раз за разом вынуждены искать, находить, терять и снова обретать свое личное счастье.
Преуспевающий предприниматель Сергей Ермолов мчится на машине в Москву, чтобы поскорее увидеть любимую жену и сына. Неожиданная встреча с инфернальной красавицей-художницей Амалией и ее восьмилетней дочерью Марусей круто меняет всю его жизнь. Сергей понимает, что его страсть — это наваждение, но не в силах устоять.
Телесериал с элементами мелодрамы и мистики основан на трилогии Анны Берсеневой «Ермоловы», включающей романы: «Яблоки из чужого рая», «Антистерва», «Мурка, Маруся Климова».","['2008', '(Сериал', 'закончился)']",7.4,"['Анна Большова, Евгения Бордзиловская, Елена Захарова, Александр Лазарев, Александр Лазарев-мл., Ада Роговцева, Александр Сигуев, Наталья Унгард, Дмитрий Щербина, Наталья Юнникова', 'Россия', '16 +']"
