,url,poster,title,ganres,description,year,rating,cast
236,https://kino.mail.ru/series_789252_dayosh_molodyozh/,https://resizer.mail.ru/p/f86ecfbc-210a-5ca3-8f30-e2d62651fa07/AAACXZABrdRlpVSH-GARoud-QhH-lVCU9IpLFtrmnmJZLRSC52SPFlldEBxOghOpxoIMn7XxZC6ZJ_KOsMmfk9dQ7qo.jpg,Даешь молодежь!,"['комедия', 'скетч-шоу']","Молодежный комедийный сериал «Даёшь молодёжь» снят авторами популярного скетч-шоу «6 кадров». Герои сериала наглядно покажут, как живут современные юноши и девушки, чем интересуются и как проводят свободное время. Ребята «пройдутся» по самым разным темам, высмеивая «золотую молодежь», метросексуалов, растаманов, посещение фитнеса и спа-салонов, военкомат и вечную проблему женской половины человечества — диету. Мы увидим героев в самых разных местах и ситуациях: в общежитии и в университете, в спортивном клубе и игровом зале, в кинотеатре и боулинге, в фитнес-клубе и на пляже...","['2009', '—', '2013']",5.9,"['Андрей Бурковский, Михаил Башкатов, Аслан Бижоев, Евгения Крегжде, Егор Сальников, Мария Зыкова, Анжелика Каширина, Татьяна Орлова, Владимир Фоков, Владимир Кузнецов', 'Россия', '16 +']"
237,https://kino.mail.ru/series_919820_pereval_dyatlova/,https://resizer.mail.ru/p/98161eac-ca8b-5ba5-bf1c-f65c84e5ab80/AQACacTJaEbksQTG7ux68ePkE5K-SOW2OXAWtrzMyDMWuA5Xlgu5K3I3KbWZsw45HvRZUzddAuYXn6mXp1iL_UeFJP0.jpg,Перевал Дятлова,"['драма', 'триллер']","Зимой 1959 года студент Игорь Дятлов собрал команду единомышленников и отправился в лыжную экспедицию по уральским горам. Достигнув перевала, который впоследствии был назван перевалом Дятлова, вся группа, состоявшая из 9 человек, погибла при загадочных обстоятельствах. В течение 60 лет никто не может ответить на вопрос, что случилось с членами экспедиции в ту роковую ночь.","['2020', '(Сериал', 'закончился)']",7.5,"['Петр Федоров, Мария Луговая, Иван Мулин, Александр Метелкин, Максим Емельянов, Мария Мацель, Ирина Касамара (Лукина), Егор Бероев, Евгений Антропов, Андрей Добровольский, Роман Евдокимов, Юрий Дейнекин, Максим Костромыкин, Алексей Кирсанов, Алексей Бардуков, Андрей Арзяев, Павел Ворожцов, Сергей Шакуров, Евгений Ткачук', 'Россия', '16 +']"
238,https://kino.mail.ru/series_899391_mamochki/,https://resizer.mail.ru/p/1769fe81-16e0-5e7a-a7d6-863ef1448c46/AAAC-r-117XdqD47BrtI4UZibTZXTsw3-ryXbyvlfp1ER2N44qdJRHRwbWB-nY_L3aqRxD_AD3grbraFD9yRCPpQxNc.png,Мамочки,['комедия'],"Героини сериала «Мамочки» — три неразлучные подруги. Аня стала мамой совсем недавно и переживает от того, что ее жизнь разделилась на до и после. Юля — многодетная мать со стажем, которая пытается совместить материнство с карьерой журналиста. А Вика находится в постоянном поиске идеального мужчины, хотя не уверена, готова ли к спокойной семейной жизни. С появлением детей быт каждой из героинь кардинально меняется, и все свалившиеся на них испытания женщины проходят вместе, стараясь сохранить дружбу и не потерять собственное «я».","['2015', '—', '2017']",7.3,"['Елена Николаева, Светлана Колпакова, Александра Булычева, Сергей Лавыгин, Александр Ратников, Владимир Жеребцов, Макс Бирюков, Михаил Присмотров', 'Россия', '16 +']"
239,https://kino.mail.ru/series_887943_lyutsifer/,https://resizer.mail.ru/p/ed69fd4d-b577-5ad3-a03a-e1e543d4049d/AQACiYBNLIWl_-Ji0sapwn5Pvae3QuRSnSsAiS-HKrHD9d5Qq9zTelYkVWYMl02MintExIHRPKoGA0i2nqxqMRgHylQ.jpg,Люцифер,['фэнтези'],"Харизматичный и привлекательный Люцифер, заскучавший в своей адской резиденции, отправляется в современный Лос-Анджелес, где основывает ночной клуб Lux.","['2016', '—', '2021']",7.8,"['Том Эллис, Мэтт Корбой, Лорен Джерман, Рэйчел Харрис, Лесли-Энн Брандт, Кайла Юэлл, Дженнифер Кэтрин Ларсон, Джонатан Салисбери, Тришиа Хелфер, Меррин Данги, Брианна Хилдебранд', 'США', '18 +']"
240,https://kino.mail.ru/series_788328_mastera_mecha_onlain/,https://resizer.mail.ru/p/441c22a1-e10e-5b81-a372-09e6a330ce1a/AAACWAmICyfJRlziwL3M6JRRWIukFDXemo380-xrUKfl44HgjPP6sBYzZ46u3r9cXVmaHKwlSoxnm9qYsfbtk0DOMEA.jpg,Мастера меча онлайн,"['фэнтези', 'боевик', 'приключения', 'аниме', 'мультсериалы']","Опытному геймеру Казуто «Кирито» Киригае повезло поучаствовать в бета-тестинге самой ожидаемой компьютерной игры нового поколения — Sword Art Online. Когда наконец на прилавках появились диски с финальной версией, тысячи геймеров устремились в совершенный виртуальный мир ММОРПГ. Там их ждал неприятный сюрприз — Гейм-мастер объявил, что выйти из игры по собственной воле невозможно. Единственный шанс — пройти все сто уровней до конца. Смерть же в игре означает и смерть в реальной жизни.
«Мастера меча онлайн» — научно-фантастический аниме-сериал, созданный на основе цикла лайт-новелл (ранобэ) японского писателя Рэки Кавахары.","['2012', '(Сериал', 'закончился)']",7.5,"['Брайс Папенбрук, Черами Ли, Кассандра Моррис, Патрик Сэйтц, Сара Энн Уильямс, Кристин Мари Кабанос, Ёсицугу Мацуока, Хирата Хироаки, Хироки Ясумото, Аяна Такэтацу', 'Япония', '12 +']"
241,https://kino.mail.ru/series_817565_rodina/,https://resizer.mail.ru/p/b59e6065-2b67-54ec-bf23-be22ea8391de/AAAC1w78wTs75QqMVrgmxinQekudEeZyHHYSSbJZ9vANlTS8EFxiYpN7CihHv_xQ85ndUBqgHbc_Hq2xdaRbb7m7a0c.jpg,Родина,['драма'],"Действие сериала «Родина» начинается в 1993 году. Во время военной операции федеральных войск на Северном Кавказе пропадают без вести майор морской пехоты Алексей Брагин и снайпер Юрий Хамзин. Спустя шесть лет в ходе совместной спецоперации ФСБ и спецназа ГРУ на Северном Кавказе уничтожен лагерь по подготовке террористов. В захваченном бункере обнаружен считавшийся погибшим Брагин — истощенный и прикованный к стене.
История майора, изнеможденного пытками и годами одиночного заключения, мгновенно становится достоянием СМИ. С находящимся в тяжелом психологическом и физическом состоянии Брагиным начинают работать врачи и психологи, а также Анна — эксперт-аналитик контртеррористического центра ФСБ. С первых же допросов Анна понимает, что с Брагиным что-то не в порядке. Он пытается наладить отношения с женой и дочерью, сблизиться с сыном, но у него есть тайна, которую он тщательно скрывает даже от самых близких.
Фильм Павла Лунгина — это российская версия популярного американского сериала «Родина», основанного, в свою очередь, на израильской драме «Военнопленный».","['2015', '(Сериал', 'закончился)']",6.5,"['Владимир Машков, Виктория Исакова, Мария Миронова, Сергей Маковецкий, Андрей Мерзликин, Мария Шалаева, Тимофей Трибунцев, Валериу Андриуцэ, Алиса Хазанова, Владимир Вдовиченков', 'Россия', '16 +']"
242,https://kino.mail.ru/series_785420_sch_i_t/,https://resizer.mail.ru/p/5b0217e3-40b0-585b-baac-0ba4e34fc8fb/AAACFyoerIordWdBOcFDeXWtci99BglDb83BXP7fL64pGz_o_FxJ-5p2i-CG7-Zd7EXOHCap_NwIU2UxdRLgk7VJQ_s.jpg,Агенты «Щ.И.Т.»,"['драма', 'фантастика', 'боевик']","Сериал расскажет нам о буднях вымышленной организации «Щ.И.Т.», борющейся с преступностью, с агентами которой мы уже не раз встречались в фильмах о супергероях из команды «Мстителей». Под бессменным руководством Ника Фьюри это агентство мужественно встречает любую опасность: будь то вторжение инопланетян, восстание андроидов или козни сверхзлодеев. У них нет времени на раздумья, у них есть время только на действия. И хотя агенты не обладают суперспособностями, они способны противостоять практически любой угрозе.","['2013', '—', '2020']",7.3,"['Кларк Грегг, Минг-На, Бретт Далтон, Хлоя Беннет, Йен де Кестекер, Элизабет Хенстридж, Шеннон Лучио, Дж. Аугуст Ричардс, Арлин Серда, Чарльз Халфорд', 'США', '18 +']"
243,https://kino.mail.ru/series_779364_balzakovskii_vozrast_ili_vse_muzhiki_svo/,https://resizer.mail.ru/p/34ba764d-b4b8-5192-bc4e-8bbe47b11411/AAACSo1e0Gf-JY7TNFqcqrATGi3At_O9VJJQBdgwzMSeK0fqVYhYxVB-LCW1eP-ngcNFxnqRAUI8AV5X4hVrQKGoPmE.jpg,"Бальзаковский возраст, или Все мужики сво...","['мелодрама', 'комедия']","Они знакомы не первый год. Вера, Алла, Юля и Соня — четыре подруги. Они так непохожи: разные характеры и разные судьбы, но их объединяет одно: им слегка за тридцать, и они живут в большом городе. В жизни подруг были ссоры и расставания, новые знакомства и любовь, мужья и поклонники. Но, несмотря на разочарование и обман, крушение надежд и иллюзий, каждая из них не перестает верить в то, что однажды на широких проспектах большого города она встретит того единственного, который останется с ней навсегда, который полюбит ее такой, какая есть. Сериал «Бальзаковский возраст, или Все мужики сво...» — российский ответ американскому «Сексу в большом городе».","['2004', '—', '2013']",6.5,"['Юлия Меньшова, Лада Дэнс, Жанна Эппле, Алика Смехова, Анатолий Васильев, Вера Алентова, Андрей Соколов, Алла Будницкая, Дмитрий Марьянов, Эвклид Кюрдзидис, Алексей Янин', 'Россия', '12 +']"
244,https://kino.mail.ru/series_777540_anna_german_taina_belogo_angela/,https://resizer.mail.ru/p/368ed711-244b-53c0-9c65-d92beb1c5ec2/AAACoN3SjBxIdky1rH7r2biTC0kU6MNY-xudY-HUGqMORf-LzUBloiW7BhzGanHFJiqGZy0TzKRxETKFe0V_ACBxHSs.jpg,Анна Герман. Тайна белого ангела,"['драма', 'биография', 'музыкальные']","История о певице, которая на пике своей славы попала в автокатастрофу и оказалась прикованной к больничной койке. 12 дней восходящая звезда Анна Герман не приходила в сознание. В те дни ей пришлось снова пережить трагические события своего детства — арест отца, обвиненного в шпионаже, скитания их осиротелой семьи по Средней Азии, смерть маленького брата, войну и побег в Польшу в надежде скрыться от преследователей из НКВД… Первую любовь и первый успех… Никто из врачей не верил, что она выживет. А если даже это случится, ей пророчили полную неподвижность до конца жизни. Однако, после 12 дней комы небо даровало ей шанс начать жизнь заново. И она совершила невозможное, став «белым ангелом» советской эстрады. Сериал «Анна Герман. Тайна белого ангела» был снят к 30-летию смерти известной польской певицы Анны Герман.","['2012', '(Сериал', 'закончился)']",7.8,"['Иоанна Моро, Мария Порошина, Марат Башаров, Екатерина Васильева, Константин Милованов, Анна Кирина, Томмазо Раменги, Шимон Сендровский, Юлия Рутберг, Виталий Гусев', 'Россия', '16 +']"
245,https://kino.mail.ru/series_761410_amerikanskaya_semeika/,https://resizer.mail.ru/p/d9c434e9-a11e-521f-9a5c-be3fe6c9d4e1/AAACDQWCVBGyNRdlaK7czdm0XfG0fGNvRSYEbU76YQPbRv1t6nhWBRxWCWsx5nQSUOt0qFETVe3eRiPZWRO61fskXsk.jpg,Американская семейка,['комедия'],"История о трех совершенно разных семьях. Джей Притчетт познакомился со сногсшибательной колумбийкой Глорией, когда она в бикини подавала ему коктейли на вечеринке, которую он устроил в день ухода его первой жены. Теперь Джей и Глория женаты, и Джей изо всех сил старается не отставать от молодой красотки-жены и ее сына Мэни. В семье Клэр Данфи тоже не все гладко. Ее муж Фил — просто замечательный, но он считает, что «свой в доску» для детей, чем их сильно смущает. А сын Джея Митчелл и его партнер Кэмерон только что удочерили Лили, очаровательного младенца из Вьетнама.
Сериал «Американская семейка» (в оригинале — «Современная семья») впервые был показан на американском телевидении в 2009 году.","['2009', '—', '2020']",7.3,"['Эд О’Нилл, София Вергара, Тай Бурелл, Джули Боуэн, Джесси Тайлер Фергюсон, Эрик Стоунстрит, Рико Родригеc, Нолан Гоулд, Сара Хайланд, Ариэль Уинтер, Фред Уиллард', 'США', '18 +']"
246,https://kino.mail.ru/series_773035_merlin/,https://resizer.mail.ru/p/3df5d27c-a444-5ffe-99b0-5c6d20f8ce76/AAAC8KO0NdDkV1Pr_EeQ5z7k1ONXsNr6oEs6Q3c0BgcsnUPRV9rulZ2SbzSdZiJpL5y4euvzpFCeJqOyVvuwTbVO7_M.png,Мерлин,"['драма', 'фэнтези', 'приключения', 'семейный']","Сериал «Мерлин» рассказывает свой вариант истории знакомства знаменитого волшебника с принцем Артуром. Во времена правления великого Утера Пендрагона существование всех драконов было поставлено под угрозу. Одержимый идеей уничтожения и истребления всех и всего, что имеет отношение к миру магии и волшебства, Пендрагон оставил в живых только одного дракона. Именно он и поведал юному волшебнику Мерлину о его истинном предназначении и о необходимости сокрытия его личности даже от принца Артура. Несмотря на конфликтную ситуацию при которой произошло знакомство будущего короля и Мерлина, самой судьбой ему было предначертано стать его оруженосцем и лучшим другом. Придворный врач Гаюус приходится незадачливому волшебнику дядей, поэтому покрывает его, как только может. Мерлин понимает, чтобы исполнить свое предназначение — помочь принцу Артуру объединить земли туманного Альбиона — он должен остаться в живых. Так начинается становление неопытного волшебника в самого известного и сильного мага в истории человечества.","['2008', '—', '2012']",7.5,"['Джон Херт, Колин Морган, Брэдли Джеймс, Ричард Уилсон, Энджел Колби, Кэти МакГрат, Энтони Хэд, Оуэн Мэкен, Сантьяго Кабрера, Руперт Янг, Эмилия Фокс, Джозеф Демпси', 'Великобритания', '12 +']"
247,https://kino.mail.ru/series_802473_luchshe_zvonite_solu/,https://resizer.mail.ru/p/37aa6b41-b2ff-51f7-b1fe-9dd6ff7a6efd/AQACFRJidmjVRXnEQckfJy3BsC6MvLxN1KDmisINd7Fc2Tn9o4QFWCk1X4WmsFYk6ete7OTEyeiYPgW7uvNqEvPjCG8.jpg,Лучше звоните Солу,"['драма', 'комедия', 'криминал']","Сериал посвящен проныре Солу Гудману, адвокату Уолтера Уайта и некоторых его коллег и друзей. Знакомство с законником произошло во втором сезоне сериала «Во все тяжкие» в эпизоде с таким же, как у спин-оффа, названием. «Лучше звоните Солу» рассказывает о том, как жил и работал Гудман до знакомства с главными героями головного шоу.","['2015', '—', '2022']",7.9,"['Боб Оденкерк, Джонатан Бэнкс, Ри Сихорн, Патрик Фабиан, Майкл МакКин, Майкл Мэндо, Джанкарло Эспозито, Керри Кондон, Марк Марголис, Тони Далтон, Кара Пифко, Джереми Битсуи, Деннис Буцикарис, Рекс Линн, Джош Фэйдем, Джулиан Бонфильё', 'США', '18 +']"
248,https://kino.mail.ru/series_790264_turetskii_gambit/,https://resizer.mail.ru/p/6ae66095-8d7e-5cc9-a04a-ec26049209b7/AAACotO2uvcyKWCfwpsXKLoISyzt_5iQ_DClktI3zB7L-L-up85eCeiPhy5u3yPkLHGvsf8xzQR7BtmY-PeSawP30SQ.jpg,Турецкий гамбит (телеверсия),"['боевик', 'триллер', 'приключения', 'детектив', 'военный']","1877 год, русско-турецкая война. Принимавший участие в военных действиях в качестве сербского волонтера титулярный советник Эраст Фандорин пробирается в главный штаб русского командования с важным секретным сообщением. Но в штабе находится предатель, опасный и коварный враг, проникший с заданием погубить русскую армию. 
Сериал снят по мотивам исторического романа Бориса Акунина.","['2006', '(Сериал', 'закончился)']",7.8,"['Егор Бероев, Ольга Красько, Александр Балуев, Александр Лыков, Виктор Вержбицкий, Гоша Куценко, Владимир Ильин, Даниэль Ольбрыхский, Алексей Гуськов, Дидье Бьенэмэ', 'Россия, Болгария', '12 +']"
249,https://kino.mail.ru/series_825711_diversanti/,https://resizer.mail.ru/p/78f279ca-c4c6-522e-bc27-906e29e50a43/AAACnstJ1fFGOTB8f9jegqCPqmjSwz0X9nToU1lEA0cz0XUML24kBAQp9NGJmeQ904Db1_x_lNCxvBAIes2z9mRpCfc.jpg,Диверсанты,"['драма', 'документальный', 'военный']","Диверсанты — это разведчики, выполнявшие конкретные и реальные задания в тылу противника. Зрители узнают о судьбах этих героев и об исторических обстоятельствах, которые сопутствуют действию сериала. В этом проекте с помощью кадров уникальной кинохроники реконструированы события ушедшей эпохи. Довоенные биографии героев, подготовка разведчиков, приготовление и разработка операций, перемещения диверсионных групп, а также необходимые справочные пояснения ко всем событиям, — обо всем этом говорится в документальном сериале «Диверсанты».","['2012', '(Сериал', 'закончился)']",8.0,"['Россия', '16 +', '2012 год (РФ)']"
